https://www.youtube.com/user/BigGameMuskyFishing/about,Dane LaJoy Outdoors,7637,2783446,I am a film maker that captures my fishing and hunting experiences. I am almost always working on new hunting or fishing projects and if not I at least have future projects or trips planned. My channel is all about Fishing and Hunting. I fish everything from giant sharks to Musky Walleye Bass Trout Perch Lakers Whitefish etc. I also hunt everything from Waterfowl Turkey Grouse Rabbit and Deer very soon. I am not sponsored nor Pro I'm just a full blown outdoorsman who has a passion for the two sports and just doing what I love and filming it. My goal is to capture some awesome experiences and make them into some great films. Please Subscribe to my channel!   Follow me on Instagram: @danelajoy,null,http://instagram.com/danelajoy,https://plus.google.com/117145083258152747394,
https://www.youtube.com/user/brunobra12/about,Bran Duke,35,4055,Whattup dogs! Do you like cute goofy skits with pets in them? Are you a hardcore gaming fanatic? Maybe you're just looking for something on YouTube that's a little... different? Well welcome to the world of Bran Duke my friends here we try to offer it all!  Main Series - Bran is the king of canines the prince of puppies and the duke of dogs. However upon receiving a new dog of his own Bran's status will be thrown for a loop. As he struggles for dominance against the beast known as Duke promptly named after his own title Bran will soon discover that sometimes ruling with an iron fist is not always the best solution. Take a step into the funtastic life of Bran Duke & friends!  Gaming - Coming Soon!  News - Where to catch up on new videos channel unboxings and the life of Bran Duke.  Be sure to like subscribe even hit up our official website while your at it!  No matter what you do though just don't forget... always... Unleash Your Beast!!!,null,http://branduke.weebly.com/,https://www.facebook.com/brandon.bruno.1656,https://www.instagram.com/bran_duke/,https://soundcloud.com/branduke,http://www.jma.duq.edu/users/brunon2/pub/jma260/Client/index.htm,http://massachusettsbaycolony.weebly.com/,https://plus.google.com/110019322364710661963,
https://www.youtube.com/user/AFVofficial/about,America's Funniest Home Videos,541652,341333589,Welcome to the OFFICIAL "America's Funniest Home Videos" channel on YouTube!  AFV is America's longest running funny video television program. We've been collecting funny viral videos since 1989. Here you’ll find funny videos viral videos prank videos funny animal videos funny baby videos classic videos and the best compilations and music montages of some of the funniest videos you've ever seen. Check out our different sections to find some of the best viral funny videos around. Comment share and subscribe to stay in touch to see funny videos you just can't find anywhere else!,null,http://www.afv.com/upload/,https://www.facebook.com/AFV,https://twitter.com/afvofficial,https://instagram.com/afvofficial,http://vine.co/americasfunniest,https://plus.google.com/116140796232268401888,
https://www.youtube.com/user/Misinman/about,MANOACTION UNIVO,222,166275,null,null,
https://www.youtube.com/user/TeamRPI/about,RPI Equipped,3184,1545766,RPI Equipped! is Western Canada's leading supplier of Aftermarket products for European auto enthusiasts.,null,https://plus.google.com/114238624346243930550,
https://www.youtube.com/user/midtowngrid/about,midtowngrid.com videos,55,92982,null,null,
https://www.youtube.com/user/ASBBank/about,ASB,4476,7379123,ASB’s official YouTube channel. We don't respond to comments posted here but you can stay connected with us through Facebook and Twitter or on our website asb.co.nz.,null,https://www.asb.co.nz/?utm_source=youtube&utm_medium=aboutpage&utm_content=visitourwebsite&utm_campaign=youtube,http://twitter.com/asbbank,http://facebook.com/asbbank,http://www.instagram.com/asbbank/,http://www.linkedin.com/company/asb-bank,https://www.asb.co.nz/intro/?utm_source=youtube&utm_medium=aboutpage&utm_campaign=youtube,https://www.asb.co.nz/?utm_source=youtube&utm_medium=aboutpage&utm_content=onlinebanking&utm_campaign=youtube,https://apps.facebook.com/asbvirtualbranch/?utm_source=youtube&utm_medium=aboutpage&utm_campaign=youtube,https://blog.asb.co.nz/?utm_source=youtube&utm_medium=aboutpage&utm_campaign=youtube,https://plus.google.com/112000357075275622853,
https://www.youtube.com/user/infojgi/about,Jain University,469,139012,Jain University is a cerebral destination that draws inspired students from more than 25 countries to one of the world's greatest cities- Bangalore.   A deemed-to-be-university since six years it is now ranked consistently among top universities in India by India Today Nielsen Best Universities Survey. Founded in 1990 as SBMJC by Dr. Chenraj Roychand an eminent entrepreneur & educationist with over 35 years of experience it has the vision to foster human development through excellence in quality education research & entrepreneurial development.,null,http://www.jainuniversity.ac.in,
https://www.youtube.com/user/pioneerpublic/about,pioneerpublic,1832,923569,Pioneer Public Television is a regional public television network in Minnesota primarily serving the southwest and west-central portions of the state Minnesota northwestern Iowa eastern South Dakota southwestern North Dakota and beyond.  For more than 45 years Pioneer Public TV has served its rural audience through a mix of local and national programs rich in cultural heritage diversity and educational opportunities.   Pioneer Public Television is based in Appleton Minnesota.  Pioneer Public TV's broadcasts began in February of 1966 doing business as West Central Minnesota Educational Television Company providing programming and services to every citizen of our coverage area.  For more information go to www.pioneer.org.,null,http://www.pioneer.org,http://www.facebook.com/pioneerpublictv,http://www.pioneer.org/membership,http://www.pioneerkids.org,http://video.pioneer.org,http://www.pioneer.org/yourlegislators,http://www.pioneer.org/postcards,http://www.pioneer.org/prairiesportsman,http://www.pioneer.org/pyg,https://plus.google.com/116529492566975212099,
https://www.youtube.com/user/newfvt/about,newfvt,6,5554,null,null,https://plus.google.com/115394801888172656726,
https://www.youtube.com/user/BrightGreenThumb/about,BrightGreenThumb,7550,2408049,This channel is dedicated to gardening both indoor and outdoor in the Great Northwest. We have a strong focus on providing detailed and accurate tests of both organic and non organic nutrients. The tests we perform are completely unbiased and our done under exact environmental conditions. We hope this information provides fellow gardeners with valuable information to grow better fruits and vegetables.,null,https://plus.google.com/108205462678020608650,
https://www.youtube.com/user/drummergreg16/about,Greg Nelson,8,3321,null,null,https://plus.google.com/105640363937151464061,
https://www.youtube.com/user/TawzerDog/about,Tawzer Dog,5742,692433,Preview Channel,null,http://www.tawzerdog.com/,https://www.facebook.com/TawzerDog,https://twitter.com/TawzerDog,https://plus.google.com/103258680916735204253,
https://www.youtube.com/user/ReutersVideo/about,Reuters,218148,183140098,Reuters tells the world's stories like no one else. As the largest international multimedia news provider Reuters provides coverage around the globe and across topics including business financial national and international news. For over 160 years Reuters has maintained its reputation for speed accuracy and impact while providing exclusives incisive commentary and forward-looking analysis.,null,http://reuters.com,https://www.facebook.com/Reuters,https://twitter.com/Reuters,http://reuters.tumblr.com/,https://www.youtube.com/channel/UChqUTb7kYRX8-EiaN3XFrSQ?sub_confirmation=1,https://plus.google.com/117651204433077625812,
https://www.youtube.com/user/RyanLewisProductions/about,Ryan Lewis,4783079,2239237724,www.Macklemore.com   This Unruly Mess I've Made 2.26.2016,null,http://macklemore.com,https://plus.google.com/114314719715995788431,
https://www.youtube.com/user/casjsa/about,Cas Allan,1,760,null,null,
https://www.youtube.com/user/EmisiuniRomaniaTV/about,Best Videos,1173,506049,null,null,https://plus.google.com/105138766890175670202,
https://www.youtube.com/user/Okiimiru/about,Erica Lyons,418,315744,Videos of my fish and chinchillas.,null,https://plus.google.com/105385005800912625813,
https://www.youtube.com/user/lusypurukan/about,Lusy Purukan,441,303026,Hai! Subscribe and mmmuaaachhh..,null,https://plus.google.com/114207126736381248018,
https://www.youtube.com/user/babyteeth4/about,babyteeth4,1442093,1109908158,Kid Candy Reviews every Thursday Time For Toys every Tuesday every Friday is Kawaii Day!  Mini-movies animation and more featuring sisters Jillian and Adelaide!  Subscribe today!  Babyteeth4 features sisters Jillian and Addie age 11 and 9 in the number one candy review show in the world!  They are also well-known for their series of hilariously epic misadventures such as "Too Many Addies" and "Fast Cars Bad Kids".    Produced by their father their sweetly comic videos have entertained millions viewers around the world since 2008.  Jillian and Addie Babyteeth4 have appeared on TV news and talk shows the front page of a major newspaper and a large market radio station.    Order Babyteeth4 T-Shirts and More at: http://babyteeth4.spreadshirt.com/  Fan Mail:  PO Box 190  Braddock PA 15104   DO NOT SEND CANDY.  Unsolicited candy will be disposed of unopened!  For business inquiries (samples adverts media etc.) see below.,null,http://babyteeth4.spreadshirt.com/customize/noCache/1,https://twitter.com/babyteeth4,https://www.facebook.com/babyteeth4,https://www.instagram.com/babyteeth4,http://babyteeth4.blogspot.com/,https://plus.google.com/105863236067891331927,
https://www.youtube.com/user/OneMindDogs/about,OneMindDogs,2721,215217,OneMind Dogs is a dog and agility training methodology based on dogs' natural behaviour. When you understand your dog's point of view you will make more clean runs.  Learn to communicate non-verbal cues correctly all dogs around the world understand the message. Any dog from anywhere in the world will instantly understand OneMind Dogs. For them it simply makes sense.,null,http://www.oneminddogs.com,https://facebook.com/OneMindDogs,https://twitter.com/OneMindDogs,http://pinterest.com/oneminddogs,http://instagram.com/oneminddogs,https://plus.google.com/105584668305077356925,
https://www.youtube.com/user/silvertrit/about,Central Voices,46,140663,Mostly a collection of local Oregon info,null,
https://www.youtube.com/user/ABNDigital/about,CNBCAfrica,28374,12458795,ABNDigital.com - ABN 360's online platform offers a portal where users can access breaking up-to-the-minute business news and stories from across Africa. On the website one can browse through video clips of in-studio interviews crossings to market commentators throughout Africa as well as packaged business features from Cape Town to Nairobi Johannesburg to Lagos and Abuja to Windhoek - all in an effort to create an online environment that allows Africans access to their own financial news and information. As the African continent begins taking centre stage in the expansion plans akin to those of developed nations ABN 360 - through ABN Digital and all its other properties is ready to shine a spotlight on the world's fastest-growing continent.,null,http://www.cnbcafrica.com,https://www.facebook.com/Cnbcafrica,https://twitter.com/cnbcafrica,https://plus.google.com/103970018894299522507,
https://www.youtube.com/user/edgarmcsteelpotco/about,Tanner Braungardt,2694851,484437473,A 16 year old YouTuber from Kansas that started out making videos of trampoline tricks cliff jumping bridge jumping teaching my friends and mom how to do backflips and now it's evolved into all kinds of crazy and sometimes weird vlogs and videos including bathtubs full of random stuff fanmail openings challenges with my siblings and friends and so much more. Subscribe to follow me on this crazy journey! :)  Instagram: @TannerBraungardt Snapchat: Tanner_B24 Twitter: @Braungardtanner,null,http://instagram.com/tannerbraungardt,https://twitter.com/braungardtanner,https://www.facebook.com/tannerbraungardt/,https://snapchat.com/add/tanner_b24,http://braungardtbiz@gmail.com,https://plus.google.com/107083867649971539095,
https://www.youtube.com/user/dogsportapps/about,dogsportapps,26,92345,null,null,
https://www.youtube.com/user/FJWestcottCo/about,F.J. Westcott,42058,3945509,Founded in 1899 the F.J. Westcott Co. is a leading innovator photography and filmmaking lighting solutions. Westcott is dedicated to delivering top-quality gear for all styles and skill levels. Teaming up with top industry pros Westcott University is a prolific source for hands-on learning and inspiration offering live shootout events seminars tutorials and social media resources.,null,http://www.fjwestcott.com,http://www.westcottu.com,https://www.facebook.com/pages/Westcott/142212785920,https://www.twitter.com/westcottco,https://www.instagram.com/westcottlighting,https://plus.google.com/101773463713285766393,
https://www.youtube.com/user/FalconryYearbook/about,FalconryYearbook,145,139396,Hunts & Stories from the World of Falconry,null,http://falconryyearbook.com,https://plus.google.com/106783425039640090100,
https://www.youtube.com/user/bdchrehoming/about,Battersea Rehoming,124,232802,Meet our current residents at Battersea Dogs & Cats Home.   We have been been rescuing reuniting and rehoming dogs and cats since 1860. We aim to never to turn away a dog or cat in need of our help and every year we rehome or reunite over 8000 dogs and cats with their owners. We also work in the community to educate people about responsible ownership.,null,http://www.facebook.com/battersea,http://www.twitter.com/bdch,http://www.battersea.org.uk,https://plus.google.com/106879433634979295607,
https://www.youtube.com/user/YourDogVideos/about,YourDogVideos,957,463123,Learn about different dog breeds dog breeders and people who love dogs. Watch people who train dogs show dogs in competitions and people who breed puppies. Videos feature puppies dog training techniques pedigree dog shows and pedigree dog competitions.,null,http://MyWorldofDogs.com,
https://www.youtube.com/user/jaymoge/about,NH treasurehunter,2381,457366,My channel is mostly metal detecting and tinkering/modifying/repairing  of metal detectors pinpointers and hand make/modified metal detecting gear. My "Wicked Diggers" are shown here as is my "wicked shovel" and the Jay Mo Pro Plus from beginning to completion. I've come to realize my calling in this hobby is to fix and modify and not so much about finding really old coins and priceless artifacts.... Well that's how it seems so far stay tuned and as always SWING BEEP DIG.,null,https://plus.google.com/107460824040261965981,
https://www.youtube.com/user/boneratorful/about,boneratorful,62,31910,AAAAAAAAAAAAAA AAAAA A A A A A  Gay!,null,https://plus.google.com/108057376433804891187,
https://www.youtube.com/user/ssaya28/about,Saira Sayani,4,486,null,null,https://plus.google.com/118369535144148627400,
https://www.youtube.com/user/ITNExtreme/about,This Is Genius,165584,64318259,Hello I'm Sam. I make this is Genius. If you like techscience facts and news but you don't like it being all serious and full of long words this is the place for you.  On Monday we have our inventively named Monday Show; A satirical look at the week in news as well as your comments. Throughout the week we have breaking news from the world of science. And on Friday we have a top five. Which features amazing things. Five of them. Sometimes people let me do cool things too so I make videos about that. And sometimes I make sketches from old black and white footage.  We're part of a channel network that also includes Truthloader: www.youtube.com/Truthloader  Truthloader looks deeper into stories questioning the mainstream narrative and providing context to the news to bring you alternative views and opinions.  And Game On: www.youtube.com/gameon  If you want daily gaming news and exclusive game previews/reviews you're in the right place!,null,http://www.twitter.com/Samdattapaulin,http://www.twitter.com/thisisgenius,https://plus.google.com/108166881155744604030,
https://www.youtube.com/user/thewinerydogs/about,The Winery Dogs,49505,7892862,The Winery Dogs are: Richie Kotzen (guitar/vocals) Billy Sheehan (bass/vocals)  Mike Portnoy (drums/vocals),null,http://www.facebook.com/TheWineryDogs,http://twitter.com/TheWineryDogs,https://plus.google.com/117991215114800234559,
https://www.youtube.com/user/sillennium/about,sillennium,2659,2453295,Look for new great guitar pedal and amp demos coming.  Always something unusual to pull out and demo for everyone!,null,http://www.facebook.com/The.Flo.Guitar.Enthusiasts,https://plus.google.com/101285675647842739440,
https://www.youtube.com/user/22alexbest/about,Александр Инкогнито,10,5334,null,null,https://plus.google.com/114129325345092260133,
https://www.youtube.com/user/Iliketamovitmovit/about,Steve Dunn,10,10380,null,null,https://plus.google.com/103968750542187685819,
https://www.youtube.com/user/WildFilmsIndia/about,WildFilmsIndia,296220,331565203,As the world's largest production house and tourism content archive of factual HD video from South Asia you can make us part of your production plans in India/South Asia. We deliver the widest range of production gear location and support services.  We can open doors that no one else can - creative aesthetic bureaucratic and most importantly - those in the mind! And yes while some of us have a weakness for wildlife wilderness and the outdoors we do produce programming on just about every subject under the sun.  The largest global collection of HD internet and television content on South Asia is now online as a part of Wilderness Films India's 'A Visual mapping of the Indian Subcontinent' initiative which has taken a team of 60 people over 25 years to put together and we're doubling up our efforts going forward in order to archive in High Definition every aspect of the South Asian experience! We have 70 000+ clips & films and plan to attain 1 million by 2017.,null,http://www.wildfilmsindia.com,http://www.facebook.com/WildernessFilmsIndiaLimited,https://twitter.com/wildfilmsindia,https://www.youtube.com/channel/UCqYeFVBl8ERzMLD-s-xXP8Q,https://plus.google.com/107594784537388740750,
https://www.youtube.com/user/purinaproclub/about,Purina Pro Club,138,14014,Purina Pro Club is dedicated to responsible dog breeders handlers and enthusiasts. Backed by Purina's focus on pet health and wellness through science-driven nutrition we support and enrich our community by providing relevant news research and information.  See our community guidelines: http://www.purina.com/terms-and-conditions,null,https://purinaproclub.com/,https://www.facebook.com/PurinaProPlanforProfessionals,http://www.purina.com/terms-and-conditions,
https://www.youtube.com/user/TAFishing/about,TAFishing,124315,29264074,TAFishing is run by father and son Graeme & Mike Pullen. We provide weekly HD fishing videos packed full of tips to help the average angler catch more fish.  We specialise in all-round fishing. Covering Saltwater Freshwater Fly Bait and Lure Fishing. Main episodes air on Friday evenings at 7pm GMT. Fishing Vlogs in the week.   Download our FREE Bi-Monthly Digital Fishing Magazine to your smart device: http://www.awesomeangler.co.uk/  Bonus content + Monthly Q&A Videos: https://www.patreon.com/totallyawesomefishing?ty=h  Our Clothing Range: http://totallyawesomefishing.spreadshirt.co.uk/,null,http://www.awesomeangler.co.uk,https://instagram.com/tafishingofficial/,https://www.facebook.com/totallyawesomefishing,https://twitter.com/tafishing,http://totallyawesomefishing.spreadshirt.co.uk/,http://www.totallyawesomefishing.com,https://plus.google.com/114596479219283792263,
https://www.youtube.com/user/allisonmaslan/about,Allison Maslan,1453,138644,Allison Maslan  CEO of Allison Maslan International A Global Business Mentoring Company named “One of the Top Women Entrepreneurs Who Inspire” by Self Made Magazine. No. 1 Best Selling Author of Blast Off! Allison’s built ten successful companies starting out at age 19. Her client list has included Ben & Jerry’s Supercuts Merrill Lynch and Charlotte Russe although her passion is mentoring small business owners to grow a high revenue business and a passionate life. She’s been featured in Success Magazine and ABC CBS NBC CNN and Fox across the US. Allison’s recipe for greatness is one of creativity strategy resilience and never taking ‘no’ for an answer. She sees entrepreneurship as the best pathway to impact the local and global economy and transform lives.  She is the Executive Producer and host of the popular online television show Allie & You The Business Success and Lifestyle Show and featured in the new documentary Inspired by 11. www.AllisonMaslan.com,null,https://www.facebook.com/allisonsfans,https://twitter.com/AllisonMaslan,https://www.linkedin.com/profile/view?id=24143814,https://plus.google.com/104198615912589225516,
https://www.youtube.com/user/DreamhackMedia/about,DreamHack,165713,41284266,ABOUT DREAMHACK DreamHack is the world's largest computer festival. DreamHack's core and origin is the LAN party with the two major festivals DreamHack Summer in June and DreamHack Winter in November. The events are a platform for eSport knowledge and creative competitions music acts lectures by game developers Internet & game culture cosplay the fair DreamExpo and much much more. DreamHack is also a production company with a focus on gaming esports music and arena productions for both traditional TV and the Internet.  During 2014 DreamHack had 104000 visitors to its events and more than 15 million unique viewers who followed the live broadcast online. More information is available on www.dreamhack.se & http://www.dreamhack.se/dhs15/about/,null,http://www.dreamhack.com/,http://instagram.com/dreamhack,https://www.facebook.com/Dreamhackfestival,http://twitter.com/DreamHack,http://tickets.dreamhack.com/?utm_source=youtube&utm_medium=cpc&utm_campaign=yt_linkclick,https://plus.google.com/104492843369787446645,
https://www.youtube.com/user/CanineArtConnections/about,CanineArtConnections's channel,63,206065,null,null,http://canineartconnections.com,
https://www.youtube.com/user/QualityCottages/about,Quality Cottages,77,50770,Videos featuring Wales. If you  would like to watch what Wales has to offer subscribe to the Quality Cottages Channel. We regularly upload insightful videos packed full of great scenic images from across Wales. We feature interviews with unmissable characters and 'how to' videos which will leave you full of ideas for an enriching trip to Wales. Ready to book a holiday cottage in Wales? Our Quality Cottages area by area videos show you all the welsh holiday cottage styles we can offer.  A true family business with over 50 years experience promoting Wales we feel sure these videos will help you choose the best country cottage or coastal cottage for your Welsh holiday. www.qualitycottages.co.uk     reserve@qualitycottages.co.uk.     (+44) 01348 837871.,reserve@qualitycottages.co.uk,http://www.qualitycottages.co.uk,http://www.facebook.com/qualitycottageswales,http://www.pinterest.com/qualitycottages,http://www.twitter.com/qualitycottages,https://plus.google.com/105445264857579697898,
https://www.youtube.com/user/QueenslandDogs/about,QueenslandDogs,180,65084,This is the official channel for Dogs Queensland,null,https://plus.google.com/109680760250714357240,
https://www.youtube.com/user/vice/about,VICE,7886036,1351669080,The Definitive Guide To Enlightening Information. From every corner of the planet our immersive caustic ground-breaking and often bizarre stories have changed the way people think about culture crime art parties fashion protest the internet and other subjects that don't even have names yet. Browse the growing library and discover corners of the world you never knew existed. Welcome to VICE.,null,https://www.vice.com,https://www.facebook.com/VICE,http://twitter.com/vice,https://instagram.com/vice/?utm_source=viceyoutube&utm_campaign=ytbanner,https://video.vice.com/en_us/channel/vice,https://www.facebook.com/vicevideos?utm_source=viceyoutube&utm_campaign=ytbanner,http://store.vice.com/?utm_source=viceyoutube&utm_campaign=ytbanner,https://itunes.apple.com/us/podcast/vice-meets/id634513189?mt=2,https://pinterest.com/vicemag?utm_source=viceyoutube&utm_campaign=ytbanner,https://confirmsubscription.com/h/i/48178908AA2FD075,http://vicemag.tumblr.com/?utm_source=viceyoutube&utm_campaign=ytbanner,https://itunes.apple.com/us/app/vice.com/id591496838?,https://play.google.com/store/apps/details?id=com.vice.viceforandroid&hl=en,https://plus.google.com/105444907895487096711,
