https://www.youtube.com/user/PilatesHomeExercises/about,Pilates Home Exercises,35,4838,Pilates Home Exercises is your source for online bodycare and Pilates workouts that can be done wherever your "home" (your body) goes.Weather your are at home in the office or in transit you will always be able to improve your health and wellness prevent injury and illness and optimize your fitness. Weather on the mat in a chair on a  swiss ball or foam roller with exercises bands or light weights weather you want to improve your balance and stability increase mobility strengthen the core or stretch and release with Pilates Home Exercises you you have the resources you need to help you along the way.    "YOUR BODY IS THE MOST IMPORTANT HOME THAT YOU HAVE" - Tara Wilson: Kinesiologist (BCAK) Exercises Physiologist (CSEP - CEP) and Pilates Instructor  ***The numbered  videos are suggestions to watch in a progressive order while learning.,null,https://plus.google.com/105229572837056971316,
https://www.youtube.com/user/larperte/about,Yeung Jason,15,55624,null,null,https://plus.google.com/103539590925208438546,
https://www.youtube.com/user/sistianatube/about,Sistiana,106802,11403799,SISTIANA:  Vlog lifestyle preferiti del mese chiacchiere fiabe video musicali e molto altro (incluso il mio cane Moki).  Iscrivetevi per entrare nel mio mondo online e seguitemi sul Blog e sugli altri social che trovate qui sotto!,null,http://facebook.com/sistiana,http://instagram.com/sistiana,http://twitter.com/sistiana,https://play.google.com/store/music/artist/Sistiana?id=Abla5hmqbuboauhzg3z3kbepprq,http://www.ilblogdisistiana.com,https://plus.google.com/105957817470545234019,
https://www.youtube.com/user/NBCNews/about,NBC News,456013,177643935,The official NBC News YouTube Channel is a leading source of global news and information. Here you will find clips from NBC Nightly News Meet The Press and our original series Debunker Flashback Nerdwatch and Show Me. Subscribe to our channel for news stories technology politics health entertainment science business and exclusive NBC investigations.   Subscribe to NBC News for the latest video: http://nbcnews.to/SubscribeToNBC,null,http://NBCNews.com,http://twitter.com/nbcnews,http://facebook.com/nbcnews,http://nbcnews.tumblr.com,http://www.nbcnews.com/news/video,http://pinterest.com/nbcnews,http://instagram.com/nbcnews,http://www.flickr.com/photos/nbc_news,https://plus.google.com/114810779645279671611,
https://www.youtube.com/user/WSJDigitalNetwork/about,Wall Street Journal,518830,326887775,The new WSJ Video takes you inside carefully selected stories and events in a visually captivating way so you can dig deeper into the news that matters to you. You’ll get breaking headlines immersive features interactive media and even virtual reality reporting whether on the go in the boardroom or at home.,null,http://wsj.com/video,https://twitter.com/WSJ,https://www.facebook.com/wsj,
https://www.youtube.com/user/LolaEliz/about,LOLA TEIGLAND,96,32283,Woofie & Bear Think They're Human. They love to watch TV.,null,http://lola-dog.com,https://www.facebook.com/rescuesROCK,http://www.thelolapage.com/,https://plus.google.com/113096572075273446822,
https://www.youtube.com/user/TheInfluencerTV/about,The Influencer TV,284,18594,The Influencer TV is an online television featuring the cutest and the hottest digital stars in Singapore.  The online television focuses on social media related content lifestyle pop-culture and youth related entertainment.   Check out www.TheInfluencerTV.com  Email TheInfluencerTV@gmail.com for business enquiries.,null,https://www.facebook.com/TheInfluencerTV,http://instagram.com/Theinfluencernetwork,https://plus.google.com/101293809444754317680,
https://www.youtube.com/user/255sage/about,Linda's Pantry,101771,14610525,/My channel is dedicated to sharing my passion for cooking canninggardening food preservation solar oven cooking and family.My hope is to inspire you to step outside the box you might be in and try something new.,null,http://pinterest.com/,http://www.facebook.com/pages/Lindas-Pantry/391852060878680?ref=tn_tnmn,http://instagram.com/lindaspantry,https://plus.google.com/100245337187687524781,
https://www.youtube.com/user/mbusa/about,Mercedes-Benz USA,173923,67865273,Welcome to the Mercedes-Benz USA YouTube channel -- your official source for Mercedes-Benz USA video content including television commercials behind-the-scenes footage owner tips and tricks and event exclusives.  We are excited to offer this channel as a destination where MBUSA enthusiasts can search discover and share videos. To maintain a positive online experience for the entire community including our valued customers we reserve the right to delete any comments that may be deemed offensive or inappropriate.  Click "Subscribe" to be notified when we upload a new video. For more exclusive content and news visit our social channels:,null,http://www.mbusa.com,https://www.facebook.com/mercedesbenzusa,https://twitter.com/MBUSA,http://instagram.com/mbusa,https://plus.google.com/110992313421112148128,
https://www.youtube.com/user/levantatetelemundo/about,Un Nuevo Día,255613,105518217,El Programa mañanero que te trae lo último de los famosos y la actualidad de la noticias. Lunes a viernes - 7am/6c.,null,http://msnlatino.telemundo.com/shows/Un_Nuevo_Dia,https://www.facebook.com/UnNuevoDia,https://twitter.com/UnNuevoDia,https://plus.google.com/118307247136944236551,
https://www.youtube.com/user/CharlezMalasana/about,Charlez Malasaña,24,3086,Photographer living on the road in a van with his pup,null,https://plus.google.com/111865001692397430126,
https://www.youtube.com/user/ThePowerOfExperts/about,Experticity,205,39108,Experticity brings together the world's largest community of influential product experts to connect them with forward-thinking brands retailers and consumers to improve sales and customer experiences through the power of experts.,null,https://www.experticity.com,https://www.twitter.com/experticity,https://www.facebook.com/experticity,https://www.instagram.com/experticity,https://plus.google.com/105923471094806429040,
https://www.youtube.com/user/ThePurinaNetwork/about,Purina,8228,7480186,At Purina we believe pets and people are better together. Here you'll find inspirational videos about the power of the bond between pets and people deep looks into pet nutrition and behind-the-scenes glimpses at our company.   See our community guidelines: http://www.purina.com/terms-and-conditions,null,http://www.purina.com,https://www.facebook.com/purina,https://twitter.com/Purina,https://www.pinterest.com/purina/,http://www.purina.com/terms-and-conditions,
https://www.youtube.com/user/xingcat/about,xingcat,3032,787808,Puppets! Cooking! Long Hair! Comedy! What do all of these things have in common? Not much unless you're on my channel. We do comedy skits make easy recipes talk about long hair (hairstyles hair care etc.) and just have a ton of fun.   Tuesdays I talk about long hair. Growing it maintaining it and my experience with the process. If you're on a long hair journey or want some information about how to grow style or maintain long hair then this is a good place to start.  Thursdays I make 3 Ingredient Recipes! Cooking doesn't have to be difficult...it can be as simple as putting together 3 ingredients and a little bit of time. I'm always joined by a co-host who brings his or her special brand of wisdom and enthusiasm to the process.   Saturday or Sunday George the Self Esteem Cat shows up to talk about Self-Esteem. George and DOG have many adventures always learning the vital lesson of "Be like cat. Be good to self."  We have puppets and comedy and lots of great things!,null,http://twitter.com/xingcat,https://www.facebook.com/sullivanspaniel/,https://www.instagram.com/xingcat/,https://plus.google.com/102091109129147206051,
https://www.youtube.com/user/THEINFLUENCERS1/about,BRAND CREATIVES,17,2128,WE ARE CREATIVE PROFESSIONALS IN THE BUSINESS PREVIOUSLY KNOWN AS ADVERTISING & MARKETING.  We bring the strategic conceptual and executional craftsmanship it takes to make brands famous no matter the media platform. We connect brands with people in innovative ways.,null,http://the-influencers.tumblr.com/,http://www.facebook.com/pages/The-Influencers/292742790831094,http://WWW.THEINFLUENCERS.NET,https://vimeo.com/home/myvideos,https://plus.google.com/113160703248214373602,
https://www.youtube.com/user/tashapolis/about,Tashapolis,106739,6500736,Natasha or Tashapolis (like Metropolis) Christian BookTuber loves to read stalk the internet and fangirl over my favorite movie and TV shows! Plus I'm obsessed with beauty.,null,http://instagram.com/tashapolis,https://twitter.com/Tashapolis,https://www.cratejoy.com/collection/tashapolis/?clickid=WZEVQAWysRngXJEUhdR9ZRgZUkhxINU%3AI1rjxc0&utm_medium=AFF&utm_source=IR&utm_basket=Tashapolis&utm_carton=ONLINE_TRACKING_LINK&utm_egg=Online+Tracking+Link&irgwc=1,https://www.facebook.com/Tashapolis,http://www.goodreads.com/user/show/19208239-natasha-polis,http://www.redbubble.com/people/tashapolis/portfolio?asc=u,https://plus.google.com/100260998572200379966,
https://www.youtube.com/user/JoshRimer/about,JoshRimer,31840,10119895,I'm Josh Rimer and I create YouTube videos for the LGBT community (and our allies) to enjoy and have a laugh at! Most of my viewers are Canadian and American gay men but my goal is to entertain anyone who comes across my content & make them laugh so if that sounds good to you please watch & subscribe!  I upload 2 to 3 times a week:  "The Sassy Scoop" is on Wednesdays & Fridays with either a viral video review or a top 10 list. Then on most weekends I upload a "Sassy Sunday" vlog with my travels my boyfriend my friends or my family. My reviews and top tens are also seen across Canada on OUTtv a national TV station!  I'm one of only 15 Team TELUS Advocates in Canada and one of the 10 top rated broadcasters on PocketLIVE. My phone internet & TV services are all provided by TELUS and I exclusively live stream at PocketLIVE.tv (weekdays at 5pm PST).  I'm what's often referred to as an influencer and blogger (located in Vancouver BC) and I'm also interested in tech health & fitness!,null,http://www.JoshRimer.com,http://www.facebook.com/JoshRimerPage,http://www.twitter.com/JoshRimer,http://www.instagram.com/JoshRimer,http://www.pocketlive.tv/live/joshrimer.html,https://plus.google.com/101975488678368693092,
https://www.youtube.com/user/ClimateKelpie/about,ClimateKelpie,18,8148,null,null,http://www.climatekelpie.com.au,
https://www.youtube.com/user/meganblake/about,Megan Blake,148,54551,Welcome to Our World - The Super Smiley Adventures of our Pet Family - World Travels Super Smiley Flash Mob  4 Pet Adoption  Talking Dog Talking Horse Pet Tips Traveling Cat Red Carpets Coaching EventsRescue & The Pet Lifestyle Coach (TM).  All from Smiley's Tout Suite's Angel's Starfire's & MiniHaHa's personal world and perspective.,null,http://www.SmileyTheDog.com,http://www.SmileyTheDog.com,https://plus.google.com/115290195721132306089,
https://www.youtube.com/user/PuppyInTraining/about,PuppyInTraining,1579,259595,Are you looking to learn how to train a puppy like a service dog?  Hi my name is Colby and here on our Puppy In Training YouTube Channel we do our best to produce high quality puppy training videos including our hit series Puppy In Training TV.  Follow me and my 4 dogs: Linus Stetson Archer and Raven as we show you the life of a Service Dog Puppy In Training puppy training tips dog toy and product reviews crate training and all kinds of interesting information on how to train a puppy.  Thanks for stopping by! Colby,null,https://PuppyInTraining.com,https://plus.google.com/116567661317682929975,
https://www.youtube.com/user/Fishdizzzzle/about,Bret Fish,157,400618,null,null,http://www.snapchat.com/add/flopppyfish,http://www.instagram.com/bretfish,http://www.twitter.com/fishdizzle,https://www.facebook.com/FishBret/,http://www.bret.fish,https://plus.google.com/106584123991031791994,
https://www.youtube.com/user/AmyShojai/about,Amy Shojai,225,146112,Pet Info-Tainment! All about cats and dogs care behavior and training. You'll also find writer-icity tips on publishing and lots of BLING!,null,http://amyshojai.com,http://www.facebook.com/amyshojai.cabc,http://www.twitter.com/amyshojai,https://plus.google.com/+AmyShojai/posts,http://www.pinterest.com/amyshojai,http://www.shojai.com,http://petliferadio.com/petpeeves.html,http://cats.about.com/od/healthconcerns/u/felinehealthandbehavior.htm#s7,https://plus.google.com/u/1/+AmyShojai-CABC/posts,https://plus.google.com/118385379745407466598,
https://www.youtube.com/user/pthoburn/about,Patrick Thoburn,null,90,null,null,
https://www.youtube.com/user/influicity/about,Influicity,68,9663,Influicity connects brands with influencers to showcase their product tell the brand story and drive sales. The company's marketplace enables brands to search select and purchase influencers/audiences with scale and simplicity.,null,http://www.influicity.com,http://www.twitter.com/influicity,http://www.linkedin.com/company/influicity,https://plus.google.com/112900181989712379909,
https://www.youtube.com/user/williefab/about,Hanala Sagal,209135,207004454,I'm Hanala Hollywood Writer Actress Producer Speaker Artist Activist Singer Sober Alcoholic Dog Lady. My super power is Bouncing Back. Subscribe for INSPIRING VIDEOS showbiz news fitness  tips & cute dogs. I co-wrote "Elvis & Nixon" (on Amazon Prime.) Follow me!   https://www.linkedin.com/in/hanalasagal/ https://instagram.com/hanalasagal/     https://twitter.com/hanalasagal https://www.facebook.com/HanalaS     https://www.youtube.com/user/williefab  www.hanala.com,null,http://www.hanala.com,http://goo.gl/1pXoSt,http://www.linkedin.com/in/hanalasagal/,https://twitter.com/hanalasagal,https://instagram.com/hanalasagal/,https://plus.google.com/113402440857890954039,
https://www.youtube.com/user/socialbusinessengine/about,Social Business Engine,287,12396,Host Bernie Borges brings you inspiring stories from professionals succeeding on their social business journey. Bernie showcases businesses around the world. What they all have in common is a willingness to share how they use the culture and technology of social to achieve measurable business outcomes. The Social Business Engine show is also a podcast available on iTunes Google Play and Stitcher. Sign up to be a member here: www.socialbusinessengine.com,null,http://www.thesocialbusinessengine.com,http://www.twitter.com/sbengine,https://www.facebook.com/socialbusinessengine/,http://instagram.com/sbengine/,https://plus.google.com/101190789017882172612,
https://www.youtube.com/user/ccaplan1/about,Christine Caplan,11,1349,My Life With Dogs (PDX) is a blog about health and wellness (with an emphasis on alternative techniques) enrichment ideas for dogs and outdoor tales.  I live with three hounds in the Pacific Northwest – two Doxies and a Beagle/Basset Hound mix.  As a Certified Veterinary Technician I use my knowledge to inform stories on health and wellness topics. I’m not practicing but continuing my education through workshops is a high priority. Readers can expect product reviews updates on my senior dog and how living with a reactive dog changed my life.  As the founder of My Life with Dogs PDX I also contribute to animal related publications including Spot Magazine. I’m a PR practitioner as well and create content for a number of animal related brands.,null,
https://www.youtube.com/user/thecarmelvalleylife/about,The Carmel Valley Life,310,185349,The Carmel Valley Life is a community inspired organization & publication comprised of local leaders who work together to create a greater sense of community connection & contribution.,null,http://www.TheCarmelValleyLife.com,https://www.facebook.com/TheCarmelValleyLife,https://twitter.com/CVSDLife,http://www.flickr.com/photos/thecarmelvalleylife/,https://www.instagram.com/thecarmelvalleylife,https://plus.google.com/107370936247338079456,
https://www.youtube.com/user/jodywowinc/about,JODY SMITH THESUPERTRAINER,1574,905750,Jody “The Super Trainer” Smith To motivate train and educate others is what you get from Jody Smith aka “The Super Trainer.” Jody Smith is a certified trainer with certifications for First Aid/CPR NCSF and NSCA. The Super Trainer has been training for over 15 years residing in Atlanta Ga. In 2000 Jody Smith’s Super Trainer workout was voted #1  for having the MOST INTENSIVE PROGRAM FOR PRODUCING THE BEST AND QUICKEST RESULTS. CONTACT:6782076607 How To Get A Small Waist With One Effective Exercise How To Get A Small Waist Small Waist Small Waist With One Effective Exercise One Effective Exercise Effective Exercise A Small Waist With One fitness blender exercise hiit toning health work out workout abs tone weight loss home workout exercises pilates full length workout videos workout videos free workout vide  Summer’s almost here and it’s not too late to get in shape.  Find Thesupertrainer at: Facebook: http://www.facebook.com/people/Jody-Smith/1416155952,null,http://www.instagram.com/thesupertrainer,http://www.facebook.com/profile.php?id=1416155952,http://www.twitter.com/thesupertrainer,http://www.pinterest.com/thesupertrainer,https://plus.google.com/111595769070608242157,
https://www.youtube.com/user/simplysweethome1/about,Jerri Birdwell,11,4969,null,null,https://plus.google.com/106330927777031348313,
https://www.youtube.com/user/IvanOberon/about,Ivan Oberon,61,2632,Ivan Oberon. Real Estate Investing. Motivation. Mindset. Entrepreneurship.,null,http://steadfastcapital.net,https://www.facebook.com/uberivan,http://instagram.com/ivanoberon,https://twitter.com/IvanOberon,http://ivanoberon.com,http://ivanoberon.brandyourself.com/,https://plus.google.com/114723430074293502945,
https://www.youtube.com/user/UmbyThePhoenix/about,UmbyThePhoenix,26852,37715571,Salve a tutti benvenuti al mio canale! Qui farò let's play ma non let's play tradizionali (sul tubo c'è ne sono troppi). I miei a differenza degli altri non mireranno a mostrare come completare il gioco prendendo il 100% o robe simili ma mireranno a far divertire lo spettatore. Solitamente faccio giochi moderni per Ps4 Ps3 Wii U 3ds o psvita. Serie in corso: - Moto Gp 14 Carriera PS4 - Oddworld: New'n'Tasty! PS4 - One Piece Unlimited World Red PS3 - Pacman e le avventure mostruose PS3 - The Last Of Us Remastered HD PS4,null,http://www.spreaker.com/page#!/user/playerunited220,https://plus.google.com/102514245252196837521,
https://www.youtube.com/user/alistsummit/about,alistdaily,842,275277,About alistdaily  alistdaily is focused on Frontline Marketing which harnesses the power of hearing understanding and acting upon the evolving desires of consumers. We’re all about informing inspiring and featuring the most vital members of the global marketing community.    alist summit  [a]list summit was founded in 2008 by Ayzenberg Group as a forum for exchanging ideas among video game industry luminaries and thought leaders. Now an annual invite-only event [a]list summit covers forward-looking trends relevant to advertising and marketing in entertainment video games and youth lifestyle products. For more information on recent and upcoming summits please visit www.alistsummit.com.,null,http://www.alistdaily.com,https://www.facebook.com/alistdaily,https://twitter.com/alistdaily,instagram.com/alistdaily,http://www.ayzenberg.com,http://www.alistsummit.com,http://alistdaily.tumblr.com/,https://www.linkedin.com/company/-a-listdaily,https://plus.google.com/112607474883228248736,
https://www.youtube.com/user/usacomputertec/about,Daily Unboxing Videos & Reviews,3936,2082994,To have your product featured or reviewed please send it to:  Justin-Breithaupt PO Box 483 Pomeroy WA [99347]  http://www.justuselinux.com  http://www.mindblowingidea.com/ProductReviews.html  My Blog: https://justinsproductreviews.blogspot.com/ http://www.mindblowingidea.com/JustinsEpicReviews.html  LEGAL NOTICE TO YOUTUBE FACEBOOK AND ALL VIEWERS: The creator’s intent is to inform or entertain (not offend or shock). Incorporated by reference as though being stated fully herein https://youtu.be/GMVGHpNGBBM NOTICE TO THE PRINCIPLE IS NOTICE TO THE AGENT NOTICE TO ANY AGENT IS NOTICE TO THE PRINCIPLE. ERRORS AND OMISSIONS ARE CONSISTENT WITH INTENT. ALL RIGHTS RESERVED AND NONE WAIVED. International Slavery laws and treaties say that I must be compensated for any work done. My videos must be Monetized.  Some audio used in my videos comes from http://www.teknoaxe.com with permission to use their content in commercial and non-commercial videos.,null,https://www.patreon.com/user?u=2970455,https://www.facebook.com/justinsproductreviews/posts/,https://twitter.com/justins_reviews,https://plus.google.com/103199214966277214893/posts,http://usacomputertec.tumblr.com/,http://sourceforge.net/projects/ultumix/,https://www.minds.com/JustUseLinux,http://www.worldtruth.mx/justuselinux/,https://www.instagram.com/usacomputertec/,http://www.mindblowingidea.com/ProductReviews.html,http://www.MindBlowingIdea.com,https://justinsproductreviews.blogspot.com/,http://www.JustUseLinux.com,https://mewe.com/i/justin.breithaupt,https://plus.google.com/107524743918351185438,
https://www.youtube.com/user/ActualDannyGonzalez/about,Danny Gonzalez,88221,3475157,I'm Danny! I make comedy sketches music videos and popular youtube trend parody videos!,null,http://instagram.com/dannygonzalez,http://twitter.com/dannygonzalez,https://plus.google.com/102976840257037470726,
https://www.youtube.com/user/steph91069/about,FUN HOUSE TV,84786,15910625,This is Fun House TV! It's the toy channel where we dig discover and make a mess and find really cool stuff! There is also cool contests and other random giveaways but mainly it's just fun! And we also think everyone is SUPER COOL!   Contact: Stephhunter910@gmail.com  Fan Mail Goes here: Fun House TV PO Box 516 Roseland NJ 07068,tephhunter910@gmail.com,http://www.watchfunhousetv.com,https://www.instagram.com/funhousetv/,https://twitter.com/WatchFunHouseTV,https://plus.google.com/114357469670324668352,
https://www.youtube.com/user/dianamadison/about,Diana Madison,22933,7469336,Hi I'm Diana Madison. I am a style enthusiast Hollywood insider and new mom! Follow me on my journey as I keep you updated with vlogs and style videos as well as beauty and hair tutorials. I bring you all the latest style and beauty trends and give you full access to the biggest icons in the industry!  Diana Madison host of HollyscoopTV is a Hollywood insider. You can find her everywhere from the red carpets of Award shows and premieres to the hottest celebrity parties in Miami New York and LA. Now she has her own web show! Watch as Diana gets "The Lowdown" from the hottest Hollywood celebs musicians and fashionistas everyday at www.youtube.com/dianamadison   Subscribe Now!  Visit her website: http://dianamadison.com/ Follow her on Twitter and Instagram: @dianamadison Like her on Facebook: https://www.facebook.com/dianamadison,everyday at www.youtube.com,http://dianamadison.com/,https://twitter.com/dianamadison,https://instagram.com/dianamadison,https://www.facebook.com/dianamadisontv,https://plus.google.com/113163751036119634829,
https://www.youtube.com/user/steiff1001/about,Floppycats,21254,8651614,This is the official YouTube Channel for Floppycats.com - Uniting Ragdoll Cat Lovers Worldwide Since 2008. Most of our videos are of cat product reviews that we're doing or something else fun we're doing!  Please feel free to stick around subscribe and comment!  We love our cat lover community and are always looking to grow it.  For business inquiries please email:  info@floppycats.com,info@floppycats.com,http://www.floppycats.com,https://www.facebook.com/floppycats,http://twitter.com/floppycats,http://pinterest.com/floppycats/,http://www.flickr.com/photos/floppycats,https://instagram.com/thefloppycats/,http://www.floppycats.com/category/giveaways,http://www.floppycats.com/ragdoll-of-the-week.html,http://youtu.be/QjZ4vAUQsTM,http://youtu.be/QDi4nPDM2YM,https://www.youtube.com/steiff1001/?sub_confirmation=1,http://www.amazon.com/gp/product/B004VMODK6/ref=as_li_ss_tl?ie=UTF8&camp=1789&creative=390957&creativeASIN=B004VMODK6&linkCode=as2&tag=floppycatscom-20,http://feedburner.google.com/fb/a/mailverify?uri=floppycats/mheS&loc=en_US,http://forms.aweber.com/form/95/115826795.htm,https://plus.google.com/100797224406736388062,
https://www.youtube.com/user/rulesforrebels/about,Rules For Rebels,55423,3794707,Self Emlpoyed Entrepreneur and Side Hustler talks about Entrepreneurship eCommerce starting businesses and making money online via various hustles and endeavours.,null,https://plus.google.com/103961477911069916527,
https://www.youtube.com/user/NatashaNuttall/about,NatashaNuttall,1581,84636,Hi I'm Tasha; a creative blogger Graphic Designer & internet lover living in London UK. I'm uploading about my experiences as a designer/ design student life in London vlogs and other creative bits & bobs :) Come say Hi!  Other places you can find me...  BLOG www.graphiquefantastique.com  TWITTER https://twitter.com/natashanuttall  INSTAGRAM http://instagram.com/natasha_nuttall  PINTEREST http://www.pinterest.com/natashanuttall  PODCAST https://soundcloud.com/designed-in-london,null,http://www.graphiquefantastique.com,https://twitter.com/natashanuttall,http://instagram.com/natasha_nuttall,http://www.pinterest.com/natashanuttall/,https://soundcloud.com/designed-in-london,https://plus.google.com/115901346067617090370,
