https://www.youtube.com/user/WSJDigitalNetwork/about,Wall Street Journal,518818,326887775,The new WSJ Video takes you inside carefully selected stories and events in a visually captivating way so you can dig deeper into the news that matters to you. You’ll get breaking headlines immersive features interactive media and even virtual reality reporting whether on the go in the boardroom or at home.,null,http://wsj.com/video,https://twitter.com/WSJ,https://www.facebook.com/wsj,
https://www.youtube.com/user/petnapethr/about,Pet na pet,1435,1539097,null,null,https://plus.google.com/115390712227118273814,
https://www.youtube.com/user/ZeroMediaHD/about,Zero Media,639453,814030668,Zero Media is the place to see all the latest and greatest movie trailers clips and more.,null,https://www.facebook.com/ZeroMediaTrailers/,http://www.twitter.com/ZeroMediaHD,https://www.youtube.com/subscription_center?add_user=ZeroMediaHD,https://plus.google.com/104278701592154569171,
https://www.youtube.com/user/networkworld/about,Network World,19464,26449418,Network World TV presents the best of our gadget technology news and enterprise networking videos. More videos at www.networkworld.tv. Network World is an IDG Enterprise brand.,videos at www.networkworld.tv,http://www.networkworld.com,https://www.facebook.com/NetworkWorld?fref=ts,https://twitter.com/networkworld,http://networkworld.tumblr.com/,https://plus.google.com/117913231786707889081,
https://www.youtube.com/user/DespicableMeMovie/about,Illumination,800531,578094551,Connect with Illumination Entertainment Online:  Like Illumination Entertainment on FACEBOOK:  http://bit.ly/IlluminationEntFB Visit the Illumination Entertainment WEBSITE:  http://www.minionsmovie.com,null,http://www.singmovie.com,https://www.facebook.com/singmovie,https://twitter.com/singmovie,http://instagram.com/singmovie,https://plus.google.com/110677721563930903522,
https://www.youtube.com/user/TechRadar/about,TechRadar,313042,104765089,The latest technology news and reviews covering computing home entertainment systems gadgets and more.,null,http://www.techradar.com/,http://www.facebook.com/TechRadar,https://twitter.com/#!/techradar,http://www.myfavouritemagazines.co.uk/tech-gadgets/?ns_campaign=youtube&ns_mchannel=extl&ns_source=future-channels&ns_linkname=0&ns_fee=0,http://www.myfavouritemagazines.co.uk/ipad-magazines/?ns_campaign=youtube&ns_mchannel=extl&ns_source=future-channels&ns_linkname=0&ns_fee=0,http://www.myfavouritemagazines.co.uk/apps/?ns_campaign=youtube&ns_mchannel=extl&ns_source=future-channels&ns_linkname=0&ns_fee=0,http://goo.gl/lIQDTD,https://plus.google.com/107370746384487549943,
https://www.youtube.com/user/damrong999/about,damrong999,7207,400818,null,null,https://plus.google.com/114854022940006451681,
https://www.youtube.com/user/lucas/about,Lucas,2553171,221966772,Hiiiiiiiiiii. Welcome to my channel where I post fun stuff at least once a week! *Business Inquiries: lucascbusiness@gmail.com,lucascbusiness@gmail.com,http://instagram.com/lucascruikshank,https://www.youtube.com/channel/UC8LclMTXz4IgsxBEFk1F4tg,https://www.facebook.com/LucasACruikshank,http://twitter.com/lucascruikshank,https://plus.google.com/101265461721912615299,
https://www.youtube.com/user/GabeHelmy/about,Gabe Helmy,513152,49451465,Ummmm....,null,http://www.youtube.com/channel/UC3X4cyb8r4i_DrpgpoabsYQ?sub_confirmation=1,https://twitter.com/GabeHelmy,http://instagram.com/gabehelmy,https://plus.google.com/107122436930001606242,
https://www.youtube.com/user/JoshPalerLin/about,JoshPalerLin,2493863,353492739,Hey welcome to my channel where you will see lost of funny Pranks Social Experiment Skits DIY and Challenge videos with me and my friends :)  👻 Snapchat: @JoshPalerLin 📸 Instagram: https://instagram.com/JoshPalerLin  📘 Facebook: https://www.facebook.com/JoshPalerLin 🐥 Twitter: https://twitter.com/JoshPalerLin  God helps those who help themselves.  Do not take life too seriously. You will never get out of it alive.  "The people who are crazy enough to think they can change the world are the ones who do." - Steve Jobs  Send me your lovely fan mails here:  PO Box: 1626 N. Wilcox Ave #614 Hollywood CA 90028,null,http://www.youtube.com/c/joshpalerlinvlogs?sub_confirmation=1,https://www.snapchat.com/add/joshpalerlin,https://twitter.com/JoshPalerLin,http://instagram.com/JoshPalerLin,https://www.facebook.com/JoshPalerLin,https://plus.google.com/111495126814092081119,
https://www.youtube.com/user/AppDated/about,techloupe,30826,13741489,Reviews Unboxing & Videos rund um Tech.   Ich zeige euch zu Smartphones Tablets Smartwatches Headsets & allem möglichen Zubehör unterschiedlichste Videos. Angefangen beim Unboxing über Gaming-Test bis hin zu ausführlichen Reviews ist auf meinem Kanal alles dabei.   Hier erfahrt ihr meine ehrliche Meinung zu brandaktuellen Geräten!   Möchtet ihr ein Produkt im Test sehen habt Fragen oder Wünschen dann schreibt sie mir in die Kommentare oder kontaktiert mich über Facebook!   Geschäftliche Anfragen: ch.goerge@techloupe.de,ch.goerge@techloupe.de,http://astore.amazon.de/ausruestung_video-21,https://www.facebook.com/techloupe,https://twitter.com/Techloupe,https://instagram.com/christiangoerge/,https://plus.google.com/101381051073933638049,
https://www.youtube.com/user/JoeyGraceffa/about,Joey Graceffa,7647846,1277199880,Hey! My name is Joey! I vlog every single day! LETS BE NERDS TOGETHER! Pre-order my NEW novel "Children of Eden" NOW!  http://joeygraceffa.com/children-of-eden-book  Business Inquiries: JoeyGraceffa (at) gmail (dot) com & joeygraceffa (at) addition-llc (dot) com,null,http://joeygraceffa.com/children-of-eden-book,http://joeygraceffa.com,https://twitter.com/joeyGraceffa,http://www.facebook.com/JoeyGraceffaFANS,https://www.instagram.com/joeygraceffa/,https://plus.google.com/110190299627841706025,
https://www.youtube.com/user/torontotv/about,torontotv,619,553382,A Toronto Based web-based TV,null,http://www.torontotv.net,https://plus.google.com/100957851064301798204,
https://www.youtube.com/user/WayOnNet/about,WayFengshui,2988,3344117,null,null,https://twitter.com/WayFengshui,https://www.facebook.com/WayFengshui/,http://www.wayfengshui.com/,https://plus.google.com/112354033788355430146,
https://www.youtube.com/user/FilmTrailerZone/about,FilmTrailerZone,564413,648284116,FilmTrailerZone is the #1 destination for all movie fans to catch the latest movie trailers clips featurettes & much more of the latest promotional content from your most anticipated movies!   DEADPOOL 2 TRANSFORMERS: THE LAST KNIGHT PIRATES OF THE CARIBBEAN: DEAD MEN TELL NO TALES GUARDIANS OF THE GALAXY VOL. 2 STAR WARS: THE LAST JEDI JUSTICE LEAGUE SPIDER-MAN: HOMECOMING THOR: RAGNAROK AVENGERS: INFINITY WAR & MORE! We will have it all. So hit that subscribe button take a seat and enjoy!  For content submission trailers promotion & all general inquiries please contact - contact@filmtrailerzone.net,contact@filmtrailerzone.net,https://goo.gl/o12wZ3,https://www.facebook.com/FilmTrailerStation,https://twitter.com/FilmTrailerZone,https://plus.google.com/109168527376058070032,
https://www.youtube.com/user/duncan33303/about,Austin Evans,2203217,324812770,The best of technology from gaming PCs to smartphones and everything in between. Whether it's finding out if that new gadget is worth it discovering the coolest of retro and cutting edge tech or testing the latest smartphone you'll find it all here.   Want to send something for me to take a look at?  Austin Evans 112 Harvard Avenue #49 Claremont CA 91711,null,http://instagram.com/austinnotduncan/,http://twitter.com/austinnotduncan,http://www.facebook.com/austinnotduncan,https://plus.google.com/102957019536750931703,
https://www.youtube.com/user/failarmy/about,FailArmy,12525584,3770795198,FailArmy is the world’s number one source for epic fail videos and hilarious compilations. We’re powered by fan submissions and feedback from all around the world with over 30 million fans across digital platforms.  SUBMIT YOUR VIDEOS http://bit.ly/11-submit-here SUBSCRIBE http://bit.ly/failarmy Check out our other channel FailArmy U! http://bit.ly/SubscribeFU  FACEBOOK http://bit.ly/FailArmyFacebook INSTAGRAM http://bit.ly/FailArmyInstagram TWITTER http://bit.ly/FailArmyTwitter  FailArmy is owned and operated by Jukin Media To license any of the videos shown on FailArmy visit Jukin Media at http://jukinmedia.com/licensing For information regarding business press materials advertising rates or sponsorships please contact: media(at)jukinmedia.com  For inquiries regarding advertising or brand partnerships email advertise@jukinmedia.com,advertise@jukinmedia.com,http://bit.ly/11-submit-here,http://bit.ly/FailArmyAndroid,http://bit.ly/FailArmyiOS,http://bit.ly/FailArmyFacebook,http://bit.ly/SubscribeFU,http://bit.ly/FailArmyTwitter,http://bit.ly/FailArmyInstagram,https://plus.google.com/102667874733681749870,
https://www.youtube.com/user/weretherussos/about,We're the Russos,21415,3508058,We ditched the 9-5 to work for ourselves and travel full time. Currently exploring the U.S. in a camper van.,null,https://weretherussos.com/,https://www.patreon.com/weretherussos,http://facebook.com/weretherussos,https://www.amazon.com/?tag=wtryt-20,https://plus.google.com/107961847709269743549,
https://www.youtube.com/user/origami768/about,Taras Kul,2761990,577597282,Fan Mail or if you want me review your product on my channels: Crazy Russian Hacker P.O. Box 49 Waynesville NC 28786   Simple Science and a lot more!,null,https://www.youtube.com/user/CrazyRussianHacker,https://www.instagram.com/crazyrussianhacker/,https://www.facebook.com/CrazyRussianHacker?ref=hl,https://plus.google.com/106350134417601183699,
https://www.youtube.com/user/BrownDogGadgets/about,Brown Dog Gadgets,2777,632375,What began as a group of weekend builders and teachers coming together to create easy to use projects has now grown into a company with a passion for creating fun and practical educational products and kits.  Founded in 2012 Brown Dog Gadgets now offers educational products and do-it-yourself kits as well as consumer retail products. Equipping everyone from young 3rd grade learners to experienced mountain climbers; Brown Dog Gadgets offers a wide-variety of products tailored around alternative energy.,null,http://www.browndoggadgets.com,https://www.facebook.com/Brown,https://twitter.com/BrownDogGadgets,http://www.instructables.com/member/JoshuaZimmerman/,https://plus.google.com/108461114241102514097,
https://www.youtube.com/user/DavidParody/about,DavidParody,3317902,489661509,SUH SUH G! I make all sort of videos on my channel so if you have some free time check some out and let me know what you think :)  More importantly don't forget to subscribe to my channel to be notified every time I upload a new video.,null,http://bit.ly/DavidParody,http://www.twitter.com/DavidParody/,http://instagram.com/DavidParody,https://plus.google.com/106252795111023591383,
https://www.youtube.com/user/IGNentertainment/about,IGN,8352258,6397315973,The latest game reviews trailers and walkthroughs from the #1 games media company.  As the leading source for gaming news on the net IGN.com brings you the inside scoop on what's hot in the world of videogames and entertainment.  Tune in turn on game out!  This is only a small taste of the videos and content available from IGN. Get more visit http://www.ign.com  Sign up for IGN's weekly top video Email at: http://go.ign.com/VideoRound-up  Interested in a career at IGN? Check us out: http://corp.ign.com/careers,null,http://www.ign.com/,https://twitter.com/ign,http://www.facebook.com/ign,https://www.instagram.com/igndotcom/?hl=en,https://www.shirtpunch.com/ign,http://itunes.apple.com/us/app/ign-video-game-news-reviews/id284819997?mt=8,https://plus.google.com/100801061924982065053,
https://www.youtube.com/user/EliComputerGuyLive/about,Eli the Computer Guy Live,116841,7860026,These are the tales of "Eli the Computer Guy".  See the world through the eyes of a geek as he slogs through what is termed "startup life".  This Vlog is a real time accounting of everything from business networking to infrastructure deployment to billing issues to determining how much Starbucks coffee is safe to drink within a 24 hour period.  As both opportunities and issues arise Eli talks about his thought processes and why he makes the decisions that he does.  Make sure to Check out Eli's main YouTube Channel at http://www.YouTube.com/EliTheComputerGuy And Website at http://www.EliTheComputerGuy.com,null,http://www.elithecomputerguy.com,http://www.twitter.com/elicomputerguy,https://plus.google.com/109953999592475423242,
https://www.youtube.com/user/CooperKing11/about,Cooper & Danielle,1496,90331,A dog & lifestyle related channel with my yellow lab Cooper! Follow him on Instagram! @Cooperking1  Also make sure to check out barkbox.com and use the code COOPERKING for $10 coupon with pawchase!,null,http://www.instagram.com/Cooperking1,http://www.twitter.com/Cooperking11,https://www.facebook.com/DanielleandCooper/?ref=bookmarks,https://plus.google.com/100504789896298633154,
https://www.youtube.com/user/SlappedHamTV/about,Slapped Ham,392919,62065786,Welcome to our top 10 video channel! Top 10 videos lists and facts about everything. NEW LIST VIDEOS EVERY MONDAY AND THURSDAY!  Here's what you'll find on our channel: Top 10 videos lists facts listicles and countdowns.  On our channel you'll see top 10 videos about real photos ghost photos creepy backstories facts animals video games movies and food.  We release new videos each and every week so remember to SUBSCRIBE and enjoy our content!,null,http://slappedham.com/,https://www.twitter.com/SlappedHam,https://www.facebook.com/SlappedHam,https://instagram.com/slappedham/,https://shop.spreadshirt.com/SlappedHam,https://plus.google.com/109047761087253861862,
https://www.youtube.com/user/timholt2009/about,Tim Holt,110,64491,null,null,https://plus.google.com/113003176734942270646,
https://www.youtube.com/user/BenjaminNelson/about,BenjaminNelson,29967,10948772,Electric car and motorcycle conversion videos. Alternative Energy and homebrew DIY can-do videos! http://300mpg.org/,null,http://300mpg.org,https://plus.google.com/102905437348093126912,
https://www.youtube.com/user/thegadgetshow/about,The Gadget Show,108754,28593806,Welcome to the official Gadget Show YouTube channel bringing you the latest tech news tests and reviews.,null,http://www.youtube.com/subscription_center?add_user=thegadgetshow,https://www.facebook.com/thegadgetshow,http://twitter.com/thegadgetshow,http://gadgetshow.channel5.com/,http://www.channel5.com,http://www.youtube.com/show/thegadgetshow,https://plus.google.com/110048186854754812574,
https://www.youtube.com/user/eandtmagazine/about,eandtmagazine,2666,581088,E&T is the IET's award-winning monthly magazine and associated website for professional engineers with a circulation of approximately 150000.  It covers all types of engineering and technology and some science featuring analysis news innovation announcements and job advertisements. The coverage is wide and aimed at professionals in all areas of engineering and technology including the key industry sectors of communications control and automation electronics management IT manufacturing and power.  Its award-winning content is available in print online and on iPad. Members can access the iPad editions free of charge. Single issues or an annual subscription can be purchased by non IET members in Apple's App Store. www.eandtmagazine.com,null,http://www.eandtmagazine.com,https://plus.google.com/103893642178420854857,
https://www.youtube.com/user/2010gameguy/about,Marc Saltzman,1766,2308223,gadgets games & gear oh my!,null,https://plus.google.com/110142321640798030925,
https://www.youtube.com/user/POPSUGARTech/about,POPSUGAR Tech,3754,77262,Feed your technology addiction and indulge your geeky pop-culture side! Get the lowdown on the latest news apps and gadgets; learn tips on everything from taking photos to organizing their lives using technology; and devour geeky movies TV shows and games.,null,https://www.facebook.com/PopSugarTech,https://twitter.com/POPSUGARTech,http://instagram.com/popsugartech,http://www.pinterest.com/POPSUGARTech,https://plus.google.com/113664793331848548508,
https://www.youtube.com/user/UnboxParadise/about,Project Five,9251,1838175,Hello and welcome to Project Five! I post videos showcasing 5 awesome products or inventions you may like. If technology inventions and gadgets interest you then this is where you belong! Be sure to subscribe and I'll see you around!,null,https://twitter.com/ProjectFiveYT,https://plus.google.com/105461364503348739045,
https://www.youtube.com/user/19dragon98/about,Tech HD,164288,36366456,Tech HD is a Youtube channel that showcase the latest: •Inventions •Innovations •New Tech •New Gadgets •Extreme Gadgets •Extreme Machines •Kickstarter Projects If this is your kind of thing SUBSCRIBE to get free update!!  Do You Want Your Product Featured On My CHANNEL? Email: gabriele.gritti.sm@gmail.com,gabriele.gritti.sm@gmail.com,https://www.youtube.com/channel/UCFvPvwa0SwuJ230VYRMA5BQ?sub_confirmation=1,https://plus.google.com/112633051929135051338,
https://www.youtube.com/user/clipsandfootage/about,Clips & Footage,1086,1480676,Clips and Footage is a friendly and independent supplier of high quality archive film. Our award-winning team work hard with clients to fulfil the most challenging of briefs until that perfect piece of footage is found.  All research is free and we can deliver material in all formats under pressing deadlines.  We have over a century of international social and political history music and entertainment war and conflict transport and aviation vintage TV ads and Americana along with one of the world's biggest collections of classic Hollywood feature film trailers production shorts and screen tests.   Just some of the unique elements of our collection include rare colour film of the Spanish Civil War colour home movies of the Royal Family and four separate collections showing lifestyles of the aristocracy from the 1920s to the 1950s including the famous Mountbatten Collection.    We are proud to represent both small independent film collectors of rarities alongside some of the most well-respected film collections in the world.   These include Lobster Films; a goldmine of fantastic  moving images in colour and black and white many of which have been beautifully restored.  As one of the highest quality collections of early cinema up until the 60s Lobster Films incorporates industry and fashion slapstick cartoons and adventure films.   We are also delighted to represent Historic Films with one of the most extensive music performance and entertainment film libraries in the world.  With amazing footage of American lifestyles and pop culture this vast collection includes newsreels  vintage ads educational / industrial films and thousands of hours of superb performance footage covering all genres from vaudeville to punk.    We also represent the high quality Travel Film Archive which contains archival travelogues along with educational and industrial films from around the globe. The films many of them in vibrant colour show the world the way it was between 1900 and 1970.,null,http://www.clipsandfootage.com,https://plus.google.com/109495886506517984235,
https://www.youtube.com/user/DealExtremeDV/about,DealeXtreme DV,29436,22272715,Here have all the official product videos from DealExtreme.com. Update constantly!,null,http://www.youtube.com/dealextremetube,https://www.facebook.com/DealExtremeFans,https://twitter.com/DealExtremeFans,https://plus.google.com/u/0/100544580277880772297/posts,http://instagram.com/dealextremefans,http://dx.com,https://plus.google.com/102994475004180534774,
https://www.youtube.com/user/GreekGadgetGuru/about,G3AR - 'GreekGadgetGuru',490130,49929886,I''m G3AR - "GreekGadgetGuru" and I make weekly videos aimed toward bringing gadgets inspired by super heroes video games and comics to LIFE through the maker mindset. 3D Printing CNC Milling Laser Cutting / Engraving and more!   Do you enjoy REAL LIFE gadgets inspired by your favorite super heroes / game characters? Well you've come to the right place.   You've got an extremely creative mind! Anything is possible. Build it in your mind shape it into reality with your hands. Join me as I do so and lets build something amazing! I hope you'll learn some new building skills along the way.  WARNING: These videos are provided for entertainment and promotional purposes only. It is your responsibility to evaluate the accuracy instructions and advice contained in these videos. No one is liable for any loss or damage caused by your reliance on information contained in these videos. Have fun but always remember to be safe and anything you try is as YOUR OWN RISK!,null,https://www.patreon.com/greekgadgetguru,https://www.facebook.com/GreekGadgetGuru,https://www.instagram.com/greekgadgetguru/,https://www.twitter.com/GreekGadgetguru,https://plus.google.com/102830865759886488620,
https://www.youtube.com/user/TheBytchplz/about,Joshua matthews,103,26838,You want all the latest context or do you just want to enjoy some videos. Check out my Website . www.Toplevelvideos.com,null,https://plus.google.com/114852880187214189755,
https://www.youtube.com/user/rhettandlink2/about,Good Mythical Morning,12311440,3358129703,We are Rhett & Link and this is our daily morning talk show Good Mythical Morning.   Watch our show after the show for more videos every weekday: http://youtube.com/goodmythicalmore  Love the Mythical Crew? Watch new videos from them everyday of the week at: http://youtube.com/thisismythical  Check out our main channel for funny music videos sketches and ridiculous local commercials: http://youtube.com/rhettandlink  Our website has music merch and more: http://www.RhettandLink.com  Snail Mail:  PO Box 6578  Burbank CA 91510,null,http://youtube.com/rhettandlink4,http://twitter.com/rhettandlink,http://facebook.com/rhettandlink,http://instagram.com/rhettandlink,http://rhettandlink.tumblr.com/,http://rhettandlink.com,https://plus.google.com/113825681504586191360,
https://www.youtube.com/user/TheCraftingLab/about,WillyB,100474,18113177,The home of Free Roam gaming videos every single day!,null,http://www.twitter.com/mrwillyjb,http://instagram.com/willbangura,http://www.facebook.com/pages/TheCraftingLab/470593206298393?ref=hl,https://www.g2a.com/r/mrwillyb,https://plus.google.com/105602643629274931144,
https://www.youtube.com/user/RoiWassabiGames/about,Guava Juice 2,2186779,424900371,Welcome to the official Guava Juice 2nd Channel! I put extra random shenanigans in here that you can't find on the regular Guava Juice channel!  Subscribe and join the adventure! Stay Juicy!,null,http://www.twitter.com/guavaroi,http://www.instagram.com/guavaroi,http://www.facebook.com/guavaroi,https://plus.google.com/105326512064626473443,
https://www.youtube.com/user/yanchuga/about,yanchuga,33,60219,null,null,
https://www.youtube.com/user/GuruBrew/about,GuruBrew,51599,13902098,Join your host Steve (electronic & gadget junkie) and the rest of the geeky crew as we document our daily techie adventures where something fun and new is always brewing.  Our show also offers broad topic video advice and lectures from tech professionals who are actually paid to screw things up.  All the information shown here is for entertainment purposes only. We will not be liable for anyone causing harm to theirself or others (person or property) by replicating any of the content displayed here.,null,http://GuruBrewShow.com,http://FaceBook.com/guru.brew,http://Twitter.com/GuruBrewShow,http://youtube.com/gurubrew2,https://plus.google.com/114322041424044344729,
https://www.youtube.com/user/yellowoctopusau/about,Yellow Octopus - Australia's Coolest Gifts & Gadgets,255,221355,Yellow Octopus is a Gifts Gadgets & Toys website. We aim to deliver you great video reviews on most of the products we supply. Please check out www.yellowoctopus.com.au for more information.,null,https://www.yellowoctopus.com.au,https://www.facebook.com/yellowoctopusau,https://www.twitter.com/yellowoctopusau,https://www.pinterest.com/yellowoctopusau,https://plus.google.com/107555946109169722971,
https://www.youtube.com/user/ShowDieShowLeader/about,ShowDieShowLeader,325,152381,null,null,https://plus.google.com/112057957917451795849,
https://www.youtube.com/user/comicbookresources/about,CBR,528400,105140385,CBR takes a mainstream approach to the Geek culture. Here you will find the most entertaining videos about TV Movies Videos Music Gaming Comics and all things 'Geek'. Subscribe to our channel for amazing videos every day! https://goo.gl/wMuSDD  For copyright matters relating to our channel please contact us directly at : david.f@valnetinc.com  For business related matters relating to our channel (including media & advertising) please contact angel@valnetinc.com,david.f@valnetinc.com,http://www.comicbookresources.com/,http://www.twitter.com/cbr,http://www.facebook.com/ComicBookResources/,http://instagram.com/comicbookresources,https://www.youtube.com/channel/UCX77Km4pLRsU9OFYEMdIvew,https://plus.google.com/112980855183233684308,
https://www.youtube.com/user/WatchMojoLifestyle/about,WatchMojoLifestyle,14390,1287698,It's time to live the good life!  Eat drink and be merry with WatchMojoLifestyle.,null,http://www.WatchMojo.com,https://plus.google.com/117218122168071551663,
