https://www.youtube.com/user/JCWhitneyVideos/about,JC Whitney,131,129349,JC Whitney is the largest and oldest catalog and Internet direct-to-consumer auto parts and accessories retailer in America. Since 1915 JC Whitney has been filling the needs of customers like you by providing the right part at the best price. You can always shop with confidence at JCWhitney.com!  We're celebrating 100 years of being a pioneer in the auto parts industry. Come watch our videos to experience our events with auto enthusiasts and partners around the US! You can also browse our uploads for the latest products we carry on our website JCWhitney.com. Thanks for watching!,null,https://www.facebook.com/JCWhitney,https://twitter.com/,https://www.pinterest.com/jcwhitneyfans/,http://instagram.com/teamjcwhitney,https://plus.google.com/112875594473033508540,
https://www.youtube.com/user/BullyDogTech/about,Bully Dog,3058,1750783,Bully Dog is the industry leader in developing full-featured aftermarket enhancements for an unprecedented number of vehicle applications.,null,http://www.bullydog.com,http://www.facebook.com/BullyDogTech,https://twitter.com/bully_dog,http://instagram.com/bullydogtech,https://plus.google.com/108852115229163897516,
https://www.youtube.com/user/LetsUnwind/about,LetsUnwind,5,7804,Informative videos linked to our two seaside holiday rental properties and life on the Sussex coast.,null,http://www.lets-unwind.com,
https://www.youtube.com/user/mailonlineworld/about,MAIL ONLINE WORLD,683,1896689,null,null,https://plus.google.com/106645756451097498347,
https://www.youtube.com/user/ciciliciousnyc/about,ciciliciousnyc,13073,323588,Please visit my new channal at https://www.youtube.com/cicistravelog,null,http://www.foodparadisetv.com,http://www.facebook.com/cicili,http://twitter.com/cicili,https://plus.google.com/100251571303673298819,
https://www.youtube.com/user/WWEFanNation/about,WWE,16110460,15070335731,WWE on YouTube is your number one spot to catch WWE original shows and exclusives!  Watch videos from all of your favorite WWE Superstars backstage fallout from live shows including Raw and SmackDown and original shows such as Top 10 Game Night Superstar Ink and much more!   Subscribe - https://goo.gl/2YO0Is RSS - https://www.youtube.com/feeds/videos.xml?channel_id=UCJ5v_MCY6GNUBTO8-D3XoAg,null,http://www.wwe.com/wwenetwork?utm_source=YouTube%20&utm_medium=YTannotation&utm_campaign=YouTubeAnnotation,https://www.facebook.com/wwe,https://twitter.com/wwe,https://www.instagram.com/wwe/,
https://www.youtube.com/user/BreakThruRadioTV/about,BreakThruRadioTV,6672,6129745,BTRtv streams original videos and premieres new episodes every weekday featuring music news comedy and more.,null,http://btrtoday.tv/,https://plus.google.com/108776901104253371599,
https://www.youtube.com/user/MuseumSecrets/about,Museum Secrets by Kensington Communications,11884,3968257,Museums Secrets is a 22-part 60 minute cross-platform series created by Kensington Communications and narrated by acclaimed Canadian Actor Colm Feore. The TV series ran for 3 seasons from 2010 - 2013.   In every episode Museum Secrets travels to one extraordinary museum revealing the stories of 6 irreplaceable treasures probing familiar legends and assumptions using cutting edge research and technology to investigate the unknown. Museum Secrets combines surprising revelations about things we recognize with amazing revelations about things we've never seen before.  Featured museums include the Louvre the Vatican Museums the Egyptian Museum the Natural History Museum in London the Royal Ontario Museum the State Hermitage Museum the Smithsonian Institution the Chateau of Versailles and the Metropolitan Museum of Art.  The series is broadcast in 50 countries worldwide: History TV Canada; Yesterday/ UKTV; BBC Knowledge (internationally); and Smithsonian Channel in the USA.,null,https://www.facebook.com/museumsecrets,http://pinterest.com/museumsecretstv,http://museumsecrets.tumblr.com/,https://twitter.com/#!/MuseumSecrets,http://www.museumsecrets.tv/,http://blog.museumsecrets.tv/,https://plus.google.com/u/0/106512282068242238435/posts,http://getglue.com/tv_shows/museum_secrets,http://www.kensingtontv.com,http://www.youtube.com/kensingtontv,http://www.imdb.com/title/tt1830154/,https://plus.google.com/115762512206632213533,
https://www.youtube.com/user/easportsbig899/about,easportsbig899,2233,4133658,The biggest - and the best - archive of public information films adverts and incoherent ramblings on YouTube. Indulge yourself in over 1000 videos containing nostalgic scraps from the past. Who knows? You just might learn something.  A new upload every day. Be sure to subscribe to get the latest reviews!,null,http://www.youtube.com/subscription_center?add_user=easportsbig899,https://www.youtube.com/playlist?list=PLtP5h_9SGiVMUA4GX13QWAK140JxtTEwK,https://www.youtube.com/playlist?list=PLtP5h_9SGiVP4f8H_v3VtWiqZY_TP5f4p,https://www.youtube.com/playlist?list=PLtP5h_9SGiVMBIDWZ86eKM-Nr0uVLQOKp,https://www.youtube.com/playlist?list=PL12F1DB0542DEB494,https://plus.google.com/113436076774592646011,
https://www.youtube.com/user/lindsay614/about,Lindsay Sews,126,15620,Sewing and quilting tutorials and craft projects. Lots of DIY fun plus info on my books!,null,
https://www.youtube.com/user/BalancedBodyPilates/about,Balanced Body,19296,6079434,Watch the latest tips exercises and much more. No matter what your Pilates background is you'll find something of interest here.,null,http://www.pilates.com,http://twitter.com/balanced_body,https://www.facebook.com/BalancedBodyInc,http://blog.pilates.com/,https://www.instagram.com/balanced_body/,https://plus.google.com/102253360688466961431,
https://www.youtube.com/user/ht/about,Hindustan Times,45661,35129199,The latest new videos on India World Bollywood Sports Business from Hindustan Times.   Subscribe to our channel: http://read.ht/fLZ  Follow us on Twitter: https://twitter.com/htTweets  Find us on Facebook: https://www.facebook.com/hindustantimes  Check out our website: http://www.hindustantimes.com,null,http://www.hindustantimes.com,https://www.facebook.com/hindustantimes,https://twitter.com/htTweets,https://play.google.com/store/apps/details?id=com.ht.news,https://www.youtube.com/channel/UCm7lHFkt2yB_WzL67aruVBQ?sub_confirmation=1,https://plus.google.com/116553985502903061865,
https://www.youtube.com/user/SavannahsVoice/about,SavannahsVoice,22715,5231306,Whispers Softly Spoken and Sound videos to help you relax and fall asleep :) **Using headphones may help the experience!    Also I'm open to requests and if I like the idea I'll try it out!  Info about my cameras: until video #78: Kodak playsport #79 and after: Sony NEX f3,null,https://www.paypal.com/cgi-bin/webscr?cmd=_donations&business=W8CK5K7BQV76G&lc=US&item_name=SavannahsVoice&currency_code=USD&bn=PP%2dDonationsBF%3abtn_donateCC_LG%2egif%3aNonHosted,https://instagram.com/savannahs_voice,https://savannahland.tumblr.com,https://plus.google.com/111104610475375916068,
https://www.youtube.com/user/oregoniannews/about,The Oregonian,19435,43741084,Oregon's source for breaking news weather entertainment videos and more. The Oregonian/OregonLive is the largest news organization in the Pacific Northwest located in Portland Oregon.  http://www.oregonlive.com/#/0,null,http://www.oregonlive.com,http://www.facebook.com/theoregonian,http://www.twitter.com/oregonian,http://pinterest.com/theoregonian,https://www.instagram.com/theoregonian/,https://vine.co/u/906703400396271616,https://plus.google.com/100617444342863416389,
https://www.youtube.com/user/HallmarkChannelUSA/about,Hallmark Channel,117092,63277279,Welcome to Hallmark Channel's official home on Youtube. Find brand new previews and clips from Hallmark Channel movies highlights from your favorite Hallmark Channel shows and more!  And check out our collection of clips from your favorite Hallmark Channel Christmas movies.   Get more at http://www.hallmarkchannel.com,null,http://www.hallmarkchannel.com,http://www.facebook.com/hallmarkchannel,http://www.twitter.com/hallmarkchannel,http://pinterest.com/hallmarkchannel/,http://hallmarkchannel.tumblr.com,http://tvtag.com/hallmarkchannel,http://hallmarkchanneleverywhere.com,
https://www.youtube.com/user/lockshopvideos/about,Lockshop Wigs,954,31512,www.lockshopwigs.com  Lockshop Wigs is an European based wig company with high quality heat resistant wigs. We aim to bring beautiful and original wigs in special custom made color blends that we put a lot of time in to design!   Our customers range from Japanese fashion enthusiasts to drag queens to people who have lost their hair and even people that just want to change their 'do quickly!,null,http://www.lockshopwigs.com,https://www.facebook.com/Lockshopwigs,https://twitter.com/lockshopwigs,http://instagram.com/lockshopwigs,https://plus.google.com/106123469862516008741,
https://www.youtube.com/user/GoddessOfTomorrow/about,GoddessOfTomorrow,14,8295,null,null,https://plus.google.com/103119756488964253421,
https://www.youtube.com/user/MUSICCITYSHAKEDOWN/about,MUSICCITYSHAKEDOWN,61,31554,Music City Shake Down is a groovy all-ages dance show on Nashville public access channel 19! We produce unique episodes featuring Music City's raddest DJs live bands and best of all dancers like you!    EVERYBODY DANCE NOW! Music City Shake Down is about GETTING down to every kind of music you can shimmy and shake to.  Each episode celebrates a different kinda groove to make you move! From rockabilly to funk to salsa to afrobeat to new wave to punk rock we've got something for every body! The best part about Music City Shake Down is that YOU'RE the star! Come on down to NECAT's studio at Nashville State Community College and dance to our badass DJs and local bands and be on TV! Yeah!  Stay tuned for the date of our tapings! Like our page and tell your friends!  If you would love to help make this happen by volunteering or if there's something you just gotta see on the show email Courtney at cour.azones@gmail.com or Diana at dianalzadlo@gmail.com.,ourtney at cour.azones,https://plus.google.com/100660103878763720305,
https://www.youtube.com/user/JonhyRico/about,Train me please,2638,373679,Free animal training video tutorials with a focus on dog training by animal trainer Jose Miguel Gomes https://www.facebook.com/TrainMePlease,null,https://www.facebook.com/TrainMePlease,https://plus.google.com/105232612491935160056,
https://www.youtube.com/user/journeymanpictures/about,Journeyman Pictures,742596,468680038,Do you want to know more? For over 20 years Journeyman Pictures have independently distributed the world's most provocative incisive factual TV. Working with the top players in the industry our award-winning stories put us at the spearhead of the factual agenda. We're your independent source for the world's most powerful films exploring the burning issues of today. We represent stories from the world's top producers with brand new content coming in all the time. On our channel you'll find outstanding and controversial journalism covering any global subject you can imagine wanting to know about.   Monday to Friday we upload new videos showcasing the best in challenging current affairs journalism from round the world and cutting edge reports examining the very latest in the worlds of technology medicine and the sciences.  And every Thursday we upload release the trailer for our Doc of the Week - a new mind-blowing full length documentary fresh from the cutting room.,null,http://www.journeyman.tv,http://jman.tv,http://www.twitter.com/JourneymanNews,https://www.instagram.com/journeymanpictures/,http://www.facebook.com/profile.php?id=100001019378639,http://youtube.com/JourneymanVod,http://vimeo.com/journeymanpictures,https://itunes.apple.com/us/app/journeyman-pictures/id1040713840?mt=8,https://play.google.com/store/apps/details?id=com.creator.journeymanpictures,https://www.youtube.com/channel/UCZmwjAGiApGHRfng-Pm6czg,https://plus.google.com/100049487616057805318,
https://www.youtube.com/user/ChasingTailOutdoors/about,ChasingTailOutdoors,458,177545,null,null,http://www.chasingtailoutdoors.com,https://plus.google.com/108441012423280687611,
https://www.youtube.com/user/JerseyShoreEvents/about,JerseyShoreEvents,null,86639,null,null,https://plus.google.com/117444619679423739267,
https://www.youtube.com/user/kirstyjbourne/about,Kirsty Bourne,18,29381,null,null,https://plus.google.com/100767612686538517974,
https://www.youtube.com/user/dirttraxtv/about,Dirt Trax Television,86063,26875661,Dirt Trax Television takes a unique slant on the sport of off-road covering the excitement of the vehicles as well as capturing the passion and experiential magnetism of riding ATVs and side-x-sides with amazing coverage of related activities surrounding these vehicles.,null,http://www.dirttraxtv.com,http://www.facebook.com/dirttraxtv,https://instagram.com/dirttraxtv,https://plus.google.com/109993030983375248695,
https://www.youtube.com/user/TheColumbiaChronicle/about,TheColumbiaChronicle,863,1004976,Whether it's reporting on administration issues at Columbia or political gridlock in the city to the latest in music and the best concerts in town The Columbia Chronicle has you covered. Subscribe to us to receive exclusive and visually stimulating multimedia content.,null,http://columbiachronicle.com,https://www.facebook.com/TheColumbiaChronicle,https://twitter.com/CCChronicle,https://plus.google.com/105781539132090312130,
https://www.youtube.com/user/CR250R40/about,CR250R40,2271,2571123,The videos within this Channel show primarily "Big Rigs." I am a big rig aka trucking enthusiast who enjoys capturing footage of Class 8 trucks at work within the city I live.  Tractor-trailer units come in various sizes various axle configurations each truck looks cool and sounds as cool as it looks.   The occasional video features something I accidentally came across in my area feeling some viewers might enjoy viewing it.   All videos on this channel have been filmed by me. (Hence the poor quality!) They are not the most dramatic videos however I do hope they are enjoyable on some level.  Thank you for watching!,null,https://plus.google.com/118237740265195833388,
https://www.youtube.com/user/DambientFilms/about,DambientFilms,10,7541,null,null,http://www.dambient.com,
https://www.youtube.com/user/JazzyTe007/about,Jasmine Rose,77091,5685773,I'm Jasmine and welcome to my little corner of the inter-webs! My channel is your one stop shop for all things beauty & lifestyle related! Here I focus on showing you easy to follow makeup tutorials / how-to’s the latest cruelty-free / vegan makeup and skincare products - perfect for people who have oily / combination skin as well as share my “heat free” natural hair / locs styles tips and tricks. I will also feature some lifestyle bits and bobs in between all while having FUN along the way!  SUBSCRIBE to Jasmine Rose for dope & fresh content weekly.  SnapChat | MsJasmineRose  //FACTS\\ +Haitian-American +NYC +Gemini +Major in Film Production + Political Science +Camera Used: Canon 5d Mark II + T3i +Editing Software: FCPX + Adobe Premiere,null,http://instagram.com/MsJasmineRose,http://www.jazzyrose.com/,https://www.youtube.com/user/JazzyLivin,https://www.facebook.com/MsJasmineRose,https://twitter.com/MsJasmineRose,https://plus.google.com/100952014746099935166,
https://www.youtube.com/user/kingofcoinjock/about,kingofcoinjock,669,757558,Started this account to upload some of the nerdcore music I had downloaded but wasn't available on YouTube.  It has grown a little larger since then and incorporates some local music in my area.  I guess the internet is my local too but you get the idea.  Really appreciate all the comments and likes so glad that the artists I deal with allow me to share their music- it is really all about them.,null,http://quindiastudios.blogspot.com/,http://mistermischievous.blogspot.com/,http://www.facebook.com/kingofcoinjock,http://www.forhelium.net/,http://bashdl.com/,http://mistermischievous.blogspot.com/,https://plus.google.com/112996928269324063579,
https://www.youtube.com/user/FemaleDailyNetwork/about,FemaleDailyNetwork,81465,10546425,Female Daily is Indonesia's biggest online beauty destinations and home to a beauty community with over 230000 members. We are a part of a network of digital destinations specifically catered to women. You can find product reviews makeup tutorial beauty inspirations industry news pro tips and many more on our website. This YouTube channel is home to our beauty videos produced by the talented in-house production team.   Our vibrant community is the heart and soul of Female Daily. The women are savvy intelligent independent and opinionated. If you are interested to meet fellow beauty enthusiasts head to our main website www.femaledaily.com and introduce yourself in our forum: femaledaily.com/forum. See you there! :)  Follow us on Twitter: @femaledaily Follow us on Instagram: @femaledailynetwork Like our Facebook fanpage: Female Daily Network,null,http://www.femaledaily.com,http://forum.femaledaily.com,http://twitter.com/femaledaily,http://instagram.com/femaledailynetwork,http://facebook.com/femaledailynetwork,https://plus.google.com/118267649139868283515,
https://www.youtube.com/user/coupe545/about,coupe545,154,299935,null,null,https://plus.google.com/106064393513369355564,
https://www.youtube.com/user/ongsengs1/about,ongsengs1,1,16812,null,null,https://plus.google.com/110105539996713628715,
https://www.youtube.com/user/zerggon/about,Serge G.,35,144650,null,null,https://plus.google.com/100719400213069192822,
https://www.youtube.com/user/greencat81/about,Bob Brown,1,17463,null,null,https://plus.google.com/107793680906471664903,
https://www.youtube.com/user/IrenaScott/about,WinningVid,15170,88182974,Thank you for looking at our videos. Over 78 million views. One of  Most Viewed (All Time) - Reporters. Also one of most viewed  in Most Viewed  All Channels (Pets & Animals All Time) and in  Partners (Pets & Animals) All time.   Companies filming for the C BBC have used our material and others such as Inside Edition the Discovery Channel National Geographic and the SyFy channel have contacted us about use of or used our material.,null,https://plus.google.com/105468513373530161425,
https://www.youtube.com/user/Holytotemic/about,Holy Totemic,126,377317,The story behind the creator of Totem Soup  ( http://ow.ly/1CImX ),null,http://totemsoup.com,https://plus.google.com/116335733027023420724,
https://www.youtube.com/user/FureyXIII/about,FureyXIII,40,10751,null,null,
https://www.youtube.com/user/Tamlynbs1/about,Tamlynbs1,28,20081,null,null,
https://www.youtube.com/user/swinfordequipment/about,SWINFORD EQ,339,634850,null,null,https://plus.google.com/110906620356505387849,
https://www.youtube.com/user/POPYachtsVideos/about,POP Yachts,4573,8993305,Who ever knew we would get this big?  What do they say about companies who start in garages?  They fail miserably or they become the largest companies in the world.  Like many small businesses POP Yachts started with a dream.  That dream was to become the largest boat and yacht brokerage in the world.  We literally started this business with our eye on being the largest and not settling for anything less.  So how did we do?  Well we're the largest.  We've been the largest for a while now and we keep getting better.  We have 5800 boats for sale in inventory and we sell more than 1500 boats annually.  Who would've thunk a couple of guys could do that in six short years?  What about customer service?  We are consistently rated the #1 boat brokerage in the world.  See for yourself on the independent TrustPilot.com website:  https://www.trustpilot.com/review/popyachts.com  If you're thinking of buying or selling we want to earn your business.  Please call us today.,null,https://www.popyachts.com,https://www.facebook.com/pages/POP-Yachts/105487119542898,https://www.trustpilot.com/review/popyachts.com,https://plus.google.com/100038005271745670169,
https://www.youtube.com/user/whostheross/about,Aaron Ross,339,236640,"WHO'S THE ROSS?" is PDX's Weekly Late-Night Talk Show hosted by actor/comedian Aaron Ross performing live every TUE 9PM at Dante's in downtown Portland Oregon.  Aside from logging almost 700 late-night talk show performances in the past 9 yrs Ross is the host of the "YOU WHO?" rock n roll children's show the star/director of the Pickathon music festival comedy series "Seriously?!" featured an hour-long show at Comedy Central Live in 2012 and has performed at SXSW from 2013-2017.  See his brand-new comedy series TRAINING WHEELS co-starring his co-writer Jordan Paladino here: https://www.youtube.com/channel/UC8oM3TXC2SsK8pCkIfI48KA,null,http://whostheross.com,http://twitter.com/whostherossboss,http://instagram.com/whostheross,http://facebook.com/whostheross,https://plus.google.com/103688481734781035856,
https://www.youtube.com/user/RuptlyTV/about,Ruptly TV,228011,343543550,Ruptly is an international video news agency headquartered in Berlin Germany. Launched in 2012 it is a part of the same media family as the Emmy-nominated global news network RT.  Ruptly is aimed to supply online broadcasters as well as traditional television broadcasters with comprehensive digital video content covering all major issues of our time with an emphasis on stories widely ignored by the mainstream media.  Follow us on all social platforms for the latest news from around the world.,null,https://twitter.com/Ruptly,http://www.facebook.com/Ruptly,https://ruptly.tv/stringer/,http://www.liveleak.com/c/Ruptly,
https://www.youtube.com/user/minuteearth/about,MinuteEarth,1532782,121537889,Science and stories about our awesome planet! Created by Henry Reich with Emily Elert Alex Reich Peter Reich Ever Salazar Kate Yoshida and David Goldenberg. Music by Nathaniel Schroeder. "When we try to pick out anything by itself we find it hitched to everything else in the Universe." ― John Muir,null,https://www.patreon.com/minuteearth,http://facebook.com/minuteearth,http://twitter.com/minuteearth,https://www.facebook.com/ScienceAlert,https://plus.google.com/105646994871970166261,
https://www.youtube.com/user/AnthonyJ350/about,AnthonyJ350,37282,19934992,Go Fast Have Fun provides the content in this YouTube channelAnthonyJ350 for information and entertainment purposes only. The information in this Channel presents guidelines to help vehicle enthusiasts modify or repair their vehicles and to demonstrate what car culture is all about. Go Fast Have Fun make no representations or warranties of any kind express or implied about the completeness accuracy reliability suitability or availability with respect to the Channel or the information products services or related graphics contained on the Channel for any purpose. Any reliance you place on such information is therefore strictly at your own risk. Nothing presented should be relied upon you for your modification or repair plans for your vehicle and is not in any way professional mechanical advice. Go Fast Have Fun strongly recommends you consult with a professional automobile mechanic to ensure that any modification or repair plans for your vehicle are appropriate for your vehicle,null,http://www.gofasthavefun.ca,http://www.facebook.com/pages/AnthonyJ350/349257401834653,https://twitter.com/AnthonyJ350,http://instagram.com/anthonyj350/,http://gofasthavefun.ca/forum/,https://plus.google.com/108704331077045612600,
https://www.youtube.com/user/TAROTZAMM/about,TAROT ZAMM,null,81342,Welcome to TAROT ZAMM's Mystical Junction! It's a good place to connect with kindred spirits and talk about life issues in life finding answers sharing interests about inexplicable phenomena learn the TAROT suggest ways to contribute to taking care of our environment and visit other mystical places of interest.  Experience a mystical adventure when you visit Middle Earth - Wellington! - Discover you past lives and soul's purpose through a past life reading. Find out about your soul mate or twin flame. Get insight and seek guidance about anything that is important to you. A TAROT Reading can also be a fun and entertaining way to know more about oneself or your possibilities!   See what clients say: http://www.tarotreader.co.nz/what-clients-say/,null,http://www.tarotreader.co.nz,http://www.facebook.com/TAROTZAMM,http://pinterest.com/TAROTZAMM/,http://www.flickr.com/photos/tarotzamm/,http://instagram.com/tarotzamm,https://twitter.com/tarotzamm,https://plus.google.com/103213675911510652405,
https://www.youtube.com/user/R16KOREA/about,R16KOREA,31120,7379265,R16 KOREA B-boy popping and locking battles. Dance performance and concert.,null,http://www.r16korea.com,http://www.facebook.com/r16korea,http://www.twitter.com/r16korea,https://plus.google.com/101893833223171248602,
https://www.youtube.com/user/artrito89/about,Arturo Mtz Villa,10,6200,null,null,https://plus.google.com/115802250141342070692,
https://www.youtube.com/user/garbagetrucksrule/about,Garbage Trucks Rule,23411,26011709,Welcome!  Family friendly garbage truck videos for children toy garbage trucks trash trucks and refuse trucks like Bruder Man Tonka Lego and matchbox.  Construction truck videos for children  diggers dump trucks excavators road rollers cranes car carriers backhoes CAT and more.   Garbage truck shirts for kids at http://460328.spreadshirt.com/garbage-trucks-rule-A12623294  "The Little Lost Garbage Truck" short story for kids on Amazon at  http://amzn.com/B00CH2IWFE  I realized that if I made a bunch of videos about garbage trucks my 4 little boys would sit still and watch them for a few minutes! :),null,http://www.pinterest.com/scttyork/garbage-trucks/,http://460328.spreadshirt.com/,http://www.twitter.com/GarbageTrksRule,https://www.facebook.com/garbagetrucksrule/,https://www.instagram.com/garbagetrucksrule/,
