url, title, subs, views, description, email, external links
https://www.youtube.com/user/Rclbeauty101/about,Rclbeauty101,11858331,2147531553,I make different types of videos ranging from DIYs life hacks comedy skits and anything I enjoy making I hope you enjoy it too!  For all business and branding opportunities please email:  info@lennonmgmt.com,info@lennonmgmt.com,http://instagram.com/rclbeauty101,https://twitter.com/#!/rclbeauty101/,https://plus.google.com/107296102112231566564,
https://www.youtube.com/user/EnzoShelby67/about,Freeze Lists,1455544,313513413,TECHNOLOGY  |  INVENTIONS  |  INNOVATIONS  |  MIND-BLOWING CREATIONS  FREEZE HD IS NOW FREEZE LISTS  !!!! We are excited to announce our new name FREEZE LISTS! For 2 and a half years we have brought you the latest in innovation and technology. Initially focusing on crowdfunded innovations we have grown into more than that.  YOU have been with us from our early days and walked with us as we adopted the exciting and free flowing “List” format of videos.  Now we have renewed zeal to bring you even more content covering a wider variety of topics in the fields of technology and innovation among others! And our new name Freeze Lists allows us to fully focus on that. Thank YOU for the journey we have had so far! Together let's get entertained let's get educated and let’s learn new things we never knew existed! NOTE: You can now watch Freeze Lists in Spanish and German in our new channels Freeze Lists ESPAÑOL [https://goo.gl/bM38rd] and Freeze Lists DE [https://goo.gl/IKd6xM]. Enjoy!,null,https://www.youtube.com/channel/UC2d9B6xq08kts8LNaYMx_fw,https://www.facebook.com/Freeze-HD-347866325338115/,https://goo.gl/IKd6xM,https://plus.google.com/105571961129245303109,
https://www.youtube.com/user/CrazyRussianHacker/about,CrazyRussianHacker,9818415,1978542145,Fan Mail or if you want me review your product on my channels: Crazy Russian Hacker P.O. Box 49 Waynesville NC 28786,null,http://instagram.com/crazyrussianhacker,https://www.facebook.com/CrazyRussianHacker,https://plus.google.com/105651555129203736099,
https://www.youtube.com/user/getconnectedtvshow/about,GetConnected TV Show,24952,15908923,GetConnected is the ultimate guide to getting your life and work connected with technology. Each week host Mike Agerbo AJ Vickery and their team of GC correspondents look at what's hot in tech and why.  Watch GetConnected on BNN CHEK TV and distributed worldwide to dozens of countries via Tricon films.   What you can expect to see:  Tech Look - Reviews of everything from tablets to servers  How-To - A close-up look at how things work for you and your business  Interviews - Every week we'll be talking to industry experts and you'll get the inside scoop on the latest tech products and trends,null,http://www.twitter.com/getconnectednow,http://www.facebook.com/GetConnectedMedia,http://www.twitter.com/mikeagerbo,http://www.twitter.com/aj_vickery,http://www.twitter.com/andybaryer,https://plus.google.com/100855263429251349065,
https://www.youtube.com/user/AhernJoey/about,Joey Ahern,191948,16001349,Hai! I'm Joey Ahern. I make dog related comedy videos! If you own a dog or are looking to buy one i'm sure you can relate to my vlogs! I don't always make dog related videos so stay tuned for more!,null,https://www.patreon.com/user?u=3525532,http://instagram.com/joeyahern,http://twitter.com/joeyahern,https://www.facebook.com/Joey-Ahern-428436977308474/,https://www.youtube.com/channel/UCJsaPMqdItmbnovAS4A6Ibw,http://joeyandsteel.spreadshirt.com/,https://plus.google.com/109364637755528021538,
https://www.youtube.com/user/VineCrave/about,The Future Is Now,247282,67797618,The Future Is Now showcases new inventions from the worlds most innovative minds. Keep up to date with the latest gadgets and technological advancements of moderns times.  For centuries our ancestors could only dream of what the future might hold. Ladies and gentlemen the future is now.,null,https://plus.google.com/110548257647119865441,
https://www.youtube.com/user/CCTVAmerica1/about,CGTN America,44068,30498243,CGTN in Washington D.C. is the American arm of the English language China Global Television Network.  CGTN can be seen in North America from 2 to 9pm eastern time on MHZ Network Channel 3 COMCAST Channel 273 FIOS 277 in the greater Washington area; on Time Warner Channel 134 in New York; on Charter Cable Channel 562 in Los Angeles; and nationwide on DISH TV channel 279.  Check local listings in your area for distribution of CGTN.,null,http://america.cgtn.com/,https://www.facebook.com/cgtnamerica/,https://twitter.com/cgtnamerica,http://america.cgtn.com/livenews,http://weibo.com/cgtnamerica,https://plus.google.com/+cgtnamerica,http://america.cgtn.com/category/full-frame,http://america.cgtn.com/category/insight,http://america.cgtn.com/category/world-today,http://america.cgtn.com/category/americas-now,http://america.cgtn.com/category/the-heat,http://america.cgtn.com/category/global-business,https://plus.google.com/110746785298014442822,
https://www.youtube.com/user/shane/about,shane,9550408,2567820386,Send letters to:  3727 W. Magnolia Blvd #712  Burbank CA 91505  *Branding Media & General Business Inquiries:  ShaneDawsonTVBiz@gmail.com  *Film & Television Agent:  UTA,iz@gmail.com,http://itgetsworsebook.com/,http://www.youtube.com/shanedawsontv,http://twitter.com/#!/shanedawson,http://instagram.com/shanedawson,http://www.facebook.com/shanedawsonfans,
https://www.youtube.com/user/sgsethi/about,Futuristic Tuber,221,49892,Welcome to my Channel  ★Watch rate share and Comment on your favorite video. ★Please leave a like if you enjoyed and tell me what you think in the comments!  Thank you for watching! if you enjoyed please subscribe by clicking here https://youtube.com/shazydude Hope to see you soon :) Much love Muhammad Sheraz   Interact with me!  Be sure to turn ON the YouTube notifications so you will always be the first to see my new videos!  ★Like me on Facebook: https://facebook.com/sheraz.sethi ★Follow me on Twitter: https://twitter.com/shazydude ★Follow me on Instagram : https://instagram.com/shazydude ★Follow me on SnapChat : shazydude,null,http://www.youtube.com/c/ShazyDude,https://www.facebook.com/sheraz.sethi,https://www.instagram.com/shazydude/?hl=en,https://plus.google.com/100626142717416205638,
https://www.youtube.com/user/hsntv/about,HSNtv,null,23862791,null,null,http://www.hsn.com/todays-special,http://hsn.com,http://youtube.com/hsn,https://plus.google.com/107649378010589717439,
https://www.youtube.com/user/PlusBelleLaVie2014/about,Viralific,1184,320125,null,null,https://plus.google.com/103380205250155408116,
https://www.youtube.com/user/TheListShowTV/about,The List Show TV,14037,7710896,THE LIST is your go-to destination for the hottest in life hacks pop culture trends deals gadgets and DIY projects that simplify your life.  A national Emmy-award winning show THE LIST delivers everything you need to know about what's trending in the form of a fun list.  If it’s happening it’s on THE LIST.  Watch The List on TV: http://www.thelisttv.com/watch  And Online Anytime: http://www.thelisttv.com/,null,http://www.thelisttv.com/,https://www.facebook.com/thelistshowtv,https://plus.google.com/114407621923085855274,
https://www.youtube.com/user/DadDoesBlog/about,Toy Gadget and Product Reviews by Dad Does,121396,79507864,Grab some popcorn sit back and watch the latest in toys gadgets technology games food sports and more.   We do real world product reviews and toy reviews - this means we test out every single product we review.  No fluff no press releases just real Moms Dads and kids playing with toys and gadgets.  Click the Subscribe button above to stay up to the date on our latest videos.  We tend to get products before they are released so Subscribe to be in the know before the products hit the market.  Got something you want us to review?  Great just leave us a comment and let us know.  Welcome to Dad Does - The place where Dads Do Things and Review Things.  Most of all - Thanks For Watching!,null,http://www.DadDoes.com,http://www.twitter.com/DanDadDoes,http://www.FaceBook.Com/DadDoes,https://plus.google.com/106658814684537050349,
https://www.youtube.com/user/kleybernilson2/about,KLSTWD,183264,35363055,KLSTWD é um canal criado para mostrar vídeos interessante engraçados com intuito de informar e divertir um pouco mais a sua vida.,null,https://plus.google.com/106627974609301026226,
https://www.youtube.com/user/RosannaPansino/about,Rosanna Pansino,8397788,1971134768,Welcome to my channel! I'm Rosanna Pansino and I really enjoy creating content on YouTube!   FOLLOW ME HERE: Facebook: http://www.facebook.com/rosannapansino Twitter: http://www.twitter.com/RosannaPansino Tumblr: http://www.rosannapansino.tumblr.com Instagram: http://instagram.com/rosannapansino Snapchat: rosannapansino  ♥A New Nerdy Nummies every Tuesday!,null,http://www.simonandschusterpublishing.com/nerdynummies/,https://www.facebook.com/rosannapansino,https://twitter.com/rosannapansino,http://instagram.com/rosannapansino/,http://www.youtube.com/subscription_center?add_user=rosannapansino,https://plus.google.com/102198113505577538021,
https://www.youtube.com/user/ezvidinc/about,Ezvid Wiki,194936,108124678,Established in 2011 Ezvid Wiki has grown from a small user-generated forum into the largest and most comprehensive video wiki on the planet providing useful unbiased information and actionable guidance to hundreds of millions of users around the world in thousands of knowledge categories. Browse our detailed guides for free or get started on a video wiki of your own.  Ezvid Inc. also makes Ezvid the best free screen recording and video editing software for windows. You can download that at http://ezvid.com.,null,https://wiki.ezvid.com,https://plus.google.com/107757788850965443217,
https://www.youtube.com/user/MrPeppe05/about,pepp peppineddu,1,279,null,null,
https://www.youtube.com/user/mindseyedesign/about,Minds Eye Design,90742,31274785,Inventions Technology Gadgets Innovation Design and much much more!  ►New Videos Weekly! SUBSCRIBE TODAY!◄   ►OUR WEBSITES & SOCIAL MEDIA◄  http://www.mindseyedesignmedia.com,null,http://www.mindseyedesignmedia.com,https://www.facebook.com/mindseyedesignmedia,https://twitter.com/MindsEyeVideo,https://www.tumblr.com/blog/mindseyedesign,https://www.pinterest.com/MindsEyeVideo/,https://plus.google.com/108061842416862748264,
https://www.youtube.com/user/ThePetCollective/about,The Pet Collective,983351,331070698,The Pet Collective is home to the top trending clips most entertaining memes and funniest animal videos online.  Simply put we think animals are the best ever. If you agree let’s make it YouTube official right here right meow: Subscribe here - http://tpc.tv/1Qd1gdP  We welcome your video submissions for use on our channel! Submit your fun pet videos here: http://bit.ly/32-submit-here  For inquiries regarding advertising or brand partnerships email advertise@jukinmedia.com   The Pet Collective is owned and operated by Jukin Media,advertise@jukinmedia.com,https://submit.thepetcollective.tv/?utm_source=youtube&utm_medium=banner&utm_campaign=submission#submit-video,http://www.facebook.com/thepetcollective,http://pinterest.com/petcollectivetv/,http://www.instagram.com/petcollectivetv,http://thepetcollective.tv,https://plus.google.com/111797746508558281499,
https://www.youtube.com/user/japanesestuffchannel/about,japanesestuffchannel,630774,482376586,Welcome to Weird Japan! Welcome to Japanese Stuff Channel(call me jsc)! This channel is mainly run by jsc and sometimes(very rare) decocookie. Japanese Stuff Channel shows Japanese stuffs like vending machines gacha Cooking Toys Squishies DIY candies and so on. In short I show Japanese kawaiicutecool and weird items.I will upload a video everyday(sometimes a few videos)!   I basically don't show myself and don't speak in my videos so my videos are like ASMR. please subscribe;)  日本のちょっと面白かったり、カワイイものを世界に向けて発信しています。よかったら応援して下さいね＾＾,null,https://www.instagram.com/japanesestuffchannel/,http://japanesestuff.jp/,https://plus.google.com/u/0/108379846934316249225,
https://www.youtube.com/user/SaturdayNightLive/about,Saturday Night Live,4183231,2566697577,Welcome to the official Saturday Night Live channel on YouTube!  Here you will find your favorite sketches behind the scenes clips and web exclusives featuring all your favorite hosts and cast members.  Check out more SNL at http://www.nbc.com/saturday-night-live,null,http://www.nbc.com/saturday-night-live/,https://www.facebook.com/snl,https://twitter.com/nbcsnl,http://instagram.com/nbcsnl,http://www.youtube.com/channel/UCqFzWxSCi39LnW1JKFR3efg?sub_confirmation=1,https://plus.google.com/107922366368044359292,
https://www.youtube.com/user/errolprowse/about,Will Prowse,6935,2721689,Out of desperation due to health problems I moved into a rebuilt van when 19. Have been on the streets for 7 years learning how to live efficiently on the streets of california. I have had 13 different vehicles 2 RV's and a Van. This channel is made to help people who are new to vehicle living.   Topics of this channel: DIY solar vehicle dwellings electric unicycles free food traveling gadgets cameras and so much more!  Check out my website: http://www.vehicledwelling.com,null,http://www.vehicledwelling.com,https://www.amazon.com/dp/B016P7SDZ0,https://www.instagram.com/williamprowse/?hl=en,https://plus.google.com/112438600692757452954,
https://www.youtube.com/user/RulofItalianMaker/about,Rulof Maker,469899,52879603,I recently started translating and film my tutorials in English to share my passions. I am a famous YouTuber in Europe. forgive the mistakes english is not my first language  :) support my ideas on Patreon: https://www.patreon.com/user?u=4910048 For commercial  use the cemmercail Email below,null,https://www.facebook.com/Rulof.Maker.YouTube?ref=hl,https://www.patreon.com/user?u=4910048,https://plus.google.com/103005636844973160225,
https://www.youtube.com/user/ABCNews/about,ABC News,2570651,2686459476,Make ABC News your daily news outlet for breaking national and world news broadcast video coverage and exclusive interviews that will help you stay up to date on the events shaping our world. ABC News’ show roster has both leaders in daily evening and morning programming. Kick start your weekday mornings with news updates from Good Morning America (GMA) and Sundays with This Week with George Stephanopoulos. Get your evening fix with 20/20 Nightline and ABC World News Tonight with David Muir. Head to abc.go.com for programming schedule and more information on ABC News.,null,http://ABCNews.com,http://twitter.com/ABC,http://fb.me/ABCNews,https://www.instagram.com/abcnews/,http://fb.me/WorldNews,http://twitter.com/ABCWorldNews,http://fb.me/ABCWorldNewsNow,http://twitter.com/abcWNN,http://fb.me/ABCNewsNightline,http://twitter.com/Nightline,http://fb.me/GoodMorningAmerica,http://twitter.com/GMA,http://fb.me/ABC2020,http://twitter.com/abc2020,https://plus.google.com/108686021205441482363,
https://www.youtube.com/user/tailsnfails/about,Funny Pet Videos,39545,20065304,Welcome to Funny Pet Videos a channel dedicated to cute fluffy cats and curious rambunctious dogs. We are here to fill your life with more furry and funny things the adorable friends in our lives do. Every Thursday Friday Saturday and Sunday we'll have a new compilation of the funniest home videos of cats dogs birds and all kids of animals being equally hilarious and adorable. Be sure the Subscribe to our channel to never miss one! So sit back relax and have a laugh on us.   For licensing information contact us at licensing@collabcreators.com. We'd love to have your furry friend on our channel!   Have a cute or hilarious video of your pet or a funny animal home video? Click below to submit and check back every week to see if it made it into the compilation.,licensing@collabcreators.com,https://www.youtube.com/user/tailsnfails?sub_confirmation=1,https://docs.google.com/a/collabcreators.com/forms/d/1sR5Y6PyFGOpIMp6-j6XDAH3J07naG4ruRAfXyTOWZRE/viewform?c=0&w=1,https://plus.google.com/101365455537140937475,
https://www.youtube.com/user/topcompilationblog/about,CooL Vines,684490,280919997,Top Vines Compilation,null,https://www.facebook.com/CooLVines1,https://plus.google.com/114836390071473636991,
https://www.youtube.com/user/TimeToPlayMag/about,TTPM Toy Reviews,284675,438489251,TTPM is a family-friendly toy review channel where you’ll find all the videos featured on TTPM.com. TTPM provides comprehensive independent objective reviews of toys by our team of experienced toy reviewers. Plus we help you shop finding the lowest prices and availability at leading retailers with just one click. Our videos and reviews help you make informed decisions about the toys you and your kids are looking for—Hot Wheels Barbie Monster High Ever After High NERF Transformers Play-Doh LEGO Shopkins Tsum Tsum and from all major movies and TV shows from Disney Universal Warner Bros. Nickelodeon Cartoon Network and more. Come play with us and discover all the toys you’ll want when your kids say “play with me!”,null,http://www.ttpm.com,https://www.facebook.com/TTPMofficial,https://twitter.com/ttpm,http://pinterest.com/TTPMofficial,http://instagram.com/TTPMofficial,https://www.snapchat.com/add/ttpmofficial,https://plus.google.com/101831201199518351896,
https://www.youtube.com/user/Rupesh799/about,Rupesh Lanjewar,null,0,null,null,
https://www.youtube.com/user/MobileUnlimited/about,TheUnlockr,402904,69602370,Welcome to TheUnlockr! I’m David and I started a blog back in 2009 as a place to talk about one of my passions: technology.  After always being the person all my friends and family came to for help with their tech (see: resident nerd) and realizing how much I loved helping others learn new things about their technology I started writing tutorials on there and doing videos here on YouTube hoping that it might help others who also needed some guidance.  Subscribe to the YouTube channel! Follow me on social networks and chat! - @theunlockr And consider checking out my shop where I put all the gadgets I personally recommend and find you the best prices for them should you want to get one (which also helps support the channel so win/win!) - https://theunlockr.com/shop)  Thanks for stopping by enjoy!,null,http://www.TheUnlockr.com,https://www.facebook.com/TheUnlockr,https://twitter.com/theunlockr,http://instagram.com/theunlockr,https://www.paypal.com/cgi-bin/webscr?cmd=_s-xclick&hosted_button_id=PTFDNF9ZS8G44,https://plus.google.com/105940887037739554227,
https://www.youtube.com/user/chinaproductsreviews/about,China Gadgets,4624,2879101,'China Gadget Reviews' covers the latest gadget news reviews and tech deals on tablets mobile phones computer accessories DVD digital cameras GPS laptops and netbooks focusing on China's market devices.  Find us here: http://chinagadgetsreviews.blogspot.com,null,http://chinagadgetsreviews.blogspot.ro,https://plus.google.com/115019670109462589067,
https://www.youtube.com/user/mogitg1986/about,Draw Color For Kids,9,27891,null,null,
https://www.youtube.com/user/heutiepizza/about,Ken Heutie,null,0,null,null,
https://www.youtube.com/user/LIDTVideos/about,Living In Digital Times Videos,549,206446,About Living in Digital Times Living in Digital Times produces conferences and exhibits throughout the year that bring together the most knowledgeable leaders and the latest innovations that impact both technology and lifestyle. Among our goals is to help companies understand what it means to be a consumer in today's digital world and to stay a step ahead in identifying key trends in their given marketplaces. Living in Digital Times produces the following summits exhibitions and events annually at the International CES and at other shows: Digital Health Summit Silvers Summit FitnessTech Summit TransformingEDU Kids@Play Summit MommyTech Summit Battle of the BandsMobile Apps Showdown Last Gadget Standing FashionWare Show and the KAPi Awards.  For more information visit http://www.LivinginDigitalTimes.com.,null,https://www.facebook.com/pages/Living-in-Digital-Times/107152525988674,http://digitalhealthsummit.com/,http://sportsandfitnesstech.com/,http://mommytechsummit.com/,http://kidsatplaysummit.com/,http://transformingedu.com/,http://lastgadgetstanding.com/,http://mobileappsshowdown.com/,http://awards.digitalhealthsummit.com/,http://kapiawards.com/,http://livingindigitaltimes.com/,http://beautytechsummit.com/,http://babytechsummit.com/,http://thedigitalmoneyforum.com/,https://plus.google.com/104701889484168567574,
https://www.youtube.com/user/PICKLEandBANANA/about,Ricky Dillon,3201874,329565529,Ricky Dillon's YouTube Channel  new videos every sunday!  follow me on twitter: https://twitter.com/RickyPDillon,null,http://rickydillonbook.com,http://smarturl.it/GOLDricky,https://www.instagram.com/rickydillon/,https://twitter.com/RickyPDillon,https://open.spotify.com/user/12168915359,http://rickydillon.tumblr.com,https://www.facebook.com/RickyPDillon/,https://www.districtlines.com/RickyDillon,https://plus.google.com/111288119793450053667,
https://www.youtube.com/user/thedealguy/about,The Deal Guy,256282,8409574,Ways to Save Huge Deals Found Daily With Matt Granite. Matt Granite is The Deal Guy: USA Today and TV's Emmy Award Winning Deal-Hunter who gets you the biggest daily deals anywhere! This is the best spot for Black Friday 2016 Deals and Cyber Monday 2016 Deals and Door Busters. A new deal drops right here every day. Subscribe to get exclusive tech deals coupon codes printable coupons and lifestyle deals. Certain deals for every video are free give-aways for subscribers. This YouTube Channel is owned and operated by The Deal Guy Matt Granite. The Deal Guy ® Some of the links used on this YouTube Channel have Bitly performance tracking codes some are from third parties and in some cases affiliate links. While third parties and YouTube advertisers benefit directly the talent on this channel (including interns) do not make a commission.,null,http://www.youtube.com/channel/UC5Qbo0AR3CwpmEq751BIy0g?sub_confirmation=1,https://www.facebook.com/thedealguy,http://www.twitter.com/mattgranite,http://mattsdailydeals.com,http://www.instagram.com/thedealguy,https://plus.google.com/115609328759482341711,
https://www.youtube.com/user/VineAholic/about,Funny Vines,871832,422461855,Funny Vines brings you the best comps from the funniest top Viners including Curtis Lepore Eric Dunn David Lopez Brittany Furlan Jessi Smiles King Bach Trey Kennedy Anwar Jibawi  Aaron Doh Allicatt Arberi Ferrag Aye Twinz Bat Dad Brandon Bowen Brandon Calvillo Austin Miles Geter Ben Cahn BottleRocket Brennen Taylor Chad Perez Chris Ashley Chris Melberger Chris Remson Christine Sydelko Dan Curtin Danny Gonzalez Darius Benson David Lopez EhBee Kenny Knox King Vader Lance210 Manon Mathews Matt Cutshall Meechonmars Michael Persad Mightyduck Mikaela Long Ollie MN Perfect Laughs Alphaxalfa Ray Ligaya Regaljoe Sam and Colby The Gabbie Show Thomas Sanders Victor Pope Jr. & Vincent Marcus.   New Vine Compilations every Sunday Tuesday Wednesday Thursday and Friday. Subscribe to never miss one!  Are you a Viner? Do you like to post Vines? Submit your Vines and we'll put them in our compilations! Submit to the link below.,null,https://docs.google.com/a/collabcreators.com/forms/d/1sR5Y6PyFGOpIMp6-j6XDAH3J07naG4ruRAfXyTOWZRE/viewform?c=0&w=1,https://plus.google.com/118067678130493055359,
https://www.youtube.com/user/tldtoday/about,Jonathan Morrison,2084278,258719118,High quality videos blending tech + aesthetic showcasing the latest products & gadgets.,null,http://amzn.to/ZEOmIE,http://www.facebook.com/tldtoday,http://instagram.com/tldtoday,http://twitter.com/tldtoday,https://plus.google.com/117142601621499293506,
https://www.youtube.com/user/CNETTV/about,CNET,1365274,664445679,We provide the latest tech news unbiased reviews videos podcasts software downloads and How-Tos making tech products easy to find understand and use.,null,http://facebook.com/cnet,http://twitter.com/cnet,https://itunes.apple.com/us/podcast/all-cnet-video-podcasts-hd/id292130379,http://instagram.com/cnet,http://cnet.tumblr.com/,http://pinterest.com/CNET/,https://plus.google.com/105198124856956810263,
https://www.youtube.com/user/BIBEKBASU1/about,Qubimaxima,110531,25524516,Qubimaxima is a YouTube channel based on Technology and Gaming. We provide you with latest tech and game releases and keep you up to date with the evolving society. We release a new video EVERYDAY.  Qubimaxima constantly uploads videos on ►  ★ Latest technology                                                   ★ New Inventions ★ Popular inventions                                                  ★ Security Devices ★ Must have gadgets                                                 ★ Smartphone Gadgets ★ Tech for gamers                                                      ★ Amazing Products & much more And also you can share your video ideas with us and we'll give you credit for that. Then why not subscribe? Be a part of the ever evolving society with us.,null,https://goo.gl/iA3YDs,https://www.facebook.com/Qubimaxima,https://twitter.com/qubimaximareal,http://qubimaxima.blogspot.in/,https://plus.google.com/117492859274531076416,
https://www.youtube.com/user/kimkomandoshow/about,The Kim Komando Show,33007,18275190,The official YouTube channel of the Kim Komando Show. http://www.komando.com  Stay tuned for more videos and fun. We have new videos for you every week.,null,http://www.komando.com,http://www.facebook.com/kimkomando,http://twitter.com/kimkomando,https://plus.google.com/107387881036217129794,
