https://www.youtube.com/user/roguekite/about,Rogue Kite Productions,318,172135,Rogue Kite Productions is a collaboration between director/writer Michelle Boley cinematographer/editor Taylor Gill and friends.  www.funnyordie.com/roguekite www.roguekite.com   View our videos on other channels: Maroon 5 - (Stuffed) Animals Parody:   http://youtu.be/XhdPEZIrd78 "Don't Vote" - A Message from the Republican Party:   http://youtu.be/KdGXD9me8no,null,https://plus.google.com/111968945996538337280,
https://www.youtube.com/user/gadgetsmalta/about,Gadgets Malta,204,174272,null,null,https://plus.google.com/111714949637955542713,
https://www.youtube.com/user/zaew1234/about,Inventions TV,3,811,null,null,
https://www.youtube.com/user/kohlerje/about,Jeffrey Kohler,1304,4555756,null,null,
https://www.youtube.com/user/neurowear/about,neurowear,7117,9435977,Neurowear is a project team that designs near-future communication experiences with a focus on biomedical signal technology. Communication tool ‘necomimi’ (2011). Cat-like ears based on brainwaves chosen as one of TIME’s 50 greatest world inventions. Headphone ‘mico (2013). Music recommendation application utilizing human emotions. Received much attention at SXSW. Wearable camera ‘neurocam’ (2013). Wearable camera that automatically takes short video clips based on human emotions Awarded Innovation Technology 2014 by Ministry of Economy Trade and Industry. EYEoT ‘mononome’ (2014). IoT device that visualizes communication between humans and objects.,null,http://neurowear.com,https://plus.google.com/116114785843264223366,
https://www.youtube.com/user/OldJimsPlowing/about,Snow Plowing,260,178904,Mainly snow plowing video's but don't rule-out other heavy equipment stuff construction trucks camping and more.  Another page I own is @osta379.  Upstate New York.,null,https://plus.google.com/109108718033999609031,
https://www.youtube.com/user/CloveTechnology/about,Clove Technology,60432,29419195,Devoted to all the latest mobile technology; from unboxings to reviews this is a must watch channel for a gadget or technology fan.  Clove Technology is a UK based mobile technology specialist specifically smartphones tablets and accessories. Established in 1992 we have handled the majority of mobile technology and bring you up close and personal with the latest smartphones tablets and accessories right here on this YouTube channel.  As an independent company we give honest yet informed opinions on all the products we cover.   If you like what you see then be sure to check out our other videos and if you really want one of the products from the videos then visit www.clove.co.uk to make your purchase. With global shipping options you need not worry about not being able to buy or having to wait a long time to receive it!,null,http://www.clove.co.uk,http://www.facebook.com/clovetechnology,http://www.twitter.com/clovetechnology,http://instagram.com/clovetechnology,http://blog.clove.co.uk,http://www.linkedin.com/company/clove-technology,http://www.clove.co.uk/emailnewsletter.aspx,http://blog.clove.co.uk/feed,https://plus.google.com/100060486841318182138,
https://www.youtube.com/user/CatLiverShunt/about,Cat Liver Shunt,28,8567,Helping to promote awareness of feline portosystemic shunts (liver shunts in cats) by providing free basic tutorials on various crafts.,null,http://www.catlivershunt.com,
https://www.youtube.com/user/TecnoCat01/about,Tecno Cat,90309,13700869,conoce mas Sobre ANDROID Las mejores AppsJuegosUnboxingsReviewsRoms  saca provecho actualizando tu Smartphone con  Roms en Diferentes terminales Como hacer Root  Suscribete:  https://goo.gl/fq0Yv2  Redes Sociales ►Twitter:  https://goo.gl/mc1Qa3 ►Instagram:  https://goo.gl/VzzYIE ►Facebook :  https://goo.gl/XC8IyG ►Web:  https://goo.gl/dN3Vqu  ►CONTACTO (BUSINESS):  contactotecnocat@gmail.com,contactotecnocat@gmail.com,https://www.facebook.com/tecno.cat.9,http://tecnocattutoriales.blogspot.com,https://twitter.com/tecnocat01,contactotecnocat@gmail.com,https://www.instagram.com/tecnocat1/,https://plus.google.com/114586838115596422426,
https://www.youtube.com/user/munukutlakumar/about,E Gadgets,2904,1620755,Welcome To My Channel. Technology has evolved a lot these days. Making a notification of latest smartphones with their specifications and comparison with the other smartphones for the best to buy and which suits you a lot. Here you can establish a new platform for a new smartphones specs features & their price. Subscribe me for all new smartphone releases...  New Blog: http://phonegeeky.blogspot.in/,null,https://plus.google.com/113903679027540470439,
https://www.youtube.com/user/RonsAmazingProducts/about,RonsAmazingProducts,406,142955,We love Electronics and the amazing products made with it! Searching for new and amazing electronic products is Ron's Amazing Products passion.  We understand how important electronic gadgets are in today's society.  We are a group of individuals who are constantly on the lookout for the next big thing in terms of technology.   We use the products we manufacture and bring them to market for our many friends like you. Join in the fun!  For more information visit our website http://www.ronsamazingproducts.com,null,http://www.facebook.com/ronsamazingproducts,http://twitter.com/ronsamazing,https://www.pinterest.com/ronsamazing/,https://plus.google.com/109472387420987958370,
https://www.youtube.com/user/LegUpUnited/about,Leg Up United,3,814,The Place for Dog Lovers and their Dogs,null,https://twitter.com/LegUpUnited,https://plus.google.com/111288656667586091015,
https://www.youtube.com/user/TEKHD/about,Tekzilla,185447,34365942,Tekzilla feeds your tech hunger! Patrick Norton and Shannon Morse bring you hands on reviews of the latest gear tips and tricks that improve the tech you already own and conversations with the most informative experts around.,null,http://Revision3.com/tekzilla,http://twitter.com/tekzilla,http://www.facebook.com/tekzilla,http://www.youtube.com/subscription_center?add_user=tekhd,http://twitter.com/patricknorton,http://twitter.com/veronica,http://twitter.com/robertheron,https://plus.google.com/102235972367863483535,
https://www.youtube.com/user/Shampyon/about,Shampyon,null,190365,null,null,https://plus.google.com/100194039696355207316,
https://www.youtube.com/user/gplaysachu/about,TechnoMaster,528,34404,TechnoMaster introducing innovations of new Technologies and Future gadgets. JUST. THAT.,null,http://www.facebook.com/technomaster02,https://www.instagram.com/technomaster02/,https://twitter.com/TechnoMaster02,www.technomaster002.wix.com/tech,https://plus.google.com/100199045360928125801,
https://www.youtube.com/user/hottrix/about,hottrix,9712,22229360,90 million apps by HOTTRIX are circulating. That's a lot of happy iPhone and Android users! Here's where we showcase our latest stuff and give you short and funny video lessons. http://www.hottrix.com,null,http://www.hottrix.com,http://app.cat,http://vimeo.com/appcat,https://plus.google.com/114044136956410442284,
https://www.youtube.com/user/pocketnowvideo/about,Pocketnow,1416750,543092201,Pocketnow has been a key source of mobile technology news and reviews since its establishment in 2000. With offices on three continents Pocketnow offers round-the-clock coverage of the mobile technology landscape from smartphones to tablets to wearables. We aim to be your number-one source for mobile tech news reviews comparisons and commentary.,null,http://pocketnow.com,http://facebook.com/pocketnow,http://twitter.com/pocketnow,http://plus.google.com/+pocketnow,http://instagram.com/pocketnow,
https://www.youtube.com/user/smosh/about,Smosh,22666738,6455613269,Watch new videos from SMOSH: ►► MONDAYS – SMOSH ANIMATED ►►Alt WEDNESDAYS – Every [Blank] Ever / The Big What If ►► FRIDAYS – SMOSH Sketches  New video every Friday. Make sure you also check out our 2nd Channel for 2 bonus videos every week!  Contact Us: http://smosh.com/contact-us,null,http://www.smosh.com/,http://facebook.com/smosh,http://twitter.com/smosh,http://smosh.tumblr.com,http://instagram.com/smosh,http://www.youtube.com/user/IanH/,http://youtube.com/smoshgames,http://youtube.com/shutupcartoons,http://www.youtube.com/ElSmosh,http://smosh.com/merch,http://smo.sh/1f0n6Kz,http://youtube.com/TheFrenchSmosh,http://smarturl.it/02d3yx,https://plus.google.com/107658787431067089650,
https://www.youtube.com/user/vat19com/about,Vat19,3738464,3105349846,Vat19 is dedicated to "curiously awesome" gifts candy toys gummy putty puzzles games and more! In addition to making funny commercials you'll actually want to watch we produce amazing challenge videos document our outrageous contraptions and invite you to a front row seat for our silly stunts.  Sometimes we blow things up fill up a bathtub or pool with crazy stuff dare each other to eat super spicy foods and answer “burning questions” from our viewers.  Don't forget to SUBSCRIBE to our channel!  Shop curiously awesome gifts: http://www.vat19.com/?adid=youtube  *******************  Do you want to feature or do product reviews of our cool products in your videos?  Send an email to: youtube@vat19.com  If you're a brand or have a product you'd like featured on Vat19's channel email us: youtube@vat19.com  ******************* Instagram: http://instagram.com/vat19 Facebook: http://www.facebook.com/vat19 Snapchat: vat19team Twitter: http://twitter.com/#!/vat19,youtube@vat19.com,https://www.youtube.com/subscription_center?add_user=vat19com,https://www.vat19.com?adid=youtube,http://www.facebook.com/vat19,https://twitter.com/vat19,http://instagram.com/vat19,http://www.vat19.com/meet-vat19.cfm?adid=youtube,https://www.snapchat.com/add/vat19team,https://plus.google.com/104149877641335444132,
https://www.youtube.com/user/thinkgeek/about,ThinkGeek,186344,140657601,Welcome to the home of ThinkGeek's video awesomeness! Product videos explaining how something works? Check. Videos that have nothing at all to do with products but we wanted to make something fun? Double check.  We've been around since 1999 and are the Internet's premier retailer for the geek community. Visit us at ThinkGeek.com and follow us on Twitter as @thinkgeek or facebook.com/thinkgeek,null,http://www.thinkgeek.com,https://twitter.com/thinkgeek,http://www.facebook.com/thinkgeek,http://www.vine.co/thinkgeek,http://www.instagram.com/thinkgeek,https://plus.google.com/111086949937726998175,
https://www.youtube.com/user/chrispoole20/about,Cole and Marmalade,544979,140267527,Cole & Marmalade are always up to something! ... Together with their human 'servant' Chris they will entertain and educate you check out their fun videos to see them in action! Please Adopt Spay & Neuter! - BE THE SOLUTION! :)  Contact our human Chris Poole: chrispoole20@yahoo.co.uk MEOW :),chrispoole20@yahoo.co.uk,https://shop.coleandmarmalade.com,https://www.facebook.com/ColeandMarmalade,http://instagram.com/coleandmarmalade,https://twitter.com/ColeTheBlackCat,https://www.youtube.com/channel/UC6VzUf8LyXxOz2ZkQP8_uhw,https://plus.google.com/100218804159261906547,
https://www.youtube.com/user/missglamorazzi/about,Ingrid Nilsen,3955933,353154597,A place for curious minds and adventurous hearts.  Check out my second channel for vlogs and more! youtube.com/thegridmonster  For business inquiries please email: lisa@flipmgmt.com,lisa@flipmgmt.com,http://www.twitter.com/ingridnilsen,http://facebook.com/heyingridnilsen,http://instagram.com/ingridnilsen,https://plus.google.com/107246954106026068349,
https://www.youtube.com/user/ErinsHamsters/about,ErinsAnimals,142100,24445469,Hi I'm Erin and welcome to our very furry YouTube channel!  This channel is my place to share the animals in my life with others and along the way encourage owners (both new and experienced) to keep learning as much as they can about caring for their furry friends. Along with cute animal footage you'll also find DIYs step by step tutorials vlogs reviews and much more animal related fun!   All you have to do to get all of this is click the subscribe button. It's 100% free and will ensure that you know right away whenever we post a new video so you'll never miss one!,null,http://youtube.com/erinrachel94,https://twitter.com/erinrachel94,http://erinshamsters.wixsite.com/hamsters,http://instagram.com/erinrachel94,https://plus.google.com/100156414420816246788,
https://www.youtube.com/user/AnimalistNetwork/about,Animalist,325592,84518064,Animalist is your destination for all things animal on the web. From the exotic to the domestic from the cute to the weird we cover the whole animal kingdom. We have breaking animal news stories and funny animal sketches. And yes we have cat videos--lots and lots of cat videos. Start with Animalist News our daily news show with hilarious hosts Alex Farnham and Catie Wayne and new episode of Weird Gross Beautiful with Catie Wayne every Wednesday. Then make sure you check out all our other Animalist shows like Best Breed Ever! Pudge It Yourself Big Cat Rescue Lil BUB's Big SHOW Cat Mojo With Jackson Galaxy Petsami and more!  Our full lineup of programming can be found at Animalist.com a Discovery Digital Network.,null,http://animalist.com/,https://www.facebook.com/AnimalistNetwork,https://twitter.com/animalists,http://instagram.com/animalists,http://www.pinterest.com/animalists/,https://plus.google.com/102315756768159443827,
https://www.youtube.com/user/Howcast/about,Howcast,5384617,2790563620,Emphasizing high-quality instructional video production Howcast brings you leading experts and accurate reliable information on topics ranging from makeup tutorials cute hairstyles and nail art designs to soccer tricks parkour and skateboarding plus how to dougie how to kiss and much much more. Howcast empowers people with engaging useful how-to information wherever whenever they need to know how.,null,http://howcast.com,http://www.facebook.com/howcast,http://www.twitter.com/howcast,https://plus.google.com/108346356309721443249,
https://www.youtube.com/user/afgPink/about,afgPink,308,25286,Hey Guys Afgpink Here!  Thanks for checking out my channel!  I try my best to upload a video once a week!  I upload beauty videos nail art and fashion!  Make sure to subscribe and don't forget to stay pink!,null,http://www.twitter.com/afgpink,http://www.instagram.com/afgpink/,https://plus.google.com/118134167716526047993,
https://www.youtube.com/user/jyanis/about,Guns & Gadgets,12618,1866769,News reviews and information from a Sheepdog & Patriot about cool things for Sheepdogs & Patriots...guns gear knives survival items and training (Guns & Gadgets)! PLEASE SUBSCRIBE!  For Sponsorships or Endorsements:  Jyanis1975@gmail.com,yanis1975@gmail.com,https://twitter.com/jyanis,https://instagram.com/guns_and_gadgets/,https://www.facebook.com/GunsGadgets,https://plus.google.com/110806617461642163363,
https://www.youtube.com/user/ClearAdvantageTac/about,ClearAdvantageTV,6739,1147056,Clear Advantage Tactical (CAT) is a company based out of Austin TX.  CAT operating along with its sister company AR15Targets strives to provide end users with the best Targets Weapons Gunsmithing Analytics Comparisons and Pro Tips available on the market.    DISCLAIMER: The individuals you see in these videos are trained professionals in their respective disciplines please do not attempt to recreate any of the tests demos drills or otherwise profiled media without professional instruction.,null,http://instagram.com/clearadvantage_tv,https://plus.google.com/103519350086795018945,
https://www.youtube.com/user/MstrJames/about,the Hacksmith,1317998,85410596,We take fictional ideas from movies video games & comics and MAKE THEM REAL!  I quit my full-time job as an engineer and product developer to make only the coolest inventions -- for you guys -- right here on YouTube. Please consider subscribing -- you won't regret it!  Send media inquires through http://www.thehacksmith.ca/contact-the-hacksmith/,null,https://www.facebook.com/thehacksmith,http://www.twitter.com/the_hacksmith,http://www.thehacksmith.ca,http://hackaday.com/author/thehacksmith/,https://plus.google.com/102344170252011806417,
https://www.youtube.com/user/gavinfabl100/about,Gavin Fabiani-Laymond,350,175445,Welcome to Gavin's Gadgets YouTube Channel. http://gavinsgadgets.com for 300+ reviews on smartphones tech gadgets security audio & more,null,http://gavinsgadgets.com,https://plus.google.com/111142169002996181445,
https://www.youtube.com/user/digitallmagnet/about,digitalmag.net,1919,2220317,null,null,https://plus.google.com/104606719267583923638,
https://www.youtube.com/user/Nickelodeon/about,Nickelodeon,1889858,1094731564,Nickelodeon is the number-one brand for kids with original cartoons sitcoms movies award shows products and more! Here on our YouTube you’ll find SpongeBob SquarePants Teenage Mutant Ninja Turtles Henry Danger The Thundermans Game Shakers Make it Pop Harvey Beaks Pig Goat Banana Cricket Sanjay and Craig Bella and the Bulldogs 100 Things to do Before High School Alvinnn! Wits Academy and Nick content from around the world.   Need to know when your favorite TV show is on? Go to: http://www.nick.com/shows/tvschedule/  Subscribe to our YouTube channel   Follow us on Instagram Snapchat Vine Facebook Twitter Tumblr Pinterest Periscope Meerkat and Google+  For even more fun games and full episodes log on to www.nick.com,null,https://www.instagram.com/nickelodeon/,https://twitter.com/nickelodeontv,https://www.facebook.com/nickelodeon,https://www.snapchat.com/add/nickelodeontv,http://nickelodeon.tumblr.com,https://plus.google.com/110926067613048214619,
https://www.youtube.com/user/joshchu/about,colt cat,469,746890,null,null,https://plus.google.com/101640537305280407895,
https://www.youtube.com/user/CatMediaCrew/about,CAT Entertainments,629,85377,With a vision to create a new generation of value based media and the cultural impact it triggers CAT entertainments aims to create a vibe that successfully stays ahead of its time and thereby ensuring longevity. A complete media production group with a refreshingly attractive new feel without compromising on quality CAT entertainments breaths eats and lives its passion for creating amazing artistic achievements in visual media,null,http://www.catentertainments.com/,https://www.facebook.com/CatEntertainments,https://twitter.com/CatMediaCrew,
https://www.youtube.com/user/canalbuenrollito/about,T3Tech,54891,7903105,T3Tech is a channel on science and technology in which research is conducted on Top format '  Here you can find videos like : • Top 10 best technologies of the future • Top 8 most advanced vehicles in the world • Top 10 Gadgets essential that you'd have • Top 8 futuristic inventions that already exist • Top the best technology applied to smart homes • Top 10 new secret weapons united states • Top 10 technologies that will see in the coming years  • And many more .... Tops science and technology '    Do not forget to subscribe to our channel and stop by our social networks : D  Support the dissemination of science '  We see in the following video: D,null,https://www.paypal.com/cgi-bin/webscr?cmd=_donations&business=D3UWSNE23UATL&lc=ES&currency_code=EUR&bn=PP%2dDonationsBF%3abtn_donateCC_LG%2egif%3aNonHosted,https://twitter.com/T3TechYT,https://www.facebook.com/T3TechYT,https://www.youtube.com/c/T3TechTops,https://www.instagram.com/t3techyt,https://plus.google.com/101224694732963756724,
https://www.youtube.com/user/gadgetsportal/about,Gadgets Portal,248942,66579443,All about Gadgets in-depth! Subscribe & have fun.  For advertising / sponsorship feel free to contact me. (I don't provide buying suggestions by the way!)  Sukesh Banik Gadgets Portal India,null,http://gadgetsportal.in/a1/,http://www.flipkart.com/?affid=adsgadgets,http://GadgetsPortal.in,http://www.youtube.com/user/gadgetsportal?sub_confirmation=1,http://facebook.com/GadgetsPortalAdmin,http://www.youtube.com/gadgetsportalplay,https://plus.google.com/107482942348589745017,
https://www.youtube.com/user/KristenLevine/about,Kristen Levine Pet Living,123,35055,I'm Kristen Levine and I believe we need pets just as much as they need us. So I share stories advice and research to show how pets and people can be healthier and happier together.  Whether I'm reviewing a great new product or telling an inspirational "tail" — I know pet parents seek content and connection with people who love pets as much as they do. So I create watchable sharable fun content for pet-positive companies.,null,http://www.kristenlevine.com/,https://www.facebook.com/KristenLevinePetLifestyleExpert,https://twitter.com/FetchingKristen,https://plus.google.com/112471086185166097467,
https://www.youtube.com/user/dsf2006/about,dsf2006,6454,12256043,The best in new and classic horror cult and sci-fi.,null,http://www.darkskyfilms.com/,https://www.facebook.com/DarkSkyFilms,https://twitter.com/darkskyfilms,https://plus.google.com/101022976635349483373,
https://www.youtube.com/user/taffOffiziell/about,taff,663533,507114083,taff - das Lifestyle-Magazin auf ProSieben mit Annemarie Carpendale Rebecca Mir Daniel Aminati Bonnie Strange und Thore Schölermann.  Die Moderatoren berichten im Lifestyle Magazin taff montags bis freitags um 17 Uhr auf ProSieben über Stars Trends und Lifestyle.   In den verschiedenen Rubriken werden so zum Beispiel die lustigsten Internetvideos vorgestellt das Neueste des Tages besprochen oder die aktuellsten Trends und Styling-Tipps gezeigt. Natürlich bekommt ihr bei taff auch exklusive Einblicke in ProSieben Formate wie „Germany's Next Topmodel" oder „The Voice of Germany".   Viel Spaß bei taff -- life. style. smile.  Alle Videos Bilder und News zu taff findest du auf: http://www.prosieben.de/tv/taff  http://www.studio71.com/impressum/,null,http://www.prosieben.de/tv/taff,https://www.facebook.com/taff,https://twitter.com/taffnet,http://www.prosieben.de/tv/galileo/videos/playlists/ganze-folgen,http://www.prosieben.de/tv/taff/themen/taff-backstage-videos,http://www.studio71.com/impressum/,https://plus.google.com/104414365602322755263,
https://www.youtube.com/user/bsbclips/about,Brunettes Shoot Blondes,27597,10688251,Brunettes Shoot Blondes is an indie rock band based in Kiev Ukraine. Formed at the beginning of 2010 they attracted music lovers’ attention to their songs.  In September 2014 the band released a self-produced music video for the song Knock Knock which immediately became a worldwide viral hit. With over 6 million views on YouTube it was called an Internet sensation and positively reviewed by such medias as Billboard Yahoo! Music The Daily Mirror USA Today Mashable Business Insider Daily Mail and many others.  At the end of 2014 Brunettes Shoot Blondes presented a new video work for the song called Bittersweet. The video made in partnership with Opel Germany is directed by the band as well as the previous one.   The band’s songs and videos are now on rotation on various radio and TV stations. The musicians have already performed numerous shows and festivals in their homeland and on the stages of Europe.,null,http://brunettesshootblondes.org/,https://www.facebook.com/brunettesshootblondes,http://vk.com/brunettesshootblondes,https://www.instagram.com/brunettesshootblondes/,https://soundcloud.com/brunettesshootblondes,https://plus.google.com/110846309186329805658,
https://www.youtube.com/user/tcboy88/about,TcBoY Yeo,361,313318,Hand and finger tracking,null,http://www.facebook.com/HCI.Research,https://plus.google.com/106437841373219523769,
https://www.youtube.com/user/JamesNintendoNerd/about,Cinemassacre,2304047,1034346087,Cinemassacre Productions creates many different gaming related web series including: Angry Video Game Nerd James & Mike Mondays Live Streams and more!  James on Twitter https://twitter.com/cinemassacre Mike Matei on Twitter  https://twitter.com/Mike_Matei  Want us to take a look at your indie game title? Contact / send Steam Keys to: Mike@Cinemassacre.com  Visit our website Cinemassacre.com  Want to donate a game? Contact Mike Matei via email at Mike@Cinemassacre.com  Often times we get e-mails from people that say they have not been notified of our newest videos. That’s probably because you have not clicked on the bell! To get notified of every video we put out you must click the bell icon when you subscribe to out channel. Then checkmark “allow notifications” and click SAVE. Never miss a Cinemassacre video again!,null,http://cinemassacre.com/,https://twitter.com/cinemassacre,https://twitter.com/Mike_Matei,https://twitter.com/schottr,https://www.facebook.com/Cinemassacre/,http://instagram.com/cinemassacre,https://plus.google.com/116133268515834057929,
https://www.youtube.com/user/advancedflea/about,advancedflea,146,51921,A random mishmash of videos from my life. Call it a "slice of life" channel if you will,null,https://plus.google.com/103621115774409811355,
https://www.youtube.com/user/ExplosmEntertainment/about,ExplosmEntertainment,7132512,1708098338,Release Schedule: Every other Monday: Explosm Presents: Channelate Shorts Every other Tuesday: Cyanide & Happiness Minis Thursdays: Cyanide & Happiness Shorts Saturday: Cyanide & Happiness Shorts Compilations  ExplosmEntertainment makes Cyanide & Happiness animations and comics as well as the Joking Hazard Card game (available here: http://store.explosm.net/)  Want to know more? Check out our comics merch live apperances and more at http://www.explosm.net,null,http://instagram.com/explosmofficial,https://twitter.com/explosm,https://www.facebook.com/explosm,http://explosm.net/comics/,https://plus.google.com/102000205973109222484,
