url, title, subs, views, description, email, external links
https://www.youtube.com/user/cltdotcom/about,Charlotte Observer,2165,3932799,The Charlotte Observer's official YouTube channel.,null,http://www.charlotteobserver.com/,https://www.facebook.com/thecharlotteobserver,https://twitter.com/charobs,http://insidestoryobs.blogspot.com/,https://plus.google.com/115021774857705317436,
https://www.youtube.com/user/osreviewz/about,OSReviews,12385,9426717,OSReviews specializes on consumer electronics and the technology industry covering in-depth reviews and unboxing videos. Be sure that your voice will be heard by commenting watching and sharing our reviews!  To receive live notifications be sure to click that 'Subscribe' button!  ~~~~~~~~~~~~~~~~~~~~~~~~~~~~~~~~~~~~~~~~~~~~~~~~~~~~~~~~ OSReviews - One Stop Reviews - The Opinion That Counts - OSTechNews  Welcome to  One Stop Reviews! Founded by a group of young non-profit tech enthusiasts you can count on us to deliver you the news and reviews that matter! Whether it's a video walk through a detailed article or our take on tech rumors we'll always cover content to the best of our abilities. We strive to improve and serve you an unbiased perspective on the world of consumer electronics.   *If you'd like for us to review your product [business inquires] feel free to contact us at: wonder00013@gmail.com,wonder00013@gmail.com,http://amzn.to/2efRVT6,http://twitter.com/OSTechNews,http://osreviews.tumblr.com/,http://ostechnews.weebly.com/,http://theosreviews.wordpress.com/,http://www.veoh.com/users/OSReviews,http://www.metacafe.com/channels/OSReviews/,http://www.amazon.com/gp/profile/AP0R93539E7KD,https://www.facebook.com/profile.php?id=100005544227853#,http://www.amazon.ca/gp/profile/AP0R93539E7KD,https://vimeo.com/user12398976,http://www.pinterest.com/osreviews/,http://www.reddit.com/user/OSReviews/,http://www.swagbucks.com/p/register?rb=19204893,https://plus.google.com/100430614756198469365,
https://www.youtube.com/user/kenanh2/about,Kamp Kenan,106877,16248753,We are Reptile enthusiasts  We know a lot about Lizards Snakes Turtles Tortoises Crocodiles Alligators and all sorts of scaly & misunderstood creatures.  We also love to learn from other animal experts who are happy to share knowledge.  That’s what Kamp Kenan is all about. We love animals and we know you do too. This is why we do what we do. Animal Conservation in the Modern World matters we're out there living it and doing it every day. This is real life these stories are real and our sole purpose is to educate you so that you can learn something new every day and one day perhaps get involved yourself. It's that simple.   Subscribe Now for more radical reptiles ►►http://goo.gl/g9y9tS Watch ALL Kamp Kenan FEATURE EPISODES ►►https://goo.gl/F94yPq Get Smarter on our WEBSITE and visit the store ►  http://kampkenan.com See more exclusive Kamp Kenan content on our Patreon page ►► https://goo.gl/w3Rd4e  New Videos Every Tuesday Thursday Saturday and Sunday!,null,http://www.kampkenan.com,http://instagram.com/kampkenan,https://www.facebook.com/KampKenan,https://www.patreon.com/KampKenan,https://plus.google.com/105237884158874611905,
https://www.youtube.com/user/qualityk9dotca/about,Mango Dogs,706,204618,Mango Dogs Inc. Located in Halifax Nova Scotia Canada. www.mangodogs.com www.mangodogsmedia.com,null,www.mangodogs.com,https://plus.google.com/105287764048933071599,
https://www.youtube.com/user/barcroftmedia/about,Barcroft TV,2916340,2647672929,Barcroft TV is the home of amazing exclusive video.  We update our YouTube site regularly with incredible real-life stories and footage - so stay tuned for more!  All our music comes from www.epidemicsound.com,null,http://www.barcroft.tv,http://www.facebook.com/barcroftTV,https://twitter.com/Barcroft_TV,http://instagram.com/barcroft_tv,https://plus.google.com/b/109352954399711636677/109352954399711636677/posts,https://plus.google.com/109352954399711636677,
https://www.youtube.com/user/WTNH/about,WTNH News8,33864,47553908,WTNH went on the air June 15 1948 as WNHC-TV Channel 6. It was the first television station in all of Southern New England. It signed on within days of WBZ-TV Channel 4 in Boston. WNHC was the first TV service for Hartford Springfield the Hamptons and Eastern Long Island.   WNHC-TV moved to Channel 8 on January 1 1954. The call letters became WTNH in 1971.,null,http://wtnh.com,https://www.facebook.com/WTNH8,https://twitter.com/WTNH,https://plus.google.com/104305133651173230013,
https://www.youtube.com/user/Vetstreet/about,vetstreet.com,12184,3662680,Vetstreet.com is dedicated to giving you the most accurate information possible so you can keep your dogs and cats healthy.  Our articles are written developed and reviewed by leading veterinarians professional journalists and animal health experts so you get the most current advice and thinking on everything from finding the right puppy or kitten to dealing with serious medical conditions.  We know that the key to a happy healthy long-living pet is a well-informed owner and an expert veterinary care team. At vetstreet.com we provide the information and tools to make that partnership happen as easily as possible.  We also cover fun events (dock diving pet parades) track trends (pets in pop culture) review great products (sleek cat toys and cushy dog beds) and explore all the things that make having a pet so amazing.,null,http://www.vetstreet.com,https://plus.google.com/104531581418216055575,
https://www.youtube.com/user/ianrbowie/about,ianrbowie,1,142,null,null,
https://www.youtube.com/user/iaminDNAofIndia/about,Iamin dnaofIndia,2358,759054,null,null,https://plus.google.com/117789974230698407733,
https://www.youtube.com/user/coursera/about,coursera,68112,2143724,Coursera provides universal access to the worlds best education.  http://www.Coursera.org,null,http://www.coursera.org,https://www.facebook.com/Coursera?fref=ts,https://twitter.com/coursera,https://plus.google.com/+Coursera/posts,http://blog.coursera.org/,https://plus.google.com/113764882365007097359,
https://www.youtube.com/user/Evelyndi/about,Niki Drage,426,76173,Hi All  I compete in agility with my 3 dogs:  Pepperoni aka Pepestaffy x IG (rescue).  Yurrugar Green WithNV aka Envy English Toy Terrier  GowithdaFLOW aka Flow staffy x border collie (?)  (rescue)  We compete all over NSW and occasionally interstate. I often have videos of my friends from agility on this channel too. Thanks for vising enjoy my videos!,null,http://www.tugstuff.com.au,https://plus.google.com/102968288249054664329,
https://www.youtube.com/user/NCNatureNews/about,GoHerping,17165,1338961,I'm Alex and I make videos on the coolest living things on Earth: Reptiles & amphibians.  SEE MY CAMERA GEAR & REPTILE SUPPLIES: https://kit.com/GoHerping  SEE MORE: http://goherping.com  “If we can teach people about wildlife they will be touched. Because humans want to save things that they love" -Steve Irwin (1962-2006)  F.A.Q.  Q. Wait you can drive? You're like 14. A. ...Close enough.  Q. How many animals do you have? A. 5 snakes 2 lizards 2 turtles 6 toads.  Q. Sub or shoutout pls? A. No go away lol,null,http://www.goherping.com,http://instagram.com/go_herping,http://twitter.com/goherping,https://plus.google.com/110168645182833846539,
https://www.youtube.com/user/kgun9/about,KGUN9,6562,10022321,KGUN9 is Southern Arizona's station for breaking news weather and sports. We are On Your Side to ask the tough questions on issues in our community.,null,https://www.kgun9.com,https://www.facebook.com/KGUN9OnYourSide,https://twitter.com/kgun9,https://itunes.apple.com/us/app/kgun-tv/id396752023?mt=8,https://play.google.com/store/apps/details?id=com.doapps.android.mln.MLN_5fef3eff51dc719c4a9f565a742d78f2&feature=search_result#?t=W251bGwsMSwyLDEsImNvbS5kb2FwcHMuYW5kcm9pZC5tbG4uTUxOXzVmZWYzZWZmNTFkYzcxOWM0YTlmNTY1YTc0MmQ3OGYyIl0.,http://stormshieldapp.com/,https://plus.google.com/106086434460580964799,
https://www.youtube.com/user/prehistoricpetstv/about,prehistoricpetstv,261017,96602318,Prehistoric Pets is a one-of-a-kind pet store specializing in exotic pets such as snakes lizards turtles and even gators! Staffed by reptile enthusiasts you’ll find everything you need for your reptile or amphibian.  The goal of the Prehistoric Pets channel is to encourage and train the community on the proper care and keeping of reptiles as pets. We focus on the education of reptiles so owners and hobbyists alike can foster an enjoyable experience and optimum animal health.  Be sure to check out our other channels website and socials below!,null,http://www.Facebook.com/PrehistoricPets,http://www.Instagram.com/PrehistoricPets,http://www.PrehistoricPets.com,http://www.Instagram.com/BuyAReptile,http://www.Twitter.com/PrehistoricInc,
https://www.youtube.com/user/23ABCnews/about,23 ABC News | KERO,15306,23184594,KERO-TV channel 23 is a television station located in Bakersfield California USA. KERO-TV is owned by the broadcasting division of the E.W. Scripps Company and is an affiliate of the ABC television network. The studios are located in downtown Bakersfield. http://www.TurnTo23.com,null,http://www.turnto23.com/,http://www.Facebook.com/23ABCBakersfield,http://www.Twitter.com/23ABCNews,http://www.instagram.com/23ABCNews,http://www.Pinterest.com/23ABCNews,https://itunes.apple.com/us/app/23-abc-for-iphone-bakersfield/id530136932?mt=8,https://play.google.com/store/apps/details?id=com.mylocaltv.kero,http://www.stormshieldapp.com/,https://channelstore.roku.com/details/90436/kero,https://plus.google.com/111186158809382322399,
https://www.youtube.com/user/ThePetzPaws/about,PetzPaws,1,461,Pet Lifestyle Enthusiasts,null,http://www.petzpaws.com/,https://twitter.com/PetzPaws,http://www.facebook.com/petzpaws,http://pinterest.com/petzpaws/,http://www.tumblr.com/blog/petzpaws,http://petzpaws.blogspot.com/,https://plus.google.com/108128292737639155112,
https://www.youtube.com/user/TEDxTalks/about,TEDx Talks,7361731,1446705502,TEDx is an international community that organizes TED-style events anywhere and everywhere -- celebrating locally-driven ideas and elevating them to a global stage. TEDx events are produced independently of TED conferences each event curates speakers on their own but based on TED's format and rules.,null,http://tedxtalks.ted.com,https://www.facebook.com/TEDxEvents,https://twitter.com/tedx,http://instagram.com/TEDxEvents,http://www.ted.com/tedx,
https://www.youtube.com/user/kristianjaker/about,kristianjaker,8,7210,null,null,https://plus.google.com/100497910183866112845,
https://www.youtube.com/user/TheVideoDog/about,TheVideoDog's channel,303,3621535,null,null,http://www.KMVideography.com,
https://www.youtube.com/user/lordancheta/about,Hour Philippines TV,19423,11526864,MABUHAY and Welcome to Hour Philippines TV the #1 Food Travel and Lifestyle Vlog!    Thanks for dropping by.  Please subscribe like share and comment on our videos! ♥ We upload daily and weekly!  Your essential guide to unforgettable food travel and nightlife adventures in the Philippines and beyond!    We believe life is meant to be shared and in doing so we hope our experiences could be useful in your travel and lifestyle decisions.  Have a great day and a fantastic life ahead!  :-) Cheers  Lord and Aksana  Food | Travel | Lifestyle | Parties | Nightlife | Events   For business inquiries please send us a message :-)  www.HourPhilippines.com  Social Media Branding Consultant: Crejativo  https://www.instagram.com/crejativo/,null,http://www.facebook.com/hourphilippinesTV,http://Facebook.com/HourPhilippinesTV,http://instagram.com/lordancheta,http://Facebook.com/HourPhilippinesTV,http://instagram.com/lordancheta,http://twitter.com/lordancheta,http://twitter.com/aksanaancheta,https://plus.google.com/116510037810154212970,
https://www.youtube.com/user/BirdDogsAfield/about,Paul Fuller,3452,1574080,null,null,https://plus.google.com/106112653326479985845,
https://www.youtube.com/user/MYPSB2012/about,MYPSB2012,312,90811,My channel is dedicated to sharing music from my favorite musical duo Pet Shop Boys.  I hope you enjoy this channel!!!,null,https://plus.google.com/108203682864128828096,
https://www.youtube.com/user/EdXOnline/about,edX,109738,5571642,EdX is a not-for-profit joint venture between Harvard University and the Massachusetts Institute of Technology to offer online versions of their classes and those of other universities.   Through edX MIT and Harvard will collaborate to enhance campus-based teaching and learning and build a global community of online learners.,null,http://www.edx.org/,http://www.twitter.com/#!/edxonline,http://www.facebook.com/edxonline,https://plus.google.com/108235383044095082735,
https://www.youtube.com/user/uzoouk/about,Uzoo,96886,116640549,For that furry little animal in all of us! U-Zoo brings you the cutest pets and most amazing animal videos from around the world.   Subscribe now for a brand new animal video every week.  Got any great videos or photos of your pets? Send them to us at uzoouk@gmail.com,uzoouk@gmail.com,http://www.facebook.com/uzooanimals,http://twitter.com/uzooanimals,http://instagram.com/uzoouk,http://uzoouk.tumblr.com/,http://www.stumbleupon.com/stumbler/uzoo-animals,https://plus.google.com/102265466908446806643,
https://www.youtube.com/user/AnimalHouseGreenBay/about,AnimalHouseGreenBay,32,36967,Subscribe to our channel to catch all the funny touching and heart rending moments that happen day to day at The Animal House  our award winning inspired pet care business that provides: Veterinary Care * Boarding * Daycare * Grooming * Training.   Check out our website at www.animalhousegreenbay.com  You can find other Animal House enthusiasts  at:  facebook.com/AnimalHouseGreenBay twitter.com/AnimalHouseGB instagram.com/AnimalHouseGreenBay,website at www.animalhousegreenbay.com,http://www.animalhousegreenbay.com,https://www.facebook.com/AnimalHouseGreenBay,https://twitter.com/AnimalHouseGB,https://instagram.com/AnimalHouseGreenBay,
https://www.youtube.com/user/OtagoDailyTimes/about,OtagoDailyTimes,1514,2950468,Otago Daily Times New Zealand's first daily newspaper and home of the latest breaking news across Otago and New Zealand.,null,http://www.odt.co.nz,https://www.facebook.com/OtagoDailyTimes,https://twitter.com/odtnews,http://www.linkedin.com/company/otago-daily-times?trk=company_logo,
https://www.youtube.com/user/PetProSupplyCo/about,PetProSupplyCo,17,24274,Official YouTube Page for Pet Pro Supply Company. Pet Pro Supply Co. is a leading online retailer of Professional-grade supplies and equipment for pet professionals.,null,http://www.petprosupplyco.com,
https://www.youtube.com/user/CCTVAmerica1/about,CGTN America,44068,30498243,CGTN in Washington D.C. is the American arm of the English language China Global Television Network.  CGTN can be seen in North America from 2 to 9pm eastern time on MHZ Network Channel 3 COMCAST Channel 273 FIOS 277 in the greater Washington area; on Time Warner Channel 134 in New York; on Charter Cable Channel 562 in Los Angeles; and nationwide on DISH TV channel 279.  Check local listings in your area for distribution of CGTN.,null,http://america.cgtn.com/,https://www.facebook.com/cgtnamerica/,https://twitter.com/cgtnamerica,http://america.cgtn.com/livenews,http://weibo.com/cgtnamerica,https://plus.google.com/+cgtnamerica,http://america.cgtn.com/category/full-frame,http://america.cgtn.com/category/insight,http://america.cgtn.com/category/world-today,http://america.cgtn.com/category/americas-now,http://america.cgtn.com/category/the-heat,http://america.cgtn.com/category/global-business,https://plus.google.com/110746785298014442822,
https://www.youtube.com/user/CCTVAFRICALIVE/about,CGTN Africa,71972,41814629,YOUR LINK TO CHINA AND THE WORLD！  China Global Television Network or CGTN is China’s new international media organization. It was launched by the national broadcaster China Central Television (CCTV) on December 31 2016.  Headquartered at the landmark CCTV building in Beijing CGTN brings together an international professional team with production centers in Washington and Nairobi and a European production center on the way.  Our mission is to create a better understanding of international events across the world bridging continents and bringing a more balanced view to global news reporting. CGTN Africa based in Nairobi Kenya. Our news show include AFRICA LIVE GLOBAL BUSINESS MATCH POINT TALK AFRICA AND FACES OF AFRICA. You can also watch CGTN Africa on DSTV Channel 409 Zuku Channel 567 & Star Times Channel 123 everyday at 1000GMT or 1700GMT. Join us!,null,http://africa.cgtn.com,https://www.facebook.com/cgtnafrica/,https://twitter.com/cgtnafrica,https://plus.google.com/100946680735878902366,
https://www.youtube.com/user/velvetvoyage/about,velvetvoyage,2206,2467112,For your eyes only....,null,https://plus.google.com/108847005040662197377,
https://www.youtube.com/user/myfoxla/about,FOX 11 Los Angeles,30163,28182731,Welcome to the official FOX 11 Los Angeles YouTube page. Find us on FOX 11 and myfoxla.com. We cover local news traffic weather sports and celebs with the entertainment industry.,null,http://www.foxla.com/,http://www.twitter.com/myfoxla,http://www.facebook.com/fox11la,http://www.pinterest.com/myfoxla,https://plus.google.com/111485336776535088248,
https://www.youtube.com/user/BurkeMountainResort/about,Ski Burke,99,44749,Burke Mountain Updates Events and all things Burke,null,http://www.skiburke.com,http://instagram.com/burkemountainofficial,https://twitter.com/skiburke,https://www.flickr.com/photos/burkemountain/sets/,https://www.facebook.com/BurkeMtn,https://plus.google.com/112664564801489898860,
https://www.youtube.com/user/TheDogFiles/about,Dog Files,1847,1403172,Showing The World That Dogs Deserve Our Love Care And Respect!,null,http://www.thedogfiles.com,http://facebook.com/dogfiles,http://facebook.com/dogfilesfoundation,https://plus.google.com/112297311081585648324,
https://www.youtube.com/user/docchat/about,Surf Dog Ricochet,3923,8062145,I'm a surf dog who surfs for fun participates in surf contests but most importantly... SURFS WITH PURPOSE! I'm the only only SURFice dog® on the planet who surfs with kids with special needs people with disabilities wounded warriors military families and veterans with PTSD as an assistive aid. I'm an internationally renowned award-winning dog who surfs solo with children adults pros celebrities other dogs & even a goat! I'm also a registered & certified therapy dog who lives a lifestyle of helping others by 'pawing it forward' while raising awareness & offering support to human/animal causes crisis situations and a bunch of other stuff!,null,http://www.surfdogricochet.com,https://www.facebook.com/SurfDogRicochet,https://plus.google.com/113687055741019305819,
https://www.youtube.com/user/MsClayInc/about,Sandeep Bakre,0,905,null,null,https://plus.google.com/110986727212282935701,
https://www.youtube.com/user/meetsandyrobins/about,meetsandyrobins,3,2596,null,null,
https://www.youtube.com/user/toledodogtraining/about,Raising Your Pets Naturally with Tonya Wilhelm,127,34209,Treating pets through positive training and a detailed holistic approach.  Pets and their families are my passion. I have spent my lifetime with both dogs and cats and turned that passion into a flourishing career. I was even honored with the title of one of the top ten dog trainers in the United States by TopTeny! Over my almost twenty year career I have been able to offer my pet clients a variety of services and finally decided to merge everything under one brand: Raising Your Pets Naturally.  Raising Your Pets Naturally embraces all of my loves: dog behavior dog training cat behavior dog and cat nutrition pet care pet product reviews traveling with dogs pet and human health and of course lots of fun and useful information.  Learn more at http://www.raisingyourpetsnaturally.com,null,http://www.raisingyourpetsnaturally.com,https://www.facebook.com/raisingyourpetsnaturally,https://www.pinterest.com/toledodog/,https://twitter.com/dogtrainer4ever,http://raisingyourpetsnaturally.com/dogblogsponsorships/,http://raisingyourpetsnaturally.com/naturalpetcarebooks/,https://plus.google.com/100018773563196745071,
https://www.youtube.com/user/JCLABoutique/about,JCLABoutique,6,4290,Hollywood's premier designer for pet bags and accessories. Jeanne Chinn Los Angeles Products are sold across the USA and distributed internationally. JCLA luxury pet bags are famous for the sculpted paw feet at the bottom of each bag. www.jclaboutique.com,null,http://www.jclaboutique.com,https://plus.google.com/102485655551477841463,
https://www.youtube.com/user/Rainingwaters/about,HulloAlice,151818,5345537,Hi my name is Alice and I make art videos of all kinds including speed drawing videos tutorials challenges and other fun things! I mostly use watercolor and copics on this channel but I'm also experienced in oil digital and 3D work.  I hold a degree in Painting and Graphic Design and another in 3D Animation! Feel free to ask me any questions I'd love to get to know you!  Note: I am not interested in joining any networks.,null,https://twitter.com/HulloAlice,https://www.facebook.com/hulloalice/,https://www.instagram.com/hulloalice/,https://www.youtube.com/c/HulloLife,https://plus.google.com/108691202997665898896,
https://www.youtube.com/user/fieldsportschannel/about,Fieldsports Channel,126328,75593135,The best hunting shooting and fishing in the world. Celebrate the outdoors. Take part in nature.,null,http://www.fieldsportschannel.tv,http://www.facebook.com/fieldsportschannel,http://twitter.com/fieldsportstv,http://www.flickr.com/photos/fieldsportschannel/sets/,http://visitor.r20.constantcontact.com/d.jsp?llr=47lsa7eab&p=oi&m=1104746721183,http://www.scribd.com/charlie_jacoby,http://www.linkedin.com/company/fieldsports-channel,
https://www.youtube.com/user/Himalaya2012/about,Himalaya2012,3,4780,null,null,https://plus.google.com/104966877200914992232,
https://www.youtube.com/user/khaledazamnoor/about,Animal education,null,6232741,Help protect endangered animals. saved endangered species,null,https://plus.google.com/115211898766515015811,
https://www.youtube.com/user/ForrestMicke/about,Forrest Micke,2646,212199,Inspirational motivational informational and entertaining videos on dog training and life!,null,https://plus.google.com/108617898454236652500,
https://www.youtube.com/user/puremichigan/about,Pure Michigan,9795,6047673,Welcome to Pure Michigan. Hundreds of crystal clear lakes and thousands of river and streams. With the world's longest freshwater coastline it's time to check out our playgrounds. Come boating fishing golfing camping biking hiking and touring. Find out what pure feels like visit soon.,null,http://www.michigan.org,https://www.facebook.com/PureMichigan,https://twitter.com/puremichigan,http://pinterest.com/puremichigan/,https://public.govdelivery.com/accounts/MIEDC/subscriber/new,http://www.michigan.org/blog,https://plus.google.com/110001387520466723232,
https://www.youtube.com/user/HillbillyRick1/about,HillbillyRick1,null,32266,null,null,https://plus.google.com/101676761241012195792,
https://www.youtube.com/user/surefirebeam/about,SureFire,19721,3274928,Maker of the world's finest illumination tools suppressors and tactical products designed and built to meet the demanding needs of high-risk professionals in the harshest conditions on earth.,null,http://www.surefire.com,http://www.facebook.com/surefire,http://instagram.com/surefire_llc,https://twitter.com/surefirellc,https://plus.google.com/112588902040288782996,
https://www.youtube.com/user/kikopup/about,kikopup,157792,24091603,Complete 'how to' free videos on dog training clicker training and behavior modification by world renowned dog trainer Emily Larlham.  Emily uses only Progressive Reinforcement Training.  A type of training that involves no forms of physical or psychological intimidation.  Visit her website for more free information on this way of training animals that is not only the safest but yields the most amazing results and creates the strongest trust and bond you could possibly have with your dog.  Dog training tips clicker training tutorials free behavior modification help,null,http://www.dogmantics.com,https://www.facebook.com/pages/Dogmantics-Dog-Training/75289166216?fref=ts,http://instagram.com/kikopup/,https://twitter.com/Dogmantics,https://plus.google.com/115012036870164148754,
https://www.youtube.com/user/kcratv/about,KCRA News,28443,73496038,KCRA 3 is Where the News Comes First in Northern California. Look to KCRA 3 for the latest breaking news daily headlines California weather political coverage and more.  KCRA 3's viewing area includes the communities of Sacramento Stockton and Modesto as well as the surrounding communities.,null,http://www.kcra.com/news/index.html,https://www.facebook.com/KCRA3,https://twitter.com/kcranews,http://www.kcra.com/weather/index.html,http://www.kcra.com/politics/index.html,http://www.kcra.com/sports/index.html,http://www.facebook.com/KCRA3Weather,http://www.facebook.com/ulocal,http://kcra.com,https://plus.google.com/101723695114440924680,
https://www.youtube.com/user/CrazyCuteVids/about,Crazycute Vids,null,13931519,Crazy Cute Funny Videos From Around The World :),null,
https://www.youtube.com/user/HTforAnimals/about,HTforAnimals,259,19041,Bridging the Art of Energy Medicine with the Science of Animal Healthcare.  Learn how to enhance your animal's health and well-being through energy medicine. The comprehensive curriculum teaches you how to apply specific techniques to help animals with health issues behavioral concerns and emotional stability.,null,https://plus.google.com/117247894599698355816,
