https://www.youtube.com/user/ExpressoPartners/about,ExpressoPartners,3743,2966120,Weekdays from 6am to 8.30am Expresso broadcasts LIVE from a penthouse apartment in Sea Point which has panoramic views of Table Mountain and the ocean. This context allows the cameras and presenters to move fluidly from place to place avoiding the typical studio format ensuring energetic performances and optimum attention. Our presenters Katlego Maboe Ewan Strydom Graeme Richards and Leigh-Anne Williams steer the show through a myriad of fun informative and interactive segments. Expresso showcases lifestyle entertainment includes kids' entertainment and green awareness on-trend fashion and beauty advice comedy interviews with celebrities live gigs from SA's top bands and the latest from the worlds of blogging gaming and gadgets.,null,http://expressoshow.com,https://plus.google.com/103133148031068068503,
https://www.youtube.com/user/techcrunch/about,TechCrunch,270737,83069980,TechCrunch is a leading technology media property dedicated to obsessively profiling startups reviewing new Internet products and breaking tech news. New episodes daily.,null,http://techcrunch.com,http://www.facebook.com/techcrunch,https://twitter.com/TechCrunch,http://techcrunch.com/video,https://instagram.com/techcrunch/,
https://www.youtube.com/user/NOVAQUA/about,Rachel Ballinger,1669885,276437182,Sup. I'm Rachel Ballinger and this is my page. I hope you get some laughs out of my videos.,null,http://missrballersplace.spreadshirt.com/,https://twitter.com/missrballer,http://instagram.com/missrballer,http://missrballer123.tumblr.com/,https://plus.google.com/102602597267451375799,
https://www.youtube.com/user/agoverseasfan/about,agoverseasfan,707947,492508998,Welcome to the AGOSF Family.On my channel I feature American Girl Doll Rooms Photo Shoots Stop Motions Hair Tutorials Reviews Updates Bedroom Setups and Openings.I have created playlists to make it easier for you to view my videos.Feel free to have a look through and leave a comment if you like :) Thanks for visiting my Channel. All rights reserved! Please DON'T repost any of my videos!,null,http://therealagoverseasfan.blogspot.com/,https://www.facebook.com/pages/Agoverseasfan/466662376706670?fref=ts,http://instagram.com/agoverseasfan,https://plus.google.com/116440410683657036405,
https://www.youtube.com/user/BostonDynamics/about,BostonDynamics,460026,148068603,Our mission is to build the most advanced robots on Earth with remarkable mobility agility dexterity and speed.  For more information about Boston Dynamics and our robots visit us at www.BostonDynamics.com,null,http://www.BostonDynamics.com,
https://www.youtube.com/user/unboxtherapy/about,Unbox Therapy,8031754,1360706302,Where products get naked.  Here you will find a variety of videos showcasing the coolest products on the planet. From the newest smartphone to surprising gadgets and technology you never knew existed. It's all here on Unbox Therapy.  Business / professional inquiries ONLY - business [at] unboxtherapy.com (please don't use YouTube inbox)  If you'd like to send products / items to Unbox Therapy use the address outlined below.  SEND STUFF TO:  Lewis Hilsenteger  1111 Davis Drive Unit #1 Suite #289 Newmarket ON - L3Y 9E5 CANADA,null,http://amzn.to/2alSfSg,https://twitter.com/#!/unboxtherapy,http://facebook.com/unboxtherapy,http://instagram.com/unboxtherapy,http://www.unboxtherapy.com,https://plus.google.com/111749552663635945392,
https://www.youtube.com/user/neumank9academy/about,Neuman K-9 Academy Inc.,9991,6551497,Neuman K-9 Academy is the countries leading provider of dog boot camps puppy training and service dog training.   We are located in Hugo Minnesota just north of St. Paul and Minneapolis. For more information visit us online at www.mndogtraining.com,online at www.mndogtraining.com,http://www.mndogtraining.com,
https://www.youtube.com/user/CBS/about,CBS,800485,1212620473,Welcome to the official CBS YouTube channel to see clips from your favorite shows! Don't forget to subscribe!,null,http://www.cbs.com,https://www.facebook.com/CBS?fref=ts,https://twitter.com/CBS,https://itunes.apple.com/us/app/cbs/id530168168?mt=8,https://www.instagram.com/cbstv/,http://www.cbssports.com/,http://www.cnet.com/,http://www.gamespot.com/,http://www.chow.com/,http://www.cbs.com/mobile?ttag=mktg_CBSapp_link_youtube,https://plus.google.com/101840326086992367163,
https://www.youtube.com/user/pradeepgiruba/about,pradeepgiruba,4668,1632774,Ambassador of Jesus Christ Join our Fastest Growing prayer team www.fb.com/groups/prayerpowerteam,null,https://plus.google.com/114293195439475383253,
https://www.youtube.com/user/TheBrandDetective/about,TheBrandDetective,605,132843,Nikki Dean is the Brand Detective - on a mission to investigate gadgets gizmos Brands Bargains and new products -- Providing no nonsense Gadget and Tech Reviews Money Saving tips Retail and Tech news and funny business :)  Featuring fellow gadget spies including the lovely Kell Allen.,null,http://www.thebranddetective.com,https://plus.google.com/103600684414309393728,
https://www.youtube.com/user/abbtech/about,abbtech,6260,17155752,Videos that are featured on Hacked Gadgets. http://hackedgadgets.com,null,http://hackedgadgets.com,https://plus.google.com/105680081018208657027,
https://www.youtube.com/user/JeffMaherNews10/about,Jeff Maher,398,697614,null,null,https://plus.google.com/103113060149611866126,
https://www.youtube.com/user/mwbforme/about,My Well-Being presented by Humana,2008,497828,My Well-Being Powered by Humana is your guide to getting started on the path to complete well-being in every aspect of your life—health and money people and play.  Learn more at www.mywell-being.com,more at www.mywell-being.com,http://mywell-being.com,http://facebook.com/mwbforme,http://Twitter.com/mwbforme,http://pinterest.com/mwbforme/,https://plus.google.com/104596771695464368177,
https://www.youtube.com/user/AnnaAkana/about,Anna Akana,1817174,118411342,New videos every Thursday. They usually feature one of my six cats.  --  Management - The Coronel Group Leanne Coronel & Tom Spriggs  Theatrical - UTA  Ty Flynn & Ali Barash,null,http://www.AnnaAkana.com,http://www.twitter.com/annaakana,http://instagram.com/annaakana,https://plus.google.com/112890310355308032044,
https://www.youtube.com/user/grav3yardgirl/about,grav3yardgirl,7994952,1354773277,GRAV3YARDGIRL PO BOX #2263 PEARLAND TEXAS 77588  † JOSHUA 1:9  BUSINESS ONLY e-mail me at: bunnymeyer@gmail.com,bunnymeyer@gmail.com,http://www.swampmerch.com,http://instagram.com/grav3yardgirl,http://www.facebook.com/grav3yardgirl,http://twitter.com/grav3yardgirl,http://www.grav3yardgirl.com,https://plus.google.com/113110385946381901538,
https://www.youtube.com/user/petopiashow/about,Petopia,1776,203378,Everyone wants to pamper their pet but there are so many products out there that it's impossible to try them all without wasting time and money. Fear not!  Join us on Petopia as Sarah Lane tests out the most interesting and exciting pet products on the market to help pet owners decide what to purchase for their beloved pet. We test the latest pet products...so Fluffy and Fido don't have to be the guinea pigs!  New episodes posted every Thursday  Subscribe here: http://youtube.com/subscription_center?add_user=petopiashow  Watch more Petopia on Animalist at: http://animalist.com/petopia  Follow Petopia on Twitter http://twitter.com/petopiashow  Like Petopia on Facebook https://www.facebook.com/pages/Petopia/584833308239691?ref=hl  Add Petopia on Google+ https://gplus.to/petopia,null,http://animalist.com/petopia,https://www.facebook.com/pages/Petopia/584833308239691?ref=hl,https://twitter.com/petopiashow,https://www.facebook.com/pages/Petopia/584833308239691,http://twitter.com/petopiashow,https://gplus.to/petopia,https://plus.google.com/100761867083193764125,
https://www.youtube.com/user/tvkchaitanyayadav/about,Dogs 101,21255,9160761,Dogs 101 Dog videos Funny Dog videos top 10 Dogs top 10 videos,null,https://plus.google.com/115861771375678080226,
https://www.youtube.com/user/STAtopreviews/about,STA Videos,67,40202,null,null,https://plus.google.com/103585382070178657880,
https://www.youtube.com/user/stampylonghead/about,stampylonghead,8480306,6026981707,Hello. Welcome to my channel. My name is Stampy. I upload lets plays on a variety of different games including one Minecraft video every day. I always have fun making my videos and if you decide to stick around hopefully you will too.  - Mr. Stampy Cat.  FAQ:  Q. Are you Stampylongnose or Stampylonghead?  A. Both Just call me Stampy.   Q. Where are you from?  A. England.   Q. Can you add me to your love garden?  A. I don't add people that ask I am afraid.   Q. When will your next Minecraft video be out?  A. New video every day.  Q. How do you record your videos? A. Elgato HD Game Capture.  Q. Would you like a cake?  A. Yes please.  Twitter - @stampylongnose  Facebook - www.facebook.com/stampylongnose  Instagram - https://www.instagram.com/stampycatyt,null,http://www.facebook.com/Stampylongnose,https://twitter.com/stampylongnose,https://plus.google.com/102183245191097332237,
https://www.youtube.com/user/AttitudeIncTv/about,AttitudeIncTv,15721,20491259,Attitude Inc is an independent street wear and urban clothing store which supplies most unique and highest quality items the industry has to offer.   Stocking all major brands from Adidas Originals to Obey Attitude Inc provides a constantly evolving range of t-shirts trainers jackets watches and cutting edge headphones and accessories - to serve up a real and stylish alternative to the mundane and mass-produced fashion of the high street.   Attitude Inc's independent roots see the clothing as born from the street for the street showcasing the talent and flair of urban culture.  www.attitudeinc.co.uk,null,http://www.attitudeinc.co.uk,https://plus.google.com/109993426302099764832,
https://www.youtube.com/user/wootchannel/about,wootchannel,6782,5647668,Welcome to the official YouTube channel of Woot.com featuring some of the least informative product tests in online retail. Also puppet shows.,null,http://woot.com,https://www.facebook.com/woot,https://twitter.com/woot,https://plus.google.com/103723650610572195701,
https://www.youtube.com/user/TeeTwyford/about,Tee Twyford,29,103482,null,null,https://plus.google.com/100645360137982367790,
https://www.youtube.com/user/CoolKarmaVideo/about,CoolKarmaVideo,2101,1762886,Welcome to CoolKarma ...  When was the last time you took a moment to laugh share your dreams connect with a friend or consider new possibilities?  http://www.CoolKarma.Com,null,http://www.coolkarma.com,https://plus.google.com/114029403627922674338,
https://www.youtube.com/user/BuzzFeedVideo/about,BuzzFeedVideo,12461879,9972668677,BuzzFeed Motion Picture’s flagship channel. Sometimes funny sometimes serious always shareable. New videos posted daily!,null,http://bzfd.it/2cphJeo,https://www.facebook.com/BuzzFeedVideo,http://twitter.com/buzzfeedvideo,http://www.buzzfeed.com/,https://www.youtube.com/playlist?list=PL5vtqDuUM1DmODGWPy7-eEn3VjJALGApT,https://plus.google.com/116847826345074596313,
https://www.youtube.com/user/AFP/about,AFP news agency,133991,182215102,AFP is a global news agency delivering fast in-depth coverage of the events shaping our world from wars and conflicts to politics sports entertainment and the latest breakthroughs in health science and technology.,null,http://www.afp.com/en,http://www.facebook.com/AFPnewsenglish,https://twitter.com/#!/AFP,http://afp-photo.tumblr.com/,https://plus.google.com/117462650312578408001,
https://www.youtube.com/user/rchrdcrg/about,Richard Craig,237,52460,I'm a freelance musician helping to carry the torch for the oldschool MOD tracking scene. All of my music is composed in Impulse Tracker format using OpenMPT. I'm highly interested in working on original music for YouTube shows and video games especially mobile games. If anyone would be interested in my services I'd love to hear more! I'm also a huge retrogame geek and have been enjoying emulators since 1997. Comments are always welcome and very much appreciated. Thanks for visiting my channel!,null,http://www.facebook.com/rchrdcrg,http://plus.google.com/b/106622544974069399702/,http://soundcloud.com/rchrdcrg,https://plus.google.com/112794221193497706986,
https://www.youtube.com/user/adric22/about,The 8-Bit Guy,493178,52855398,A computer video series focusing mainly on retro technology from the 80's 90's and 2000's. However once or twice a year I'll create something totally "out there."  My main goal at this point is to make educational content about retro technology that is interesting and engaging.  Some people will be re-living their childhood while others will be experiencing the technology for the first time.   You can help support this channel and content by donating $1 per month on Patreon: https://www.patreon.com/8BitGuy1,null,http://www.facebook.com/the8bitguy,http://www.patreon.com/8BitGuy1,https://plus.google.com/105790671673371436573,
https://www.youtube.com/user/desencaixotando/about,desencaixotando,73,124200,unboxing everything,null,https://plus.google.com/114575498066091090267,
https://www.youtube.com/user/gadgetsPL/about,gadgetsPL,39,154773,www.gadgets.pl to internetowy sklep z nietypowymi gadżetami,null,http://www.gadgets.pl,http://www.na-prezent.pl,
https://www.youtube.com/user/TheOfficialGadget/about,Inspector Gadget,8209,2955837,Welcome to the OFFICIAL Inspector Gadget Channel  Inspector Gadget is the world's first bionic policeman.  Our bumbling detective is equipped with an incredible array of gadgets to help him in his never-ending battles against crime and corruption.,null,https://plus.google.com/116162641481097194985,
https://www.youtube.com/user/fastfuriousandfunny/about,Fast Furious & Funny,343110,42168574,Fast Furious & Funny - Brand new videos every single week!,null,http://www.facebook.com/FastFuriousFunny,https://twitter.com/FFF_TheChannel,https://plus.google.com/112768060922060534000,
https://www.youtube.com/user/nonstophonolulu/about,Nonstop Honolulu,879,741204,Entertainment eating and event videos from Honolulu Hawaii and beyond!,null,http://www.nonstophonolulu.com,https://plus.google.com/100556550788663433355,
https://www.youtube.com/user/texastvman24/about,texastvman24,1,4531,null,null,https://plus.google.com/108343091497849604237,
https://www.youtube.com/user/FLOSSYCARTER/about,Flossy Carter,603346,93794844,HOME OF THE REAL REVIEWS HARDCORE TECH http://www.facebook.com/FlossyCarter INSTAGRAM: Flossy_Carter TWITTER: Flossycarter Google+: Flossy Carter PSN: Ciroc__Obama__,null,https://www.facebook.com/pages/Google-Gangstas/204634992926627?ref_type=bookmark,http://www.instagram.com/Flossy_Carter,https://twitter.com/FlossyCarter,http://amzn.to/1zZ2y4P,www.snapchat.com/flossy_carter,https://plus.google.com/109483273697059763164,
https://www.youtube.com/user/kipkay/about,kipkay,2621665,648354920,The most amazing hacks pranks and how-to videos in the world! Check out my website: http://www.kipkay.com Parts and Project Documents: http://www.kipkay.com.,null,http://kipkay.com,https://www.facebook.com/KipkayVideos,https://twitter.com/#!/kipkay,https://plus.google.com/u/0/109046442675811528997/posts,http://kipkay.com/parts/,http://kipkay.com/docs/,https://plus.google.com/104535574357773526301,
https://www.youtube.com/user/lostsouljaxx978/about,lostsouljaxx978,227,44495,my name danny i and i am from lowell mass..i love to play bball krump play yugioh..go to church and all other kinds of stuff..i like to make music and upload video..i will be posting videos up soon so be patient..if u wanna know anything more about me get at me on my aim either imfam0usking or lostsouljaxx978..for u yahoo folks my sn is drod1210..and for the windows live folk..my sn is datruth978@live.com,datruth978@live.com,http://myspace.com/drod1210,https://plus.google.com/109262187250145722098,
https://www.youtube.com/user/CarThrottle/about,Car Throttle,1593089,208229929,Car Throttle is the Internet's car community.  We're one of the fastest growing YouTube channels for the next generation of young car fans. With over 1 MILLION fans on Facebook we think you'll enjoy the videos we've got including: Readers' Rides Car Trivia Reviews and 2 Guys 1 Car!  Subscribe now so you don't miss a thing. And if you want to get in touch email teamct@carthrottle.com. All messages will be read!,teamct@carthrottle.com,http://www.carthrottle.com,http://facebook.com/carthrottle,http://twitter.com/carthrottle,http://www.carthrottle.com/shop,http://instagram.com/carthrottle/,https://plus.google.com/106573372486785624716,
https://www.youtube.com/user/CATSPod/about,Seth Dolcy,9,4123,null,null,https://www.facebook.com/groups/comicstotheworld/,https://plus.google.com/103621811202864448492,
https://www.youtube.com/user/dhxretrotv/about,Space Ranger Roger & Friends,21292,15496565,Welcome To Space Ranger Roger and Friends!  Here you can enjoy all your favourite Space Ranger Roger full episodes compilations and clips for everyone to enjoy.  Space Ranger Roger is a plucky little alien hero sent to help a strange faraway world…Earth! No assignment is too big or too small. Roger’s motto is “A friend in need is a mission for me!” Along with his trusty squad of Ranger Bots and his bot dog Rover Roger can always get the job done.   Each day Roger scans the surface of our small blue planet from orbit aboard the Friend Ship. When he picks up a distress signal from an Earth creature it’s his job as a Space Ranger to gear up with his team of rambunctious fix-it bots find out what the problem is and save the day in a fun and creative way.  Dont Forget To LIKE | COMMENT | SHARE | SUBSCRIBE   https://www.youtube.com/channel/UCRxpEdsmC7dojrESS_r5o9A?sub_confirmation=1,null,http://www.dhxmedia.com/shows/space-ranger-roger-2/,https://plus.google.com/116340882201922215781,
https://www.youtube.com/user/halloweenpropsuk/about,Creative Vlogs,17015,2421529,Hi Im Sharon a British You Tuber Vlogger from East Sussex I Love creating Videos and just having a crazy fun time with it!  Welcome to my Fun Channel  * Subscribe for Twice weekly uploads *  SEE PATREON (for exclusive extras) https://www.patreon.com/creativevlogs  Cameras I Use Canon G7X & DJI Phantom 4 I Pad Mini 4 Using Mac Book I movie  SOCIAL MEDIA https://www.facebook.com/creativefilmsyoutube/ https://twitter.com/GiveawayGirl2 http://creativevlogs.tumblr.com/ https://www.flickr.com/photos/1391984... https://www.pinterest.com/giveawaygirl1/  Business enquiries thefuncompany@aol.com,thefuncompany@aol.com,https://twitter.com/GiveawayGirl2,https://plus.google.com/101365526218524789799,
https://www.youtube.com/user/CraNikV/about,CraNikV,313,857825,Сюжеты и репортажи. Специальные и случайные. Познавательные и необходимые. Всё что сняла матрица - здесь! Лошадки и Пёсики коптеры и автомобили природа и пейзажи. Всё здесь!,null,http://epngo.bz/cashback_index/nwjwsd,http://join.air.io/cranik,https://plus.google.com/102315081725267650096,
https://www.youtube.com/user/Matthiasiam/about,Matthias,2940111,494359091,Comedy unboxing videos made in LA!  Email below for business/branding inquiries only. :),null,http://www.twitter.com/matthiasiam,http://www.instagram.com/matthiasiam,
https://www.youtube.com/user/ericcalisto/about,Eric Matthew,3337,509556,EricMatthew is a channel dedicated to the top 10 of almost everything! I post the top 10 weird diseases highest-grossing movies disney world secrets family guy facts and more! I post a new video at least twice a week!  Subscribe so you don't miss out. Feel free to send us questions comments etc. Remember we donate a cup of dog or cat food for every subscriber we receive! Donations are made quarterly.  I sometimes make compilations of Vines GIFs funny videos etc. I do my best to get rights to the material but sometimes it is extremely hard to trace back to the owner. If you have a copyright concern please email me and I will get it taken care of ASAP.,null,http://www.youtube.com/user/ericcalisto?sub_confirmation=1,https://twitter.com/ericmatthewyt,http://facebook.com/ericmatthewyt,https://instagram.com/ericmatthewyt/,https://plus.google.com/106744143622378462935,
https://www.youtube.com/user/mkohl40/about,Mkohl40,58187,28191932,Welcome to MKohl40. It is our mission to bring you the best Yugioh content we can deliver!,null,http://www.mkohlgames.com/,http://www.facebook.com/mkohl40,https://www.twitch.tv/zodiacduelisttv,https://www.patreon.com/MKohl40,https://plus.google.com/101427280359974314055,
https://www.youtube.com/user/sohoinsights/about,sohoinsights,43,6457,Home Office Lifestyle features the mother/daughter team Kathy and Jenn talking about the latest trends tips and tools for home based business owners.  More at http://ovaleye.tv. Tweet us http://twitter.com/ovaleyetv,null,
https://www.youtube.com/user/sonyelectronics/about,Sony,253777,29823745,The Official YouTube Channel for Sony Electronics in the United States.,null,http://sony.com,http://www.facebook.com/Sony,http://www.twitter.com/SonyElectronics,http://www.pinterest.com/SonyElectronics,http://www.instagram.com/Sony,https://plus.google.com/107316151152900332757,
https://www.youtube.com/user/BackFlash2K/about,Digihaven,276,206228,We love cats and cats love you!,null,https://www.youtube.com/channel/UCpOWFb0tBMygqxfxRadIDag,https://plus.google.com/111354577686827485322,
https://www.youtube.com/user/chadwildclay/about,Chad Wild Clay,1316109,226989447,I use ninja weapons to slice fruit & soda. I guess you could call me a Fruit Ninja in real life. I've tested weapons from Mortal Kombat WWE Shadow Fight 2 Teenage Mutant Ninja Turtles Assassin's Creed and more.  I also love roasting YouTubers doing YouTuber impressions & singing parody songs. All my videos are jokes and are just for fun. I like all the YouTube video creators I parody react to and roast. So if it seems like I'm angry with a YouTuber I'm only pretending. Some of the people I've roasted or made a parody song of are PewDiePie Matthias Jacksepticeye Markiplier Leafyishere Casey Neistat Scarce RiceGum Misha / Mishovy silenosti Webs & Tiaras Keemstar on Drama Alert Marina Joyce NigaHiga DanTDM Guava Juice Smosh and more.   Chad Wild Clay,null,http://www.youtube.com/subscription_center?add_user=chadwildclay,http://twitter.com/chadwildclay,http://www.facebook.com/chadwildclay,https://www.google.com/url?sa=t&rct=j&q=&esrc=s&source=web&cd=1&cad=rja&uact=8&ved=0CB4QFjAAahUKEwiZ8P7u_qfHAhVGmogKHcvPAAI&url=https%3A%2F%2Fopen.spotify.com%2Fartist%2F48TS8a0wo5yMUbcAsEQ7Zd&ei=vpDNVZmZIsa0ogTLn4MQ&usg=AFQjCNEnhee8i4A7nJ_UtY2NZPUO8XyeQA&sig2=IPAKnubwbYRfeEMa5GpIiw&bvm=bv.99804247,d.cGU,https://instagram.com/chadwildclay/,https://itunes.apple.com/artist/chad-wild-clay/id519894522?ign-mpt=uo%3D4,https://plus.google.com/106500764643743042982,
https://www.youtube.com/user/choopuchy/about,choopuchy,null,0,null,null,
https://www.youtube.com/user/TechFeeed/about,TechnoProtocol,2187,502172,Hai ! Thank You Very Much For Checking Out My Channel. In This Channel You Can Find The Videos Related  To Tech Tutorials Tech Tips & Tricks Gadgets Technology Facts And Best Android App's & Games Etc. I will Try My Level Best To Provide Informative Content about Technology On This Channel. So Stay Subscribed   ➨  Its All About Technology  ➨ Tech Videos  ➨ Reviews  ➨ How To's And More....  ➨ Subscribe It's Free Why Not...,null,https://www.youtube.com/user/TechFeeed,http://www.technoprotocol.com,http://instagram.com/abusufiyangeek,https://www.facebook.com/technoprotocol/,https://twitter.com/abusufiyangeek,https://plus.google.com/105182762042218611980,
https://www.youtube.com/user/iDubbbzTV/about,iDubbbzTV,4333350,517938153,WHO WE ARE AND WHAT WE DO The Arby's brand purpose is to "inspire smiles through delicious experiences." Arby's delivers on its purpose by celebrating the art of Meatcraft™ with a variety of high-quality proteins and innovative crave-able sides such as Curly Fries and Jamocha shakes. Arby's Fast Crafted™ restaurant services feature a  unique blend of quick-serve speed combined with the quality and made-for-you care of fast casual.  Arby's Restaurant Group Inc. is the franchisor of the Arby's Brand and is headquartered in Atlanta Ga.  DISCLAIMER: Daniel Keem a.k.a KEEMSTAR did not create nor does he possess or have access to any part of this channel.  Website: idubbbz.com  Twitter: Twitter.com/idubbbz Facebook: Facebook.com/idubbbz,null,http://www.idubbbz.com,https://twitter.com/Idubbbz,http://www.facebook.com/IDubbbz,http://idubbbz.spreadshirt.com/,https://www.instagram.com/idubbbz/,https://plus.google.com/103544784061253550320,
https://www.youtube.com/user/Mrpompousmoustache/about,Noodle Cat,788,331235,THIS CHANNEL IS CURRENTLY UNDERGOING RENOVATIONS  **New videos and theme will be uploaded in a month**  Thank you for waiting while these renovations are going on.  See you soon!,null,https://plus.google.com/106905922684845580816,
https://www.youtube.com/user/GameHopping/about,GameHopping,11303,4065756,Greetings! My Channel has PC and Mobile gaming content. Much of it padded with humor. Come on down and have a look.,null,http://www.gamehopping.com/,https://twitter.com/GameHopping,https://plus.google.com/114821175772973563025,
https://www.youtube.com/user/NCIXcom/about,NCIX Tech Tips,1112189,224578533,Official NCIX.com Channel - Reviews & Tutorials,null,http://www.ncix.com,http://www.facebook.com/NCIXdotCOM,http://twitter.com/NCIXdotCOM,https://instagram.com/NCIXdotCOM/,http://pinterest.com/source/ncix.com/,https://plus.google.com/113775689853175075445,
https://www.youtube.com/user/WildlifeGadgetman/about,Wildlife Gadget Man,878,307267,null,null,https://plus.google.com/112195584512863157407,
