https://www.youtube.com/user/MovieManiacsDE/about,moviemaniacsDE,We bring you the best movie trailers let you sit in on exclusive one-on-one interviews with Hollywoods greatest stars and take you onto the red carpet and behind-the-scenes of the biggest movies.,http://www.moviemaniacs.de,http://www.facebook.com/moviemaniacsDE,https://plus.google.com/111044543246328158957,
https://www.youtube.com/user/DespicableMeMovie/about,Illumination,Connect with Illumination Entertainment Online:  Like Illumination Entertainment on FACEBOOK:  http://bit.ly/IlluminationEntFB Visit the Illumination Entertainment WEBSITE:  http://www.minionsmovie.com,http://www.singmovie.com,https://www.facebook.com/singmovie,https://twitter.com/singmovie,http://instagram.com/singmovie,https://plus.google.com/110677721563930903522,
https://www.youtube.com/user/movieclips/about,Movieclips,The Fandango MOVIECLIPS channel is the largest collection of licensed movie clips on the web. We are HUGE movie fans. We love films so much that our genome team has gone through hundreds of movies to pick out the best moments scenes and famous lines from all of your favorite films. Whether it's an action comedy drama western horror film or any other genre Fandango MOVIECLIPS has the unforgettable moments that stay with you long after you leave the theater.,https://www.youtube.com/movieclipstrailers,http://movieclips.com,http://www.facebook.com/movieclips,https://twitter.com/MOVIECLIPS,http://pinterest.com/movieclips,http://instagram.com/movieclips,https://www.youtube.com/channel/UC3gNmTGu-TTbFPpfSs5kNkg?sub_confirmation=1,https://vine.co/Fandango,https://plus.google.com/110315793794015517463,
https://www.youtube.com/user/UnboxingSurpriseEgg/about,Surprise Eggs unboxing toys,Stop Motion Play Doh videos Kinder surprise eggs Superheroes elsa Frozen Gummy Bear Family and much more. Have fun! http://www.youtube.com/subscription_center?add_user=UnboxingSurpriseEgg,https://www.youtube.com/playlist?list=PL8T-DLVxbPhT0gKohKrU74QsgQHkTKIvj,https://www.youtube.com/channel/UCaOsf5MA8uAEJuiyDxoLbeg,http://www.youtube.com/user/LaBabyMusica,https://plus.google.com/116863180060586372991,
https://www.youtube.com/user/ThePetCollective/about,The Pet Collective,The Pet Collective is home to the top trending clips most entertaining memes and funniest animal videos online.  Simply put we think animals are the best ever. If you agree let’s make it YouTube official right here right meow: Subscribe here - http://tpc.tv/1Qd1gdP  We welcome your video submissions for use on our channel! Submit your fun pet videos here: http://bit.ly/32-submit-here  For inquiries regarding advertising or brand partnerships email advertise@jukinmedia.com   The Pet Collective is owned and operated by Jukin Media,https://submit.thepetcollective.tv/?utm_source=youtube&utm_medium=banner&utm_campaign=submission#submit-video,http://www.facebook.com/thepetcollective,http://pinterest.com/petcollectivetv/,http://www.instagram.com/petcollectivetv,http://thepetcollective.tv,https://plus.google.com/111797746508558281499,
https://www.youtube.com/user/Theoatrix/about,Theoatrix OSRS,Welcome to the Theoatrix Channel! I create Oldschool Runescape videos focused mainly on Money Making Guides and Skill Guides as well as some other random cool videos!    Inbox if you have any questions about anything shoot me an email!,http://youtube.com/theoatrix/subscribe,https://www.twitter.com/theoatrix/,https://twitch.tv/theoatrix_osrs,https://plus.google.com/114105016769533818677,
https://www.youtube.com/user/moviesinsights/about,Movies Insights,Interesting stuff about cinema world  NEW VIDEO EVERY 8 HOURS (3 New Daily Videos),https://www.facebook.com/moviesinsightspage,https://plus.google.com/108810013792391432394,
https://www.youtube.com/user/ScreenSlam/about,ScreenSlam,We are an Entertainment channel that features Hollywood interviews premieres behind the scenes of movies & TV press conferences award shows film festivals and more. Our content is made up of original videos and stuff that the studios send us. We might not have the millions of dollars backing us like some of the big guys but we make up for that by being quick and caring about our subscribers.  Thanks for checking out our YouTube page!  - The ScreenSlam Team,http://www.screenslam.com,https://twitter.com/#!/Screenslam,https://www.facebook.com/pages/Screenslam/152999188075199?ref=ts&fref=ts,https://instagram.com/screenslam,https://plus.google.com/111658631103674573004,
https://www.youtube.com/user/chadalantoys/about,Chad Alan,About Chad Alan : Hello! I am a toy collector who loves to share my collection and hobby with the world! I collect and unbox tons of things such as Surprise Blind Bags Dolls Toys Playset Reviews Disney Princess Dolls Play Doh Disney Tsum Tsum Mystery Minis  Mystery Toys Frozen My Little Pony and so much more!  I also make some crafts for dolls and other random things. I also do fun youtube challenges with friends hauls and random vlogs! Business e-mial : chadeboi20@gmail.com,http://instagram.com/chadalanofficial,http://www.facebook.com/pages/Chad-Alan/197210503680115,https://twitter.com/MHCollector,https://plus.google.com/102581505388500834533,
https://www.youtube.com/user/animalztv4u/about,Animalz TV,This channel is created for the people who love animals. We collect and publish videos about cute dogs and cats (even more cute are puppies and kitten).  We release at least two new videos in a week ---  On Mondays - Funny Animal Compilations Stay with us to watch new videos about adorable pets and animals. Our videos include: cat videos funny dogs funny pets puppies and kitten funny monkeys cute owls cute baby animals best animals compilation cute and funny animals and much more.   You can also send us your videos to Animalz TV and it will be featured on our channel and will seen by lots of animal lovers.  Please Submit your videos at: http://www.animalztv.net/submit-video/  We respect other people's copyrights but sometimes happens that other people's videos are in our compilations without their permission in such situation the author should contact us and we will remove it immediately.,http://www.animalztv.net/submit-video/,http://goo.gl/O97FCe,https://twitter.com/AnimalzTVv,https://www.facebook.com/animalztv4u,http://animalztv.net,https://plus.google.com/109357051925508382516,
https://www.youtube.com/user/TheDodoSite/about,The Dodo,The Dodo on Youtube is place for everyone who loves animals and cares about their wellbeing. Our goal is to make caring about animals a viral cause. We want our fans to fall in love with animals have fun and be entertained while they’re doing it and feel empowered to help animals in need.,https://www.thedodo.com,https://www.facebook.com/thedodosite,https://instagram.com/thedodo,https://twitter.com/dodo,https://www.snapchat.com/add/thedodo.com,
https://www.youtube.com/user/SqueakerAlert/about,TOP 5 ALLTIME,We upload daily TOP 5 Videos  If you have a topic request please contact us using our business email bellow.,https://www.youtube.com/channel/UC4HLj1huw4mvCL6QTezaSog,https://twitter.com/CommunityVideos,https://plus.google.com/115726502556915197811,
https://www.youtube.com/user/MommyandGracieShow/about,MommyandGracieShow,Hi! We are Mommy and Gracie a 13 year old girl and her mom who love dolls and toys.  We are huge fans of Monster High Ever After High Barbie and American Girl Dolls.  We are also Shopkins and Shoppies collectors! Gracie is into a bunch of fandoms including Five Nights at Freddy's Undertale The Phandom of Dan and Phil and Steven Universe. She is always throwing references to her fandoms into our videos and she is super funny.  Mommy has never grown up and she has collected dolls her whole life.    We pride ourselves on being real and honest and we never do re-takes or scripts.  We just let the camera roll and have fun!  As we like to say we are #SoProfesh  You won't find fancy editing and special effects here.  Just lots of laughs for the whole family!   Instagram: http://instagram.com/mommyandgracieshow Twitter: https://twitter.com/mommyandgracie Facebook: https://www.facebook.com/MommyandGracieShow,https://www.facebook.com/MommyandGracieShow?ref=hl,http://instagram.com/mommyandgracieshow,https://twitter.com/mommyandgracie,https://www.youtube.com/channel/UCMJMQpisAsHo-VsrWqBpNOg,https://www.youtube.com/channel/UC28hHuZTVHHg1GlmDDYfOVA,https://plus.google.com/115767152075462257058,
https://www.youtube.com/user/LinfairRecords/about,福茂唱片,福茂唱片音樂股份有限公司（ Linfair Records Ltd. ）由創辦人張人鳳先生成立於 1961 年，並於同一年取得世界最大古典音樂廠牌之一 -- Decca 的台灣區代理權。  1992 年，當時的 Decca 母公司 - 國際寶麗金唱片集團（ Polygram International ）買入百分之六十福茂股權，福茂唱片也同時加入了國際寶麗金唱片集團，福茂唱片的英文名稱因此改為 Decca Records Taiwan Ltd.。 2002 年，張耕宇先生及張霄芸女士向國際環球唱片集團（由於寶麗金唱片已於 1998 年被環球併購）買回其擁有的百分之六十福茂股權，福茂唱片又再度回到了100% 的獨立唱片公司，而英文名字又改回最初的 Linfair Records Ltd.。  雖然脫離了環球，但福茂仍然繼續在台代理 Decca。另外，福茂唱片還代理美國高音質獨立廠牌 Chesky 以及許多歐洲獨立廠牌.  福茂唱片除了代理國外廠牌外，於 1986 年開始發展國語流行歌曲，先後捧紅了許多台灣本地及香港、大陸地區的歌手，例如庾澄慶、邰正宵、林隆璇、黃舒駿、王菲、那英、范曉萱、王力宏、蘇永康、陳慧琳、許志安、周蕙 ... 等．近年福茂仍然繼續大力在國語歌曲市場發展，除了簽入高知名度藝人歌手外，也不斷培養全新歌手．近年成功推出的歌手藝人有范瑋琪、韋禮安、陳妍希、郭靜、張韶涵、曾沛慈、吳汶芳、畢書盡、朱俐靜、陳勢安、曾靜玟、陳彥允、李玉璽、法蘭黛樂團、李唯楓、王笠人 ... 等歌手。  福茂唱片的位置：http://goo.gl/zpRbSN,https://www.facebook.com/LinfairRecords,http://weibo.com/u/3912096225,https://itunes.apple.com/tw/album/%E6%A5%B5%E6%A8%82%E4%B8%96%E7%95%8C%E5%85%A8%E5%89%B5%E4%BD%9C%E5%B0%88%E8%BC%AF/id1218156441,https://instagram.com/linfairrecords/,http://www.facebook.com/Claire.fans?fref=ts,https://www.facebook.com/Weibird.official?ref=ts&fref=ts,http://www.facebook.com/eagleBii,https://www.facebook.com/ohyeahpetsofficial,https://www.facebook.com/hi.jingwen,https://www.facebook.com/FanFan.official?ref=ts&fref=ts,https://www.facebook.com/WenFangWenGo/?fref=pb&hc_location=profile_browser,https://www.facebook.com/Ian0204/?fref=ts,https://www.facebook.com/dino0331/?fref=ts,https://plus.google.com/115368732168801182471,
https://www.youtube.com/user/TheEnglishSimmer/about,TheEnglishSimmer,Hi there  I enjoy procrastinating by playing The Sims and recording it for you guys to (hopefully) enjoy. Sometimes I even go as far as playing other games for entertainment.  I am obliged to say that if you aren't subscribed already then you should.  WEBSITE: http://theenglishsimmer.com TWITTER: http://twitter.com/EnglishSimmer  Current LPs: Get To Work The Young'Uns The Asylum Challenge Life Is Strange Game Of Thrones Minecraft Story Mode  Completed LPs: Late Night Gone Home University Life The Novelist Among The Sleep Generations/S2 Wolf Among Us Supernatural The Sims 4 Ambitions Runaway Teen   ---------------------------  Computer Specs  INTEL® Core™ i7-4790 Quad Core 3.60 GHz  NVIDIA GeForce GTX 780 3GB  16GB RAM  HDD:128 GB Corsair Series GS SATA III Gaming MLC Solid State Disk  HDD2:2TB SATA-III 6.0Gb/s 64M Cache 7200rpm Hard Drive  Microsoft® Windows 8.1 Pro (64-bit Edition),http://mypage.thesims3.com/mypage/mollie_x,http://twitter.com/EnglishSimmer,http://instagram.com/EnglishSimmer,http://theenglishsimmer.com,https://plus.google.com/107468375782981162532,
https://www.youtube.com/user/CookieSwirlC/about,CookieSwirlC,◕‿◕    Hi Cookie Fans!!!   Welcome to the sweet world of Cookieswirlc a unique toy channel bursting with super happy positive family friendly videos inspired by sugary cute toys like Disney Frozen Princesses mermaids Littlest Pet Shop LPS My Little Pony MLP Lego Barbie dolls Play Doh Monster High Shopkins and much muchy more!!! Everything from stories movies playset toy reviews hauls blind bag openings toy unboxing and fun do it yourself crafts!   Are you subscribed? It's FREE!!! Don't miss out on all the fun!!!!  Toys are donated to charity and given to Cookie Fans  www.cookieswirlc.com  Friend Cookieswirlc on Instagram @cookieswirlc https://instagram.com/cookieswirlc/  Cookieswirlc does Not have Facebook Snapchat Skype or any other social media.,http://www.cookieswirlc.com,http://instagram.com/cookieswirlc,http://cookieswirlc.spreadshirt.com/,https://plus.google.com/101851096110463521121,
https://www.youtube.com/user/cbstvdinsideedition/about,Inside Edition,Inside Edition is television's longest-running top-rated and most-honored syndicated newsmagazine.,http://www.insideedition.com/,https://www.facebook.com/Inside.Edition,https://twitter.com/insideedition,https://instagram.com/insideedition/,https://plus.google.com/104304424115513428440,
https://www.youtube.com/user/PopularMMOs/about,PopularMMOs,Your source for epic Minecraft content!  Don't forget to subscribe! - Minecraft Mob Battles and Arena Battles - Epic Modded Let's Plays - Mod Showcases - Minecraft Mods Vs Maps   http://popularmmos.com for Minecraft Mods,https://represent.com/store/popularmmos,https://www.instagram.com/popularmmospat/,http://www.twitter.com/popularmmos,http://www.facebook.com/pages/PopularMMOs/327498010669475,http://popularmmos.com/minecraftmods/,http://popularmmos.com/faq,https://plus.google.com/117264274555588384493,
https://www.youtube.com/user/tylerrugge/about,Tyler Rugge,Hello everyone! My name is Tyler Rugge and I make random videos and put them on the internet ;D   PO Box Address:  Tyler Rugge 511 Olde Towne Rd #81274 Rochester MI 48308,http://trugge.tumblr.com,http://instagram.com/tylerrugge,https://twitter.com/Tylerrugge,https://www.facebook.com/TylerRuggeOfficial,https://snapchat.com/add/trugge,https://plus.google.com/117133095020469707357,
https://www.youtube.com/user/HobbyKidsTV/about,HobbyKidsTV,The inventor of GIANT SURPRISE EGGS! The only brand trusted by families since 2013. We share learning fun and popular toy reviews by kids for kids! Subscribe its free + supports our channel.   Q. Who made the FIRST BIGGEST Surprise Egg?  A. WE DID! It was our kids idea first published on 12-9-2013.  Q. What do you do with the toys?  A. We donate lots of toys featured we also give them as gifts to HobbyFriends in our local community. HobbyKids love to share the fun!   Q. Is your channel kid-friendly?  A. YES! We take pride in keeping a clean unique channel for families of all ages. We are parents and know the importance of having a safe place for viewing. Importantly we speak native English which guides children's communication skills.  Q. Do you play Video Games?  A. YES! Visit our channels: HobbyPigTV and HobbyFrogTV  Q. Do you have extra shows?  A. YES! Visit: HobbyFamilyTV  Q. Do you have a channel for learning?  A. YES! Visitl: HobbyBabyTV,http://youtu.be/ojvpRfYe7Mk?list=PLzDMAGLsSlZoNvpGg-ijs4DlYu2RMSOxo,http://www.twitter.com/hobbykidstv,https://www.facebook.com/HobbyKidsTV/,http://a.co/185BVz3,https://shop.spreadshirt.com/HobbyKidsTV/,http://www.google.com/+HobbyKidsTV1,http://astore.amazon.com/hobbykids-20,http://www.HobbyKids.net,http://www.youtube.com/user/hobbygamestv,http://www.pinterest.com/hobbytv,http://www.youtube.com/user/hobbytoystv,https://youtu.be/St9RBa8wjkY?list=PL849n1gpgdFWlIV6SM3LXslxFOZO2N8aZ,http://www.HobbyKidsTV.com,https://www.instagram.com/hobbykidstv/,https://plus.google.com/108694155777909765301,
https://www.youtube.com/user/DerRaizer97/about,Entertainment Access,Entertainment Access is your go-to destination for the movies games & series we all love! Featuring Trailers Clips Compilations Lists & more!   Entertainment Access | A Project by Fabian Pohl,http://www.entertainmentaccess.tv/,http://instagram.com/fabiann_ph#,https://twitter.com/EntertainAccess,http://somenetwork.de/#mehr,https://www.facebook.com/EntertainAccess,https://plus.google.com/116327792514606123700,
https://www.youtube.com/user/ComicBookCom/about,Comicbook.com,ComicBook.com is an independently owned media company focused on all things pop culture influenced by the robust comic book industry whose iconic creations have become the driving force of mainstream entertainment behind today's blockbuster movies hit TV shows best selling video games and more.  ComicBook.com provides fans with the latest news reviews tv & movie database vibrant communities social platforms events and industry scoop through innovative technology products and mobile platforms.,http://twitter.com/comicbookdotcom,http://facebook.com/comicbookdotcom,http://comicbook.com,https://plus.google.com/107643867754355018896,
https://www.youtube.com/user/SmartBooksMedia/about,Pinkfong! Kids' Songs & Stories,Welcome to PINKFONG's official YouTube channel. Meet PINKFONG’s fun educational videos that captured the hearts of millions of children around the world.  Subscribe to our channel for hundreds of kids' favorite songs and stories including nursery rhymes phonics songs number songs bedtime lullabies children's classics fairy tales and more! Enjoy educational songs and stories for preschool kids created by the experts in children's education.  Follow us on Facebook for new updates and free promotions. ★ Facebook: https://www.facebook.com/PINKFONG.smartstudy ★ Website:  https://www.smartstudy.co.kr,https://about.pinkfong.com/en/,https://www.facebook.com/pinkfong.smartstudy,https://plus.google.com/102640249751866322552,
https://www.youtube.com/user/FunnyPetMedia/about,Funny Pets,Funny Dog Videos. Funny Cat Videos. Funny Pet Videos! Funny Pets is bringing you the best funny pet videos that we can find. Please subscribe and we will make you laugh!,https://www.youtube.com/channel/UCPAt6mvC-wKunwKyiEeAxFQ,https://plus.google.com/114432190771493507565,
https://www.youtube.com/user/ZeroMediaHD/about,Zero Media,Zero Media is the place to see all the latest and greatest movie trailers clips and more.,https://www.facebook.com/ZeroMediaTrailers/,http://www.twitter.com/ZeroMediaHD,https://www.youtube.com/subscription_center?add_user=ZeroMediaHD,https://plus.google.com/104278701592154569171,
https://www.youtube.com/user/toysreviewtoys/about,ToysReviewToys,Toys reviewing other toys!  ToysReviewToys is a friendly kid channel fun for both kids and parents!   We feature top toys from popular franchises like Teenage Mutant Ninja Turtles and superheroes like Batman and Superman!  We make parodies and adventures mixing franchises together like Paw Patrol with Duplo Lego Spiderman or even The Good Dinosaur toys with surprise eggs.   We teach how to build toys with Legos or Mega Bloks with Play Doh.  You can also find other fun videos at my wife's channel DisneyCarToys.  So come on click on a video and imagine!,https://plus.google.com/109889329486414195750,
https://www.youtube.com/user/Promangan/about,Joseph Smon,Welcome to my channel where you can find some classic educational PC game videos plus many others. Please subscribe if you like this channel.,https://plus.google.com/111800652967181394327,
https://www.youtube.com/user/DisneyCarToys/about,DisneyCarToys,DisneyCarToys is a fun kid friendly toy channel. Sandra and Spidey make toy videos giant surprise toys videos doll parodies surprise eggs opening toy reviews and unboxing videos daily for toddlers preschoolers and school children.  I feature top toys from popular Disney movies like Frozen and Cars 2 plus TV shows like Mickey Mouse Clubhouse and Peppa Pig. I love doing Frozen Barbie episode parodies with my Elsa and Disney Princess Anna dolls. I'm known for unique Play Doh videos. You'll also find funny Cookie Monster Sofia The First Orbeez  Disney Cars Toys Lightning McQueen and Mater videos. My favorite Disney Princess is Ariel from The Little Mermaid favorite Disney Car is Lightning McQueen favorite superhero is Spiderman. I love Barbie especially 1990s Barbie playsets. Be sure to check out my husband's channel ToysReviewToys for toy videos. Why am I called DisneyCarToys? Because my son loves Cars 2 and collects cars toys. :-),https://www.facebook.com/pages/Disneycartoys/1406438099591147,https://twitter.com/DisneyCarToys,https://plus.google.com/101680558872528991943,
https://www.youtube.com/user/AlternativeOnMV/about,Alternative on MV,Welcome to Alternative on MV a sub channel of Music Vault where you can find our entire collection of live alternative music videos in one location.,http://www.musicvault.com,https://plus.google.com/117124149812263378891,
https://www.youtube.com/user/screenjunkies/about,Screen Junkies,In a world full of movies and television only one channel is keeping them honest every Tuesday Thursday and Saturday - SCREENJUNKIES!   Home of the epic Honest Trailers and The ScreenJunkies Show...it's the ScreenJunkies YouTube channel!  Enjoy our warped take on film & TV with a steady stream of pop-culture parody original series thoughtful commentary and whatever we can think of next.  Tuesdays: Honest Trailers Thursdays: ScreenJunkies Show Saturdays: Movie Fights,http://www.screenjunkies.com,https://twitter.com/screenjunkies,https://facebook.com/ScreenJunkies,https://itunes.apple.com/us/podcast/screen-junkies-movie-fights/id975948473?mt=2,https://www.districtlines.com/screenjunkies,https://plus.google.com/108055490202119434452,
https://www.youtube.com/user/MaterCarClub/about,DCTC Toy Channel,Hey there and welcome to DCTC! We are Disney Cars Toy Club and we love love love making super fun kid-friendly videos!   Some of our favorite things include Olaf Queen Elsa and Princess Anna (and anything Frozen actually) Mater (you know…Tow Mater - from Disney Pixar’s Cars and Cars 2) Play Doh Surprise Eggs Kinder Eggs Chocolate (and chocolate eggs!) Roc (our crazy dog - you'll see him in videos sometimes) Lightning McQueen Blind Bags Hello Kitty (meow!) Sofia the First Monster High (love Goulia's glasses!) BARBIE! And guess what? We can’t wait to hear more about you and what YOU like!  So you know what that means right? You have to leave us comments! Or... drop us a line here:  DCTC PO Box 104 Saxapahaw NC 27340  Business Inquiries ONLY Email: DCTC.Channel@gmail.com Sorry no birthday request or special video messages.,https://www.facebook.com/pages/Disney-Cars-Toy-Club/207062189487320,https://twitter.com/dctcfans,http://instagram.com/disney_cars_toy_club_dctc/,http://www.cafepress.com/dctcmerch,
https://www.youtube.com/user/KinoCheck/about,KinoCheck,Hot new movie trailer news and reviews in highest quality on a daily basis! KinoCheck is Germany’s largest movie-entertainment channel. Whether blockbusters like Star Wars 8 Assassin's Creed Movie Baywatch Doctor Strange Fast and Furious 8 Wonder Woman Justice League or indie movie trailers — we’ve got them all. In addition we create original content like reviews mashup’s and contest so you’ll always be up to date on the really good movies!  Don’t miss to visit our brand-new website https://KinoCheck.de  KinoCheck is a project of some.marketing GmbH & Co. KG,https://KinoCheck.de,http://www.youtube.com/user/KinoCheck?sub_confirmation=1&app=desktop&annotation_id=annotation_2697786943,http://m.me/KinoCheck,http://facebook.com/KinoCheck,https://www.youtube.com/Filme,https://instagram.com/KinoCheck,https://KinoCheck.de/filmstarts,https://KinoCheck.de/kritiken,https://kinocheck.de/impressum,http://KinoCheck.me/Teilnahmebedingungen,https://plus.google.com/111197825252972146505,
https://www.youtube.com/user/YouAlwaysWin/about,YouAlwaysWin,The Fun destination for YouTube Minecraft Left 4 Dead 2 (L4D2) & Call of Duty Zombies videos. Let Dumb and Dumber guide you through various Minecraft maps including adventure survival and parkour. Sit back and enjoy a custom Minecraft Animation as well as Minecraft Mods like Tekkit Pixelmon Hexxit etc...  Whether you play on Minecraft servers XBOX 360 PS3 or Minecraft Pocket Edition you'll love our Minecraft videos. We're also the #1 source for Left 4 Dead 2 Call of Duty Zombies & other Scary games. We post new Custom Zombies videos every day and enjoy playing other Zombie games. Whether you play on a PC XBOX One PS4 XBOX 360 or PS3 you'll love our L4D2 and COD Zombies videos.,https://twitter.com/YouAlwaysWin,http://www.youalwayswin.net/,
https://www.youtube.com/user/TheEducVideos/about,Kids' Toys,Welcome to KIDS' TOYS channel. Join us in discovering and collecting cool toys like Play Doh Kinder surprise eggs Barbie doll Robocar Poli cash register toys Minecraft Disney Frozen Cars 2 Monsters University Monster High doll Baby Alive doll Lalaloopsy LEGO Orbeez Disney Big Hero 6 Little Live Pets Hello Kitty Hot Wheels Pinypon Disney Playhouse Barbie dollhouse My Little Pony Thomas and Friends Monsters Inc Moon Dough Mickey Mouse Batman Superman Spiderman Talking Tom and a lot more... I also added some cool Japanese toys like Kracie Popin Cookin Kutsuwa Eraser Making Kit Re-Ment miniatures and Charms. Subscribe for more KIDS' TOYS surprises: https://www.youtube.com/user/TheEducVideos,http://www.facebook.com/kidstoyssurprises,http://www.youtube.com/user/theeducvideos,https://play.google.com/store/apps/details?id=com.app.kidstoys,https://plus.google.com/114758358474075837054,
