https://www.youtube.com/user/wloltigerlolw2/about,Tiger Productions,ABOUT US: Hi there!  We create all kinds of compilations mostly about animals lego animations lego tutorials and other videos.. If u like our products please SUBSCRIBE! U can also add us on google+ or FB..  WANNA MAKE YOUR PET FAMOUS? We are opened to all kind of interesting animal clips so feel free to share them with us. If you  think your furry friend deserves to be famous send us youtube links or clips of your pet to: tigerlicensing@gmail.com  COPYRIGHT ISSUES: Our purpose when making COMPILATIONS is NOT to steal other people's videos but to share those in quality compilation with other people. If any owner of clips used in our compilation has a copyright issue feel free to contact us by personal message and add title COPYRIGHT ISSUE. We will remove the clip video or come to an agreement. Thank you.  Using or sharing our compilations is allowed so feel free to share them anywhere but it would be nice that you use direct link of video not of copies.,https://www.youtube.com/user/wloltigerlolw?feature=watch,https://www.facebook.com/pages/Tiger-Productions/218697918329530,https://www.youtube.com/user/wloltigerlolw3,https://www.youtube.com/user/wloltigerlolw4,https://plus.google.com/109312494230050765441,
https://www.youtube.com/user/guiadelociotv/about,Guia del Ocio,Un completo canal que informa de todo el ocio de 50 provincias de toda España y que se actualiza diariamente. Cuenta con todo el cine cartelera restaurantes dónde comer o cenar teatro obras en cartel conciertos giras música noche copas de moda arte cultura exposiciones pintura escultura museos niños dónde ir con niños especiales para niños ferias cursos aficiones Televisión y mucho más,https://plus.google.com/u/0/b/105225212817273462368/+guiadelocio/posts,https://twitter.com/guiadelocio,http://facebook.com/guiadelociocom,https://plus.google.com/105021990838146046630,
https://www.youtube.com/user/WatchMojo/about,WatchMojo.com,Top 10 lists on Music TV Film and Video Games. We publish 4 or more Top 10s daily. Subscribe for new top 10 lists every day and binge watch on Top 10s covering Pop Culture Celebrity Movies Music TV Film Video Games Politics News Comics and Superheroes. WatchMojo’s back catalogue has ten thousand videos on Top 10 lists Origins Biographies Tips How To’s Reviews Commentary and more  Your trusted authority on ranking Pop Culture.   Subscribe Now http://goo.gl/Q2kKrD - Ranking Pop Culture Since 2006!,https://www.facebook.com/watchmojo,https://www.twitter.com/watchmojo,https://www.instagram.com/watchmojo,https://www.snapchat.com/add/watchmojo,
https://www.youtube.com/user/barcroftmedia/about,Barcroft TV,Barcroft TV is the home of amazing exclusive video.  We update our YouTube site regularly with incredible real-life stories and footage - so stay tuned for more!  All our music comes from www.epidemicsound.com,http://www.barcroft.tv,http://www.facebook.com/barcroftTV,https://twitter.com/Barcroft_TV,http://instagram.com/barcroft_tv,https://plus.google.com/b/109352954399711636677/109352954399711636677/posts,https://plus.google.com/109352954399711636677,
https://www.youtube.com/user/78vwrabbit/about,Greg Mosier,YOLO !,http://gregorymosier.weebly.com/,https://www.facebook.com/gregorymosierphotography/,https://plus.google.com/106910692795528537683,
https://www.youtube.com/user/rhettandlink2/about,Good Mythical Morning,We are Rhett & Link and this is our daily morning talk show Good Mythical Morning.   Watch our show after the show for more videos every weekday: http://youtube.com/goodmythicalmore  Love the Mythical Crew? Watch new videos from them everyday of the week at: http://youtube.com/thisismythical  Check out our main channel for funny music videos sketches and ridiculous local commercials: http://youtube.com/rhettandlink  Our website has music merch and more: http://www.RhettandLink.com  Snail Mail:  PO Box 6578  Burbank CA 91510,http://youtube.com/rhettandlink4,http://twitter.com/rhettandlink,http://facebook.com/rhettandlink,http://instagram.com/rhettandlink,http://rhettandlink.tumblr.com/,http://rhettandlink.com,https://plus.google.com/113825681504586191360,
https://www.youtube.com/user/phreakindee/about,Lazy Game Reviews,Opinionated snarky commentary on games retro tech and more!  PC gaming Oddware The Sims thrifting Tech Tales etc  ● SCHEDULE: Mondays: more relaxed videos on whatever (shorter game reviews LGR Plays unusual topics) Fridays: usually more substantive videos on stuff (Reviews Oddware Tech Tales LGR Thrifts)  ● For business proposals email me at my business address below. Otherwise please use LGR social media to ask questions or just touch base!  ● If you're looking to donate anything email me or consider supporting LGR on Patreon: http://www.patreon.com/LazyGameReviews  "Laziness is a state of mind not necessarily a lack of action.",https://www.patreon.com/LazyGameReviews/,https://twitter.com/lazygamereviews/,https://www.facebook.com/LazyGameReviews,https://www.youtube.com/channel/UCz9uUFDhsPYii-ZihoKsbPg,http://www.twitch.tv/lazygamereviews,https://docs.google.com/spreadsheet/ccc?key=0Ar-cJK68JK-3dGxtNWo4enhRMWtxWFAyMGh4dW9nR2c,http://www.lazygamereviews.com/,http://www.cafepress.com/lgrshop,https://plus.google.com/114407182308042596122,
https://www.youtube.com/user/wloltigerlolw3/about,Tiger FunnyWorks,Hello!  We like creating all kind of videos you already may have seen our 2 other channels wloltigerlolw and Tiger Productions (wloltigerlolw2).  Well hope you like our work if you do please share it and don't forget to SUBSCRIBE :D no really I mean it! SUBSCRIBE God da**it ! :P  COPYRIGHT ISSUES:  Our purpose when making COMPILATIONS is NOT to steal other people's videos but to share those in quality compilation with other people.  If any owner of clips used in our compilation has a copyright issue feel free to contact us by personal message and add title COPYRIGHT ISSUE. We will remove the clip video or come to an agreement. Thank you.,https://www.youtube.com/user/wloltigerlolw2,https://www.facebook.com/pages/Tiger-Productions/218697918329530,https://www.youtube.com/user/wloltigerlolw,https://www.youtube.com/user/wloltigerlolw4,https://plus.google.com/110777826680753888317,
https://www.youtube.com/user/FlicksMovieTrailers/about,Flicks And The City Clips,The hottest movie & TV clips trailers interviews behind-the-scenes b-roll special features & deleted scenes!  We have permission and licenses to use all the materials on this channel. For any copyright issues please email copyright@flicksandthecity.com and we will get back to you.  For movie reviews easter eggs & deleted scenes explained giveaways amazing movie secrets comic con videos & exclusive interviews check out our main channel ► YouTube.com/FlicksAndTheCity  Want to contribute subtitles? Email via the button below!,http://www.youtube.com/subscription_center?add_user=flicksandthecity,http://twitter.com/FlicksCity,http://www.facebook.com/FlicksAndTheCity,http://FlicksAndTheCity.com,http://www.youtube.com/subscription_center?add_user=flicksmovietrailers,https://plus.google.com/103757067768610702786,
https://www.youtube.com/user/geobeats/about,geobeats,We create informative and entertaining videos around the world on topics such as travel lifestyle fitness style food and drinks. Let us know what you think of our channel. Leave us a comment!,http://www.geobeats.com,http://www.youtube.com/channel/UC_5qxE-6ITKqNYK6Z7EZYtQ?sub_confirmation=1,https://plus.google.com/117386436314474749373,
https://www.youtube.com/user/SuperSimpleSongs/about,Super Simple Songs - Kids Songs,Kids songs nursery rhymes and more! Learn and explore through song and movement with Super Simple Songs! Our team of educators has created some of the most popular children's songs on YouTube to get up move and sing along with! Get ready for a musical adventure in rhyme!,https://www.youtube.com/subscription_center?add_user=supersimplesongs,https://www.facebook.com/SuperSimpleLearning,https://itunes.apple.com/us/artist/super-simple-learning/id429247660?uo=4&at=10l7wf,http://instagram.com/supersimplelearning,http://www.pinterest.com/simplesongs,
https://www.youtube.com/user/topcompilationblog/about,CooL Vines,Top Vines Compilation,https://www.facebook.com/CooLVines1,https://plus.google.com/114836390071473636991,
https://www.youtube.com/user/Popscivideo/about,Popular Science,Popular Science is the best source for science and technology videos from the future. Subscribe to get the latest DIY projects science interviews tech news and lots and lots of robots delivered straight to you.,http://www.popsci.com?src=soc&dom=yt&loc=rrail,https://www.facebook.com/PopSci,https://twitter.com/PopSci,https://www.pinterest.com/popularscience,https://subscribe.popsci.com/servlet/ConvertibleGateway?cds_mag_code=PPS&cds_page_id=158147&cds_response_key=IWAPLAY00&cds_misc_1=social-ytb&cds_misc_2=00-000&cds_misc_3=&cds_misc_4=&cds_misc_5=,http://www.emagazines.com/insight/link/?user=5&g=E4EB52C5-B998-4065-8DE7-537C6BB446A2,http://www.emagazines.com/insight/link/?user=5&g=3B464BBD-22E7-488E-81A2-14809B0CE715,http://www.emagazines.com/insight/link/?user=5&g=9D47E086-24E7-40FA-ABE1-9EF8A93677AA,http://www.emagazines.com/insight/link/?user=5&g=901838FC-CBCF-4803-840A-C603A8857B6E,https://plus.google.com/112971505702976750152,
https://www.youtube.com/user/UniversalPicturesBRA/about,Universal Pictures Brasil,Você ama filmes? Inscreva-se em nosso canal para receber conteúdo exclusivo e ficar por dentro de todas as novidades da Universal Pictures Brasil. A Universal Pictures é o estúdio mais antigo de Hollywood sendo de extrema importância para a história do cinema e responsável por grandes sucessos de bilheteria.,https://www.facebook.com/UniversalPicturesBR,https://twitter.com/universalpicsbr,http://instagram.com/UniversalPicsBr,https://plus.google.com/113131616645681072039,
https://www.youtube.com/user/xoLPSlover1314xo/about,Gerrie Berrie,Just a teenage girl who tells her stories through tiny plastic toys.   P.O Box:  Gerrie Berrie Box 1 Number 6 Great Village Nova Scotia  B0M1L0 Canada,https://www.facebook.com/LPSGerrieBerrie,https://twitter.com/GerikaTurner,https://plus.google.com/109172122960156144651,
https://www.youtube.com/user/KOSGAMESON/about,KOSDFF VLOGS,I film my life and add cinematics. Thanks for watching!,https://electronicgamersleague.com/collections/kosdff?page=1,http://www.youtube.com/KOSDFF,http://www.twitter.com/KOSDFF,http://www.twitch.tv/KOSDFF,http://www.instagram.com/KOSDFF,http://www.facebook.com/KaliberKOSDFF,http://www.gfuel.com/kosdff,http://www.kontrolfreek.com/?a_aid=KOSDFF,http://scufgaming.com,http://bit.ly/EGLTKSHOP,http://amzn.com/w/3C9H324WDYF04,https://plus.google.com/115461756924723294190,
https://www.youtube.com/user/familyfunpack/about,Family Fun Pack,If someone's having fun it's our family!  Our daily videos include challenges parks epic road trips vlogs toys games food clothes and lots of other fun things!  We are the originators of the "costume runway" series on YouTube.  We have 5 kids:  Alyssa David Zac & Chris all born within 39 months of each other.... and their baby brother Michael!  Our motto is "fun with the family every day".  Thanks for visiting our channel. We love reading your comments! Please subscribe and enjoy watching our happy family grow up!   Want to send fan mail? If you'd like something back from us be sure to include a large size self-addressed and stamped envelope.   Here's our fan mail address: Family Fun Pack 8383 Wilshire Blvd. Suite #1050 Beverly Hills CA 90211 USA,https://www.facebook.com/pages/Family-Fun-Pack/262729447181961?ref=hl,https://www.twitter.com/familyfunpack,http://instagram.com/familyfunpack,https://shop.studio71us.com/collections/family-fun-pack,https://www.youtube.com/channel/UCAWlwILydRAPX0TUJeEH1tw,https://www.instagram.com/alyssafunpack/,https://www.instagram.com/daddy_fun_pack/,https://www.twitter.com/daddy_fun_pack,https://www.youtube.com/channel/UCEJpGxMVHCltUzIAMb8J4vQ,https://www.youtube.com/channel/UC_lIqNT-IVNinV4aUQUOGlA,https://www.youtube.com/channel/UCFkvaOM2Nc_8TtchHlH0ZBg,https://plus.google.com/112102156052955961652,
https://www.youtube.com/user/AnimalPlanetTV/about,Animal Planet,Animal Planet is the world's only entertainment brand that immerses viewers in the full range of life in the animal kingdom with rich deep content via multiple platforms and offers animal lovers and pet owners access to a centralized online television and mobile community for immersive engaging high-quality entertainment information and enrichment.,http://AnimalPlanetGO.com/,https://www.facebook.com/AnimalPlanet,http://www.twitter.com/AnimalPlanet,https://plus.google.com/115385867391314033546,
https://www.youtube.com/user/EpicToolTime/about,Epic Wildlife,Discover amazing new animal species & learn about the world's deadliest & most mysterious creatures with new wildlife videos every week.  Epic Wildlife is an educational & entertaining animal channel dedicated to making learning about nature fun and enjoyable for adults and kids of all ages. Here you'll find interesting animal facts giant snakes man eating saltwater crocodiles worldwide shark attacks deadly spiders bigfoot sightings mysterious creatures discovered strange new species prehistoric discoveries deep sea monsters & breaking animal news.   Our World is Amazing! Come explore it with us.,http://www.twitter.com/epicwildlife,https://www.facebook.com/epicadamwildlife,https://plus.google.com/u/0/100987998591712914407/posts,http://pinterest.com/epicwildlife,http://epicwildlife.tumblr.com/,http://www.stumbleupon.com/stumbler/epicwildlife,http://www.districtlines.com/epic-wildlife,https://plus.google.com/100987998591712914407,
https://www.youtube.com/user/TheBestVines/about,Dumb Genius,Dumb Genius bringing you the Best Funny Vines Compilations Try Not to Laugh Challenges Kids Animal and Fail Compilations! Featuring Viners like: King Bach Thomas Sanders David Lopez Amanda Cerny Brandon Bowen Ross Smith MeechonMars and more!,https://www.facebook.com/TheBestVines,https://docs.google.com/a/collabcreators.com/forms/d/1sR5Y6PyFGOpIMp6-j6XDAH3J07naG4ruRAfXyTOWZRE/viewform?c=0&w=1,https://plus.google.com/100333283738371521777,
https://www.youtube.com/user/songstowearpantsto/about,ANDREW HUANG,★ EXPLORING THE WONDER OF MUSIC ★   I'm a music producer working with lots of different genres and instruments including things that aren't instruments like pants and balloons. Passionate about sharing my knowledge and trying new things.  I have over 40 albums out which you can find at the links below. Become a patron to get the best deal on all my new music plus instant access to over 1000 b-sides and exclusive tracks! patreon.com/andrewhuang  I'm Canadian based in Toronto partially deaf married to a badass and I hate sleep.  ★ FREQUENTLY ASKED ★  Equipment? I put a pretty comprehensive list of what I use for each video in the description box. With Amazon links!  What do you edit with? Was FCP7 then FCPX now Premiere. They are all good with different very minor pros and cons.  How many instruments do you play? I don't really know. I just try to make noise with everything.,http://patreon.com/andrewhuang,http://facebook.com/andrewismusic,http://twitter.com/andrewismusic,http://instagram.com/andrewismusic,https://open.spotify.com/artist/7HifubxN0gO1nHbRIqWhrY,https://play.google.com/store/music/artist/Andrew_Huang?id=Alpsoonmkxmmis7pf4zjad444ki&hl=en,https://itunes.apple.com/artist/andrew-huang/id130057628,http://andrewhuang.bandcamp.com,http://soundcloud.com/andrewismusic,http://andrewismusic.tumblr.com,http://andrewismusic.com,https://plus.google.com/104428526557178454491,
https://www.youtube.com/user/CheekiiChaps/about,CheekiiChaps,im not actually from zimbabwe  mlg  Add me Twitter: twitter.com/cheekiichap Facebook: facebook.com/cheekiichaps Google+,https://plus.google.com/101566042214566898183,
https://www.youtube.com/user/NutsGum/about,NutsGum,
https://www.youtube.com/user/TheDiamondMinecart/about,DanTDM,Daily gaming videos with DanTDM :)  BUSINESS ONLY :: tdmbusiness@live.co.uk,http://bit.ly/TxtGm8,http://www.facebook.com/TheDiamondMinecart,http://www.twitter.com/dantdm,http://www.instagram.com/dantdm,https://plus.google.com/111822903685791223342,
https://www.youtube.com/user/TheEllenShow/about,TheEllenShow,For 14 incredible eventful and sometimes life-changing seasons Ellen has been making audiences laugh all over the world with her signature brand of humor and her powerful message of kindness. There's nobody better at making you laugh and brightening your day. You never know what funny can do!,http://www.ellentv.com,http://www.twitter.com/theellenshow,http://www.facebook.com/ellentv,http://instagram.com/theellenshow,http://ellentube.com/,http://pinterest.com/ellentv/,http://ellen.warnerbros.com/ellentogo/,http://scrapbook.ellentv.com,https://plus.google.com/113689144410560404035,
https://www.youtube.com/user/AlisonLovesJB/about,Alison Henry,Alison. 23. Atlanta based!    ☞LINKS☜ ➤instagram: @alisonhenryy @alisonhenrymakeup ➤business inquiries can email me at alisonhenrymakeup@yahoo.com  Thanks for watching!   xx,http://twitter.com/alisonhenryy,http://facebook.com/alisonlovesjbyoutube,http://instagram.com/alisonhenryy,http://pinterest.com/alisonhenryy,http://breatheinthesea.tumblr.com,http://askalisonlovesjb.tumblr.com,https://plus.google.com/102855705524451463451,
https://www.youtube.com/user/MayaTOOTS/about,The Pals,Hey! Welcome to The Pals!. We're a team that's dedicated to bringing you the highest quality kid friendly gaming content on Youtube! The channel originally began as an animation channel with Sub but later branched out into Minecraft Roblox and more with Denis Corl & Alex! Sketch joined us too! 100% Family Friendly and Kid Friendly!  Subscribe to stay notified about the latest uploads!  Our Roblox Usernames: RealSubZeroExtabyte CorlHorl DenisDaily & CraftedRL Sk3tchYT  Denis's Channel: http://bit.ly/1QUgm5j Corl's Channel: http://bit.ly/1WhnaNX Alex's Channel: http://bit.ly/1Lj6pkS Sketch's Channel: https://www.youtube.com/channel/UCfw6CRDOg5xQsB-2QNC_KUA,https://www.youtube.com/subscription_center?add_user=mayatoots,https://twitter.com/SubZeroExtabyte,https://plus.google.com/114231775424779513318,
https://www.youtube.com/user/ldshadowlady/about,LDShadowLady,Minecraft is love. Minecraft is life. Crazy Craft 3.0 Shadowcraft Minecraft Mini-games Minecraft mods & Random indie games! http://ldshadowlady.com/ I'm a 24 year old Let's Play Gamer called Lizzie! I love cats and anything cute :3  P.S. Sorry I don't have an upload schedule! I try to post frequently but I've found that the best videos are made when I'm inspired and motivated. Trying to stick to a schedule drains away all the spontaneity and excitement from making videos. I still want to keep this as fun as possible for me so hopefully it's more fun for you to watch too!  Channel Banner by: https://twitter.com/BlooSims,https://twitter.com/LDShadowLady,https://www.facebook.com/LDShadowLadyFB,https://instagram.com/LDShadowLady,http://www.twitch.tv/ldshadowlady,http://ldshadowlady.com/,https://plus.google.com/109951399932460497870,
https://www.youtube.com/user/ZeusTheServal/about,ZeusTheServal,FACEBOOK https://www.facebook.com/ZeusTheServal  EMAIL TO BE REACHED: ZeusTheServal@gmail.com (PROFESSIONAL INQUIRIES ONLY!)  Zeus The Serval is an African Serval. The serval is a medium-sized cat going up to 40-55lbs. It is a strong yet slender animal with long legs and a fairly short tail. Due to its leg length it is relatively one of the tallest cats. Usually the serval is boldly spotted black on tawny with two or four stripes from the top of the head down the neck and back transitioning into spots. Servals have the longest legs of any cat relative to their body size.   ATTENTION: Servals DO NOT MAKE GOOD PETS. They are illegal in all but 4 states and require special permits to own.,https://plus.google.com/108259121072480907278,
https://www.youtube.com/user/vat19com/about,Vat19,Vat19 is dedicated to "curiously awesome" gifts candy toys gummy putty puzzles games and more! In addition to making funny commercials you'll actually want to watch we produce amazing challenge videos document our outrageous contraptions and invite you to a front row seat for our silly stunts.  Sometimes we blow things up fill up a bathtub or pool with crazy stuff dare each other to eat super spicy foods and answer “burning questions” from our viewers.  Don't forget to SUBSCRIBE to our channel!  Shop curiously awesome gifts: http://www.vat19.com/?adid=youtube  *******************  Do you want to feature or do product reviews of our cool products in your videos?  Send an email to: youtube@vat19.com  If you're a brand or have a product you'd like featured on Vat19's channel email us: youtube@vat19.com  ******************* Instagram: http://instagram.com/vat19 Facebook: http://www.facebook.com/vat19 Snapchat: vat19team Twitter: http://twitter.com/#!/vat19,https://www.youtube.com/subscription_center?add_user=vat19com,https://www.vat19.com?adid=youtube,http://www.facebook.com/vat19,https://twitter.com/vat19,http://instagram.com/vat19,http://www.vat19.com/meet-vat19.cfm?adid=youtube,https://www.snapchat.com/add/vat19team,https://plus.google.com/104149877641335444132,
https://www.youtube.com/user/MoviepilotTrailer/about,Moviepilot Trailer,Die neusten deutschen Trailer in HD und Ultra HD/4K  zu den besten Filmen für 2017! Hier findest du alle deutschen Videos zu aktuellen Kino Highlights wie Star Wars Episode 8: Die Letzten Jedi The Avengers 3: Infinity War Spider-Man: Homecoming Justice League Der Dunkle Turm Deadpool 2 Wonder Woman Dunkirk Alien: Covenant Kingsman 2: The Golden Circle und vieles vieles mehr!  Wenn du immer auf dem Laufenden bleiben und keinen Trailer mehr verpassen willst dann besuche auch unsere Trailer-News-Sektion unter https://www.facebook.com/cinefeed und abonniere uns: http://www.youtube.com/subscription_center?add_user=moviepilottrailer,http://www.moviepilot.de,https://www.facebook.com/cinefeed,https://twitter.com/MPTrailer,http://www.youtube.com/playlist?list=PLC909B08B843E123D,http://www.moviepilot.de/pages/imprint,https://plus.google.com/106420588257210405305,
https://www.youtube.com/user/relaxmydog/about,Relax My Dog - Relaxing Music for Dogs,RelaxMyDog specialises in music designed for any breed of dog at any age.  The music is created for dogs who have anxiety problems or who are alone a lot and uses the power of music to calm and relax your pet.    It is perfect for those occasions which bring fireworks potentially scaring your pup or for a dog who suffers with separation anxiety.    The music uses sound sweep technology in order to capture your dog's attention and then combines lullaby-like melodies with classical music to keep your dog calm and soothed.  We have had great success with a number of fans' pets and will continue to bring you new music on a regular basis.  In the meantime please check in at our social media sites for lots of dog fun photos and more!  If you want to support us then you can do so through our Patreon page just take a look at our page and choose which tier suits you and thank you so very much for watching and giving! https://www.patreon.com/RelaxMyDog,http://www.relaxmydog.com,https://itunes.apple.com/album/calming-music-for-dogs-reduce/id716747799,http://www.facebook.com/RelaxMyDog,https://twitter.com/RelaxMyDog,http://www.instagram.com/relaxmydog,https://itunes.apple.com/gb/album/soothing-music-designed-for/id439733929,https://itunes.apple.com/gb/album/dog-relaxation-music-music/id553934892,https://itunes.apple.com/gb/album/music-to-calm-your-dog-relaxation/id554267610,https://itunes.apple.com/gb/album/pet-relaxation-music-to-relax/id669155777,https://itunes.apple.com/gb/album/music-to-calm-anxious-dogs/id637748437,https://www.facebook.com/relaxmydog,https://itunes.apple.com/album/calming-music-for-dogs-reduce/id716747799,https://plus.google.com/113361832499667582411,
https://www.youtube.com/user/CutiePieMarzia/about,Marzia,Welcome to my channel! I make videos about anything that interests me. If you would like to see more of me subscribe...we are going to have a lot of fun! ;)  *** For business offers please contact kat@reelstyle.co ***,http://www.marziaslife.com,http://twitter.com/MarziaPie,http://instagram.com/itsmarziapie,http://shopcutiepiemarzia.com,http://www.facebook.com/pages/CutiePie/347559301929634,https://plus.google.com/104858444407546220064,
https://www.youtube.com/user/MrTwistedPandora/about,TwiistedPandora,Welcome to my channel - where I play anything! Including: Roblox Minecraft Pokemon Outlast & MORE!!  Thanks for checking me out; hope you enjoy my videos! :D   Stay Snazzy Twisties! (:,https://twitter.com/TwiistedPandora,https://plus.google.com/110210910048059843719,
