https://www.youtube.com/user/FilmIsNow2/about,FilmIsNow Trailer & Clip in Italiano,Benvenuti a FILMISNOW Trailer & Clip in Italiano! Qui trovate recensioni di film trailer clip interviste classifiche filmati in HD sulle prossime uscite cinematografiche e ultime notizie dal mondo dello spettacolo!   Il network FILMISNOW è nella TOP 15 mondiale nella categoria film e animazione su YouTube. Grazie ai nostri telespettatori che amano i film il nostro network genera oltre 60 milioni di visite mensili attraverso i nostri sette canali.  Per offerte commerciali collaborazioni e fornitura di contenuti contattate: filmisnowpromo@gmail.com  Per questioni di copyright contatte: copyrightfilmisnow@gmail.com  Movie Trailers & Clips Celebrity Interviews Movie and Entertainment News and much more! New videos every day!,https://www.facebook.com/filmisnowitalia,https://www.instagram.com/filmisnowtrailer/,https://play.google.com/store/apps/details?id=com.filmisnow.app,https://itunes.apple.com/us/app/filmisnow/id932439474,http://www.youtube.com/user/filmisnowEXTRA,http://www.youtube.com/user/worldcinemanews,http://www.youtube.com/user/filmisnowHD,http://www.youtube.com/user/sneakpeakandfake,http://www.youtube.com/user/filmisnowEU,http://www.filmisnow.com,https://twitter.com/italianmovie,https://www.youtube.com/playlist?list=PLDs-H6Q4jRpMqswrT7gJrB1O7MtjQDIl6,
https://www.youtube.com/user/TEILO21/about,TEILO JUAREZ,https://plus.google.com/116102561456123305454,
https://www.youtube.com/user/parlophone/about,,
https://www.youtube.com/user/storyful/about,Storyful,Who are we?  Have you ever uploaded a video and not known what to do with it once the view count starts rising? Well that's where we come in!  Storyful is a social news agency that aims to promote monetize and protect great content from news to weather to viral videos. Our Viral team continuously works to discover the latest trending user generated content in order to promote it worldwide.  Our clients range from the biggest news outlets like the New York Times ABC BBC Vice News to global online partners like AOL Yahoo and MSN to producers of popular TV shows such as the Ellen Show and MTV's Ridiculousness.  Our goal is to help your video get discovered and go viral while we monetize and protect your video on YouTube and around the Internet.  Want to know more?  You can visit http://licensed.storyful.com/sell_videos for more information on how you can partner with Storyful.,http://licensed.storyful.com/sell_videos,http://www.facebook.com/Storyful,http://twitter.com/storyful,https://plus.google.com/101099271600373444913,
https://www.youtube.com/user/jayson9938/about,jayson9938,
https://www.youtube.com/user/TheOtherMau5/about,TheOtherMau5,Welcome to my youtube channel guys! THIS IS NOT THE REAL DEADMAU5 I AM JUST A FAN. Just sit back relax and enjoy the best mau5 tracks in the highest quality on youtube!,http://www.deadmau5.com/,http://soundcloud.com/suralo,https://www.facebook.com/suralomusic,http://adf.ly/ENyQ8,https://plus.google.com/100894897678601524414,
https://www.youtube.com/user/expertvillage/about,expertvillage,Enjoy Expert Village videos?  Every detail counts when you're learning-- clear picture quality videos so you dont miss the essential information.  Check out the HD quality videos our friends at eHow.com have on their YouTube channel.  More eHow HD videos coming soon!,http://www.ehow.com/,https://twitter.com/#!/ehow,https://www.facebook.com/EVGuide,http://www.youtube.com/subscription_center?add_user=expertvillage,https://plus.google.com/101597079225209749475,
https://www.youtube.com/user/EnzoShelby67/about,Freeze Lists,TECHNOLOGY  |  INVENTIONS  |  INNOVATIONS  |  MIND-BLOWING CREATIONS  FREEZE HD IS NOW FREEZE LISTS  !!!! We are excited to announce our new name FREEZE LISTS! For 2 and a half years we have brought you the latest in innovation and technology. Initially focusing on crowdfunded innovations we have grown into more than that.  YOU have been with us from our early days and walked with us as we adopted the exciting and free flowing “List” format of videos.  Now we have renewed zeal to bring you even more content covering a wider variety of topics in the fields of technology and innovation among others! And our new name Freeze Lists allows us to fully focus on that. Thank YOU for the journey we have had so far! Together let's get entertained let's get educated and let’s learn new things we never knew existed! NOTE: You can now watch Freeze Lists in Spanish and German in our new channels Freeze Lists ESPAÑOL [https://goo.gl/bM38rd] and Freeze Lists DE [https://goo.gl/IKd6xM]. Enjoy!,https://www.youtube.com/channel/UC2d9B6xq08kts8LNaYMx_fw,https://www.facebook.com/Freeze-HD-347866325338115/,https://goo.gl/IKd6xM,https://plus.google.com/105571961129245303109,
https://www.youtube.com/user/AmerVetMedAssn/about,AmerVetMedAssn,The official American Veterinary Medical Association YouTube channel. We hope you find it informative and entertaining. For more information about any of the topics we address here check out our website at www.avma.org.,http://www.avma.org,https://plus.google.com/108176564467508559152,
https://www.youtube.com/user/kids440/about,Blue Bell Kids,O Blue Bell possui 19 anos de experiência excelência e pioneirismo no ensino de inglês para crianças! Nossas aulas são lúdicas e divertidas com jogos músicas e brincadeiras que ajudam as crianças a aprender a língua estrangeira de maneira natural e eficiente.   Criamos os projetos Kids and Songs e Babies and Sounds que são propostas inovadoras no ensino de idiomas para bebês a partir de 06 meses e crianças de até 4 anos cuja a música é o principal recurso pedagógico.   Rua São Domingos do Prata 390 São Pedro BH/MG (31) 3221-4634 / 3234-6024 | www.bluebellidiomas.com.br,https://plus.google.com/104703599909952180513,
https://www.youtube.com/user/xpotbrowniex/about,Slayerholik,No videos pc is shot. sorry,https://twitter.com/Slayerholik,https://plus.google.com/114564929968499956729,
https://www.youtube.com/user/harvestech/about,VideMan Vids,"Best Vine compilation. Most popular Daily Weekly and Monthly Hottest Vines!  This is alternative Vine website. You can watch most amazing 6 sec Vines without Vine mobile application.  Search Vines by tags Viners or description.,https://plus.google.com/107967527938561145113,
https://www.youtube.com/user/LiebermannRamone3/about,LiebermannRamone3,Hi Ramones community! I'm Liebermann Ramone and I'm here to Share all the ORIGINAL Ramones videos with you. I used to be sick and tired of watching Ramones video on YouTube Why? it was just fucking videos with a disgusting quality and the worst audio on the planet. It always made me feel Angry so I decided to upload  the videos I had  always wanted to watch. I really hope you enjoy the videos It's been  very hard to upload them so Stop watching that Ugly Ramones Videos on YouTube and be part of the Best RAMONES Channel in the World.  Every Ramones Music Video that has ever existed will be uploaded to this channel.  Ramones:  -Joey Ramone (Vocals 1974 - 1996) -Johnny Ramone (Guitar 1974 - 1996) -Dee Dee Ramone (Bass 1974 - 1989) -Tommy Ramone (Drums 1974 - 1978) -Marky Ramone (Drums 1978 - 1983) 1987 - 1996 -C. Jay Ramone (Bass 1989 - 1996) -Richie Ramone (Drums 1983 - 1987),
https://www.youtube.com/user/Games4Kickz/about,Games4Kickz,I'm the German dude with the bad Irish accent that loves playing games and entertaining people. Follow me on Twitter for content updates and changes to series or just to have a chat about games you might want to see on the channel etc..  I post at least 1 Daily video but 2 when ever I can and sometimes 3. Times usually are 7PM 8:30PM 10PM (GMT)  ▼ Content I post/focus on ▼ ► Survival games (Mainly 7Days To Die) ► Horror Games ► Any game that I enjoy  ☺☻ I hope you enjoy the channel and join the home of the G4KNinjas for more ☻☺  ▼ FOR DEVELOPERS ▼ If you are a developer specially for Horror or Survival Games and you would like me to check out your game feel free to contact me on business[at]games4kickz[dot]com  ▼ PC-Spec ▼ ► i7-5820k @4.4Ghz ► 8GB MSI Geforce GTX 1080 Gaming X ► Blue Yeti Microphone ► Windows 10,https://twitter.com/Games4Kickz,https://www.facebook.com/Games4Kickz/,https://plus.google.com/u/0/b/109112102818687856469/+Games4Kickz/posts,
https://www.youtube.com/user/SnazzyNikki/about,SnazzyNikki,My name is Nikki my main interest and expertise falls into the category of Reptiles with years keeping a large range of reptiles I also help out / work at a professional reptile store my main job was to assist any beginner keepers cleaning and feeding the animals. The shop constantly has over 300 snakes and other reptiles. Part of my experiences involve in neglected and abandoned small exotics rehabilitation any abused flawed reptiles and small exotics had been taken in cured and tamed and resold into good homes. All my animals have been exposed to the best of quality fed very regularly tamed with loving attention constant and common health checks all healthy and fat.would like to reassure you all that I will only expose myself deeply into situations I believe that I know clearly and have had hands on experiences on before hand.   Please feel free to inbox me for any further questions any specific questions you wish to be answered.  Thank you for all your kind attentions!,https://www.facebook.com/snazzynikkipets,https://plus.google.com/100289111603079919454,
https://www.youtube.com/user/KitKat4Cool/about,bombastic!,
https://www.youtube.com/user/SevenSuperGirls/about,SevenSuperGirls,SevenSuperGirls is the largest all-girl (under 18's) Partner collaboration on YouTube!  So just who are these girls?  MONDAY: Nicole | USA  TUESDAY: JthreeProductions Jazzy | USA  WEDNESDAY:Mpatient13 Kaelyn | USA  THURSDAY:  CupcakeCutie170 Jenna | USA  FRIDAY: katherineshow1 &  Really Rad Rachael Katherine & Rachael | USA  SATURDAY:  Mimi Mimi | USA  SUNDAY: Ellie the Unicorn Ellie | UK  - - - FAQ  Q) Do you have Instagram? A) Yes it's SevenSuperGirlsFans - - -  Please note: This is a parentally controlled and moderated channel. The parents are responsible for all uploads and all content is vetted by them. Inappropriate behaviour will not be tolerated. - - - © 2008-2017 SevenSuperGirls.Com,http://www.facebook.com/SevenSuperGirls,http://instagram.com/sevensupergirlsfans,https://plus.google.com/116645884143929523045,
https://www.youtube.com/user/gabymsowa/about,gabymsowa,https://plus.google.com/109113091379912272455,
https://www.youtube.com/user/juanmrt/about,juanmrt,https://plus.google.com/112222171715505880032,
https://www.youtube.com/user/BakerStAdv/about,Baker Street Advertising,We create advertising and marketing communication that takes its clues from consumer behavior. Sounds elementary at first look but there's more to the story. Baker Street Advertising is named after Sherlock Holmes' London office address and the famous literary character also symbolizes our passion for discovering insights that the ordinary eye overlooks. We delight in dramatically revealing the "proof" that our work will motivate consumers all while being shot at by unsavory rivals as we leap from rooftop to rooftop in death defying chase sequences.,http://www.bakerstadvertising.com,https://plus.google.com/118279945699517222799,
https://www.youtube.com/user/jacksepticeye/about,jacksepticeye,Top of the mornin’ to ya laddies! Welcome to my channel my name is jacksepticeye.  I am the most consistently energetic videogame commentator on youtube.  If you like daily videos on videogames for example happy wheels undertale gta and more you have come to the right place!  PC Specs: GTX Titan X Intel i7-4770K 16GB RAM  Software used: Fraps/Bandicam to record Sony Vegas Pro 12 to edit,http://jacksepticeye.fanfiber.com/,https://twitter.com/Jack_Septic_Eye,https://www.facebook.com/officialjacksepticeye,http://instagram.com/jacksepticeye,http://therealjacksepticeye.tumblr.com/,https://plus.google.com/100511955649419832552,
https://www.youtube.com/user/cambridgeenglishtv/about,Cambridge English,Welcome to the official YouTube channel of Cambridge English Language Assessment.  We offer the world's most valuable range of qualifications for learners and teachers of English. Over 5 million people take our exams each year in more than 130 countries.  Over 20000 universities employers government ministries and other organisations around the world recognise Cambridge English qualifications as proof of English language ability.  All our videos are available to share through social media and for embedding. This can be accessed in YouTube by opening a specific video then click on the 'Share' tab.  Cambridge English Language Assessment (formerly University of Cambridge ESOL Examinations) is a not-for-profit department of the University of Cambridge and part of the Cambridge Assessment Group.,http://www.cambridgeenglish.org,http://www.facebook.com/CambridgeEnglish,https://twitter.com/CamEngHelpers,https://twitter.com/CambridgeEng,https://plus.google.com/101738960379737504463,
https://www.youtube.com/user/evilgrrrrl/about,evilgrrrrl,https://plus.google.com/115790859552012447230,
https://www.youtube.com/user/fatawesomefilms/about,fatawesome,Boston-based Sketch Comedy.  Lots of dick jokes some non-dick jokes.  Here you'll find things about video games superheros pop culture pranks and dicks.,http://www.fatawesome.com/comics,http://www.facebook.com/Fatawesome,http://twitter.com/fatawesome,http://www.fatawesome.com,https://plus.google.com/111347433950336911207,
https://www.youtube.com/user/PetShopBoysVEVO/about,PetShopBoys,http://www.vevo.com/watch/pet-shop-boys,http://www.facebook.com/petshopboys,http://www.twitter.com/petshopboys,http://www.petshopboys.co.uk,https://plus.google.com/117889052168255239522,
https://www.youtube.com/user/WorldCinemaNews/about,FilmIsNow Movie Trailers International,Welcome to FILMISNOW Trailers International Channel your first stop for the latest new cinematic trailers clips TV spots and other extras from around the world including original language dubbed and subtitled releases. Subscribe to our network which is one of YouTube's TOP 30 film & animation channels worldwide with over 60 million monthly views through our Seven channels.  Todos os últimos lançamentos de filmes incluindo trailer clipe comercial de tv e muitos outros vídeos de filmes do mundo todo.  予告編、切り抜き、テレビのスポット広告、全世界のフィルムに関するエキストラビデオなどを含む、全ての最新映画が公開されます。  모든 최신 영화의 예고편(트레일러)클립TV 스팟과 세계각국에서 영화와 관련된 다른 기타 추가 비디오를 포함한 영화 자료.  近期上映的所有电影及其所包括的预告，剪辑，广告以及附带影片均为中文版本.  Contact us for any partnership enquiries content submission or other requests at filmisnowpromo@gmail.com Contact us for any copyright issues at copyrightfilmisnow@gmail.com,http://www.youtube.com/user/filmisnow,https://play.google.com/store/apps/details?id=com.filmisnow.app,https://itunes.apple.com/us/app/filmisnow/id932439474,http://www.youtube.com/user/filmisnowEU,http://www.youtube.com/user/filmisnowEXTRA,http://www.youtube.com/user/filmisnowHD,http://www.youtube.com/user/filmisnow2,http://www.youtube.com/user/sneakpeakandfake,http://www.filmisnow.com,https://www.facebook.com/pages/FILM-is-NOW/63415488435,https://plus.google.com/112826375087833810720,
https://www.youtube.com/user/AnimalRescueVideos/about,International Animal Rescue IAR,At International Animal Rescue we do exactly what our name says - we save animals from suffering around the world. We cut free dancing bears in India rescue primates from animal smugglers in Indonesia and treat stray dogs and cats around the world. And so much more... Whenever we can we release rescued animals back into the wild. And when that's not possible we give them a safe haven for life.,http://www.internationalanimalrescue.org,https://plus.google.com/104480807324678226457,
https://www.youtube.com/user/thedogworldtv/about,thedogworldtv,dogworld.tv films at championship dog shows and special events around the UK to produce programmes which are broadcast on Horse & Country TV (Sky channel 280). Full group coverage is available at www.dogworld.tv,http://www.dogworld.tv/,https://plus.google.com/103319711220353611850,
https://www.youtube.com/user/ALDONINO2/about,A-MUSIC,AMIGAS Y AMIGOS LES COMUNICO QUE ESTE CANAL ESTA A PUNTO DE CERRAR YA QUE GOOGLE ME A ADVERTIDO DE QUE SI LLEGABA A TENER ALGUNA DENUNCIA MAS DE COPYRIRGHT ME LO CERRABA DE MANERA QUE LES RECOMIENDO  QUE SI DESEAN DESCARGAR ALGÚN VIDEO QUE UTILIZEN EL PROGRAMA aTube Catcher  con el que podrán descargar el video en cualquier formato como tambien descargar la música unicamente Espero poder abrir un nuevo canal  lo cual les avisaré a la brevedad. Gracias. :),https://plus.google.com/103502629833562983486,
https://www.youtube.com/user/foodplot/about,foodplot,Denver is the Guiltiest Dog on the Planet!  What started as a video has now erupted into a worldwide brand "Guilty Dog" and she now has her own line of plush toys children's books and soon to be announced products.  You can visit her online store at http://www.guiltydogstore.com/collections/all and also visit her outrageously funny Facebook page at www.facebook.com/guiltydog,http://www.guiltydogstore.com/collections/all,https://www.facebook.com/guiltydog,http://www.cafepress.com/guiltygear,https://plus.google.com/117761511480254616647,
https://www.youtube.com/user/CinemaNirvana/about,Cinema Nirvana,Best of English movies of different genres. Complete entertainment zone with best animation and feature films. Ring of Death Ghatotkach little zizou Charlie English are a few of the amazing collections.,http://www.nirvanadigital.com,https://twitter.com/cinemanirvana,http://cinemanirvana1.blogspot.com,http://www.youtube.com/watch?v=1a-HNKzT1lw&list=PL_hyR7wZCrT_z2Z6rWl1mS7Vo1YJ5_zCn,http://www.youtube.com/watch?v=G-Mg0MbevZM&list=PL_hyR7wZCrT__s4xinIOLsTySHUws1TeH,http://www.youtube.com/watch?v=G-Mg0MbevZM&list=PL_hyR7wZCrT-jzuxN53PTYNNDKdrLMpBq,https://plus.google.com/102989470159384995010,
https://www.youtube.com/user/lifeinaday/about,Life in a Day,https://plus.google.com/102562727051931492629,
https://www.youtube.com/user/astighey/about,Astig Hey,https://plus.google.com/114330048255910030560,
https://www.youtube.com/user/CrystalFingerboards/about,CrystalFingerboards,The username is old from when I first started it. I've turned the channel into a Super Bowl commercial channel.  Enjoy :),
https://www.youtube.com/user/1234sock/about,1234sock,www.1234.com.au,http://www.1234.com.au,https://plus.google.com/106730755065486273007,
https://www.youtube.com/user/nathanpreece/about,nathanpreece,Hello! This is Nathan from Swansea Wales UK. For more information about me search for my name in Facebook.,https://plus.google.com/117805945469205361602,
https://www.youtube.com/user/Barrie2701/about,Barrie Buckner,https://plus.google.com/113077704947087649645,
