https://www.youtube.com/user/filmisnow/about,FilmIsNow Movie Trailers,Welcome to FILMISNOW Movie Trailers Channel your first stop for the latest new cinematic trailers the moment they are released. In addition to this we also produce original cool content to give our viewers a different perspective from just the trailer.   The FILMISNOW Network is one of YouTube's TOP 30 film & animation channels worldwide. Thanks to our viewers who love movies our network generates more than 60 million monthly views through our seven channels.  Contact us for any partnership enquiries content submission or other requests at filmisnowpromo@gmail.com  Contact us for any copyright issues at copyrightfilmisnow@gmail.com,https://www.youtube.com/watch?v=kPtEPh0a0MM&list=PLSBlhbfM-l3uuACqqNTcUM812oFyF66fQ,https://play.google.com/store/apps/details?id=com.filmisnow.app,https://itunes.apple.com/us/app/filmisnow/id932439474,https://twitter.com/filmisnow,http://www.youtube.com/user/worldcinemanews,http://www.youtube.com/user/filmisnowEU,https://www.youtube.com/user/FilmIsNow2,http://www.youtube.com/user/sneakpeakandfake,http://www.youtube.com/user/filmisnowHD,https://www.youtube.com/user/filmisnowextra,https://plus.google.com/106365512709089723332,
https://www.youtube.com/user/filmisnowextra/about,FilmIsNow Movie Bloopers & Extras,Bloopers & Gag Reel Featurette Deleted & Alternative Scenes Making of & Behind the Scenes and much more!  The FILMISNOW Network is one of YouTube's TOP 30 film & animation channels worldwide. Thanks to our viewers who love movies our network generates more than 40 million monthly views through our seven channels.  New videos every day!  Official website: Http://www.filmisnow.com  Contact us at filmisnowpromo@gmail.com Contact us for any copyright issues at copyrightfilmisnow@gmail.com,http://www.youtube.com/user/filmisnow,https://itunes.apple.com/us/app/filmisnow/id932439474,https://play.google.com/store/apps/details?id=com.filmisnow.app,https://www.facebook.com/pages/FILM-is-NOW/63415488435,http://www.youtube.com/user/worldcinemanews,http://www.youtube.com/user/filmisnowEU,http://www.youtube.com/user/sneakpeakandfake,http://www.youtube.com/user/filmisnow2,http://www.youtube.com/user/filmisnowHD,http://www.filmisnow.com,https://plus.google.com/108899533391872266877,
https://www.youtube.com/user/Promise21111/about,Promise Phan,This is my second Youtube Channel well actually my 3rd  (couldn't access to my 2nd one I opened ) If you want more Promise in your life Feel free to SUBSCRIBEEE   I will be posting fun videos here   For Business & PR opportunities please email both: mngmt@ufluencers.com & Promisephan@gmail.com,https://plus.google.com/116552440388142359650,
https://www.youtube.com/user/LEGO/about,LEGO,Hello! Welcome to the home of the official LEGO® channel thanks for dropping by! We hope to inspire and develop the builders of tomorrow so come and join us and watch your favorite Minifigure characters from LEGO Elves The LEGO Movie LEGO CITY LEGO Star Wars™ LEGO Ninjago LEGO Bionicle and more come to life in exclusive webisodes and stop motion videos!   THERE ARE SO MANY FUN THINGS TO DO!! 1. Watch Playlists 2. Sort by LEGO theme 3. Subscribe for updates (click the red "Subscribe" button in the upper right of this page) 4. Make a custom Playlist (click 'video options' then 'add to playlist' on any LEGO video you like! You can add to an existing playlist or make a new one.  Be sure you're signed in!)  We've even drafted in our very clever LEGO designers and builders to let us in on some of their secrets so keep a look out for those to get some tips on how to build like a pro.  SUBSCRIBE FAVORITE LIKE and...enjoy!  See more at www.LEGO.com,https://www.facebook.com/LEGO,http://instagram.com/LEGO,http://www.pinterest.com/LEGO,http://www.lego.com,https://plus.google.com/118199612297395338408,
https://www.youtube.com/user/earthling1984/about,Earthling1984,RC Pets Offroading Electronics Fishing Camping & More!  Good videos good people good subscribers!  Join the fun!  Twitter: https://twitter.com/earthling1984  Also be sure to check out my cooking channel: EarthlingCooks,https://www.paypal.com/cgi-bin/webscr?cmd=_s-xclick&hosted_button_id=Y8DWU9L9ZDETL,https://plus.google.com/108500669533563831097,
https://www.youtube.com/user/Howcast/about,Howcast,Emphasizing high-quality instructional video production Howcast brings you leading experts and accurate reliable information on topics ranging from makeup tutorials cute hairstyles and nail art designs to soccer tricks parkour and skateboarding plus how to dougie how to kiss and much much more. Howcast empowers people with engaging useful how-to information wherever whenever they need to know how.,http://howcast.com,http://www.facebook.com/howcast,http://www.twitter.com/howcast,https://plus.google.com/108346356309721443249,
https://www.youtube.com/user/AVAsingapore/about,AVAsingapore's channel,
https://www.youtube.com/user/PETCOAnimalSupplies/about,Petco,Subscribe for your weekly pet videos on: how to train and care for your pets; your true pet stories of love joy and triumph; and our latest contests and deals at Petco.  Petco is a leading specialty retailer that focuses on nurturing the powerful relationship between people and pets. We do this by providing the products services advice and experiences that keep pets physically fit mentally alert socially engaged and emotionally happy. Everything we do is driven by the idea that together anything is possible. Visit us at www.petco.com to learn more.    We're glad you're here and invite you to comment on our videos or send us videos of you and your animal companion at Petco. Here are a few guidelines for posting so this remains a fun and safe place for everyone. YouTube Channel Moderation Policy: http://bit.ly/1hjW4Sd  Participation and interaction with Petco via social media is subject to the terms and conditions found here: http://bit.ly/UiJTMi,http://www.petco.com,https://www.facebook.com/PETCO,https://twitter.com/petco,
https://www.youtube.com/user/kbsworld/about,KBS World TV,KBS World is a television channel for international audiences provided by the Korean Broadcasting System (KBS). It's your premier window on Korean contents with a nonstop 24-hour a day 7-day a week stream of Korea's latest and most popular programs.,http://www.kbsworld.co.kr,http://www.twitter.com/kbsworldtv,http://www.facebook.com/kbsworld,http://plus.kakao.com/friend/@kbs_world,http://instagram.com/kbsworldtv,http://kbsworld.tumblr.com/,https://plus.google.com/104963191499169217814,
https://www.youtube.com/user/Mickeyjuice/about,Mickeyjuice,https://plus.google.com/115588569436817133037,
https://www.youtube.com/user/movieclipsTRAILERS/about,Movieclips Trailers,Welcome! The Fandango MOVIECLIPS Trailers channel is your destination for hot new trailers the second they drop. The Fandango MOVIECLIPS Trailers team is here day and night to make sure all the hottest new movie trailers are available whenever you want them.  In addition to hot new trailers we give you original content like Ultimate Trailers Instant Trailer Reviews Monthly Mashups Awards Show Coverage and so much more to keep you up-to-date on what's new and what you should be watching.  Looking for more awesome movie content? Check out our other channels in the links below!,https://www.youtube.com/movieclips,http://movieclips.com,http://www.facebook.com/movieclips,https://twitter.com/MOVIECLIPS,http://instagram.com/movieclips,http://pinterest.com/movieclips,https://www.snapchat.com/add/fandango,https://www.youtube.com/user/FandangoMovies,https://www.youtube.com/user/oldhollywoodtrailers,https://www.youtube.com/user/FilmFestivalVideos,
https://www.youtube.com/user/TimeToPlayMag/about,TTPM Toy Reviews,TTPM is a family-friendly toy review channel where you’ll find all the videos featured on TTPM.com. TTPM provides comprehensive independent objective reviews of toys by our team of experienced toy reviewers. Plus we help you shop finding the lowest prices and availability at leading retailers with just one click. Our videos and reviews help you make informed decisions about the toys you and your kids are looking for—Hot Wheels Barbie Monster High Ever After High NERF Transformers Play-Doh LEGO Shopkins Tsum Tsum and from all major movies and TV shows from Disney Universal Warner Bros. Nickelodeon Cartoon Network and more. Come play with us and discover all the toys you’ll want when your kids say “play with me!”,http://www.ttpm.com,https://www.facebook.com/TTPMofficial,https://twitter.com/ttpm,http://pinterest.com/TTPMofficial,http://instagram.com/TTPMofficial,https://www.snapchat.com/add/ttpmofficial,https://plus.google.com/101831201199518351896,
https://www.youtube.com/user/Ma7amed/about,Mohamed Mostafa,https://plus.google.com/104506290612197350000,
https://www.youtube.com/user/TheSims/about,The Sims,This is the Official YouTube channel for The Sims™ where videos and Live Broadcasts created by Electronic Arts' (EA) Maxis Label are featured and released on behalf of The Sims franchise. The Official YouTube channel for The Sims also features player-created videos and content from The Sims' community of players from around the world. For more information about The Sims visit www.thesims.com,http://www.thesims.com,http://www.facebook.com/thesims,http://www.twitter.com/thesims,http://help.ea.com/the-sims/the-sims-4/,https://plus.google.com/113155661231449639608,
https://www.youtube.com/user/Vsauce2/about,Vsauce2,Subscribe for Mind-Blowing Science Technology & People.   Vsauce2 launched in December 2010 and is run by Kevin Lieber  Vsauce is... Michael Stevens: Producer/Host of Vsauce1 Kevin Lieber: Producer/Host of Vsauce2 Jake Roper: Producer/Host of Vsauce3 Eric Langlay: VFX for Vsauce1/2/3 Hannah Canetti: Writer/Editor of D.O.N.G. Alisha Garza: Coordinator You: Thanks for watching!,http://curiositybox.com,https://twitter.com/VsauceTwo,https://www.instagram.com/kevlieber/,https://www.facebook.com/VsauceTwo,https://plus.google.com/100225227491323248537,
https://www.youtube.com/user/petshopboys/about,Pet Shop Boys,This is the official YouTube channel of Pet Shop Boys. On this channel you will find all of the official video content from Pet Shop Boys including music videos single playlists album playlists live show footage and more.  Subscribe here http://smarturl.it/petshopboysyoutube Website http://smarturl.it/petshopboyswebsite  Pre Order the forthcoming album 'Super'; Download http://smarturl.it/petshopboyssuperdl CD http://smarturl.it/petshopboyssupercd Vinyl http://smarturl.it/petshopboyssuperlp  Follow the Super playlist on Spotify http://smarturl.it/petshopboyssuperpl  Follow the Super album playlist on Youtube http://smarturl.it/petshopboyssuperytpl  Follow Pet Shop Boys Facebook http://smarturl.it/petshopboysfacebook Twitter http://smarturl.it/petshopboystwitter Youtube http://smarturl.it/petshopboysyoutube Spotify http://smarturl.it/petshopboysspotify Instagram http://smarturl.it/petshopboysinsta  www.petshopboys.co.uk,http://www.petshopboys.co.uk,https://twitter.com/petshopboys,http://www.facebook.com/petshopboys,https://www.instagram.com/petshopboys/,https://plus.google.com/103586251140494698613,
https://www.youtube.com/user/wyfftv/about,WYFF News 4,WYFF4.com is your top source for Live Local Breaking News in Upstate South Carolina and Western North Carolina. Look to WYFF4.com for breaking news community news weather politics and viral videos.,http://www.wyff4.com/news,http://www.wyff4.com/weather,http://www.wyff4.com/emailnewsletters/,http://www.wyff4.com/sports,http://www.wyff4.com,https://plus.google.com/109881930823523156214,
https://www.youtube.com/user/PetAirways/about,Pet Airways,You see on Pet Airways your pets aren't packages they're Pawsengers.™ And every step of the journey we'll take care of them as if they were our own. While Zoe passed on in June 2010 she will forever be the wind beneath our wings. Now from heaven she'll have the best view of all our flying Pawsengers.™,http://www.petairways.com,https://www.facebook.com/petairways/,https://twitter.com/PetAirways,http://www.instagram.com/petairways,
https://www.youtube.com/user/ABCNews/about,ABC News,Make ABC News your daily news outlet for breaking national and world news broadcast video coverage and exclusive interviews that will help you stay up to date on the events shaping our world. ABC News’ show roster has both leaders in daily evening and morning programming. Kick start your weekday mornings with news updates from Good Morning America (GMA) and Sundays with This Week with George Stephanopoulos. Get your evening fix with 20/20 Nightline and ABC World News Tonight with David Muir. Head to abc.go.com for programming schedule and more information on ABC News.,http://ABCNews.com,http://twitter.com/ABC,http://fb.me/ABCNews,https://www.instagram.com/abcnews/,http://fb.me/WorldNews,http://twitter.com/ABCWorldNews,http://fb.me/ABCWorldNewsNow,http://twitter.com/abcWNN,http://fb.me/ABCNewsNightline,http://twitter.com/Nightline,http://fb.me/GoodMorningAmerica,http://twitter.com/GMA,http://fb.me/ABC2020,http://twitter.com/abc2020,https://plus.google.com/108686021205441482363,
https://www.youtube.com/user/EnglishTeacherEmma/about,Learn English with Emma [engVid],Hi my name is Emma and I'm going to teach you English! Learning a different language can be hard but it can also be a fun and rewarding experience.  I am TESOL-certified and have taught students from various backgrounds ages and levels. From immigrants to international students private lessons to classrooms my experiences have been varied and have allowed me to gain insight into the challenges that ESL students face.  Teaching is one of those great professions that allow you to be forever learning. While I teach students both French and English they teach me about their cultures their lives and other ways to see the world. It is a privilege to teach and I am thankful for all of my students over the years who have shared their stories interests and dreams with me.,http://www.engvid.com/,http://www.facebook.com/learn.english.free,https://twitter.com/engVid,https://vk.com/engvid,http://www.youtube.com/subscription_center?add_user=EnglishTeacherEmma,https://plus.google.com/111319494083097928897,
https://www.youtube.com/user/AnimalistNetwork/about,Animalist,Animalist is your destination for all things animal on the web. From the exotic to the domestic from the cute to the weird we cover the whole animal kingdom. We have breaking animal news stories and funny animal sketches. And yes we have cat videos--lots and lots of cat videos. Start with Animalist News our daily news show with hilarious hosts Alex Farnham and Catie Wayne and new episode of Weird Gross Beautiful with Catie Wayne every Wednesday. Then make sure you check out all our other Animalist shows like Best Breed Ever! Pudge It Yourself Big Cat Rescue Lil BUB's Big SHOW Cat Mojo With Jackson Galaxy Petsami and more!  Our full lineup of programming can be found at Animalist.com a Discovery Digital Network.,http://animalist.com/,https://www.facebook.com/AnimalistNetwork,https://twitter.com/animalists,http://instagram.com/animalists,http://www.pinterest.com/animalists/,https://plus.google.com/102315756768159443827,
https://www.youtube.com/user/NCNatureNews/about,GoHerping,I'm Alex and I make videos on the coolest living things on Earth: Reptiles & amphibians.  SEE MY CAMERA GEAR & REPTILE SUPPLIES: https://kit.com/GoHerping  SEE MORE: http://goherping.com  “If we can teach people about wildlife they will be touched. Because humans want to save things that they love" -Steve Irwin (1962-2006)  F.A.Q.  Q. Wait you can drive? You're like 14. A. ...Close enough.  Q. How many animals do you have? A. 5 snakes 2 lizards 2 turtles 6 toads.  Q. Sub or shoutout pls? A. No go away lol,http://www.goherping.com,http://instagram.com/go_herping,http://twitter.com/goherping,https://plus.google.com/110168645182833846539,
https://www.youtube.com/user/AllRamonesMusic/about,Ramones Music,-High Quality MP3 Music -Full Album Artwork -Includes lyrics -New videos uploaded regularly  -Includes live and unreleased tracks  The Ramones formed in Queens New York in 1974 kicking off the first wave of punk music. The band has been credited as one of the most influential rock bands of all time.   Every Ramones song that has ever existed will be uploaded to this channel. To find a Ramones song you wish to listen to just type the name of the song into the search box by the video scroller and hit "Search".  FACEBOOK: Like us on Facebook for your chance to win Ramones Collectibles! https://www.facebook.com/allramonesmusic    Ramones:,https://www.facebook.com/RamonesMusic,
https://www.youtube.com/user/CNN/about,CNN,CNN operates as a division of Turner Broadcasting System which is a subsidiary of Time Warner. CNN identifies itself as -- and is widely known to be - the most trusted source for news and information. The CNN umbrella includes nine cable and satellite television networks two radio networks the CNN Digital Network which is the top network of news Web sites in the United States and CNN Newsource the world's most extensively syndicated news service. CNN is proud of our ability to bring you up-to-the-minute news from around the world as a result of our many extensions.,http://www.cnn.com/,http://facebook.com/cnn,http://twitter.com/cnnbrk,http://edition.cnn.com/,
https://www.youtube.com/user/racheldoesstuff/about,racheldoesstuff,My comedy videos!,http://racheldoesstuff.com,https://plus.google.com/112439007770428816158,
https://www.youtube.com/user/MagicPetsSongs4Kids/about,Morphle TV,Hi! I'm Mila and I have a magic pet called Morphle. He can morph into anything I want him to! Together we have all sorts of adventures.  Copyright © 2011 My Magic Pet Morphle™ is YouTube original kids series created by Morphle TV™ ALL RIGHTS RESERVED.,http://www.mymagicpetmorphle.com/,https://www.facebook.com/morphle,https://plus.google.com/105521330618463708527,
https://www.youtube.com/user/BuzzFeedVideo/about,BuzzFeedVideo,BuzzFeed Motion Picture’s flagship channel. Sometimes funny sometimes serious always shareable. New videos posted daily!,http://bzfd.it/2cphJeo,https://www.facebook.com/BuzzFeedVideo,http://twitter.com/buzzfeedvideo,http://www.buzzfeed.com/,https://www.youtube.com/playlist?list=PL5vtqDuUM1DmODGWPy7-eEn3VjJALGApT,https://plus.google.com/116847826345074596313,
https://www.youtube.com/user/xchomperoviskera/about,xchomperoviskera,
https://www.youtube.com/user/Shadowblood66/about,Bart Coppens,Welcome to my channel. I am Bart Coppens and I have a passion for insects.  I like rearing many kinds of species. Butterflies and moths are my favorites (Lepidoptera) while I also keep stick insects mantids beetles and more.  Most of my videos feature insects. Take a look at my Flickr too if you are interested!,http://breedingbutterflies.com/,https://www.facebook.com/bart.coppens.94,https://www.flickr.com/photos/75668720@N05/sets/72157631693426819/,https://plus.google.com/101038520402485805918,
https://www.youtube.com/user/WildlifeBernie/about,WildlifeBernie,I'm a wildlife educator with common exotic animals and one Canada Lynx. All are ambassadors educating the public. I possess a federal and state license to exhibit and educate with these animals. My videos are either training videos with Max in the beginning or just fun videos of my animals. Please understand that Max is comfortable on a leash. It allows me the opportunity to bring him out of his exhibit cage during educational presentations. This is a safe way for him to receive enrichment on our property.    I often hear "wild animals belong in the wild." What happens when there is no "wild" left? When the wild is gone there are two options: captivity or extinction. Education is the key to our species survival and the protection of our environment  Just to be clear my lynx is captive bred and can never be released into the wild.  Also please be aware that ALL comments are moderated. Clean comments please.,http://www.wildlifeeducationbybernie.wordpress.com,https://plus.google.com/101821880084156500321,
https://www.youtube.com/user/HowcastArtsRec/about,HowcastArtsRec,Need a hobby? Take your pick of old pastimes and new sidelines with our how-to's covering everything you've ever thought of filling your free time with. You'll never be bored again! Howcast empowers people with engaging useful how-to information wherever whenever they need to know how.,http://howcast.com,https://plus.google.com/118242415288326494545,
https://www.youtube.com/user/alexxwassabi/about,Alex Wassabi,If you're not smiling you're doing it wrong :),https://instagram.com/AlexWassabi,https://twitter.com/AlexWassabi,https://plus.google.com/109658048886620037588,
https://www.youtube.com/user/klaatu42/about,Talking Animals,Your one stop shop for furry things that talk!,http://talkinganimalmerch.com,http://twitter.com/talkinganimals,https://www.facebook.com/pages/Talking-Animals/119667514742928,http://klaatufilms.com/submit,https://plus.google.com/113853287412245300266,
https://www.youtube.com/user/geektofreakfitness/about,Freak World,Welcome to Freak World   This channel use to be my life vlog known as "Geek To Freak Fitness & Lawn Care"  If you are a Super Fan of Toy Freaks & Freak Family Vlogs then this is where you will find even more videos from Freak Daddy Victoria & Annabelle. All the videos on Freak World will feature Freak Daddy in them.   We Love you Freaks! :),https://instagram.com/toy_freaks/,https://plus.google.com/105927330269672814236,
https://www.youtube.com/user/NoahJ456/about,NoahJ456,NoahJ456 is a gaming YouTuber who loves video games and does daily livestreams of gameplay videos! #Broahs,http://www.twitter.com/noahj456,https://www.instagram.com/NoahJ456,http://www.twitch.tv/NoahJ456,https://www.facebook.com/noahj456,http://www.NoahJ456Shop.com,https://plus.google.com/101191241596299870026,
https://www.youtube.com/user/Anmlwndrs/about,AnimalWonders Montana,Animal Wonders on YouTube shows our animals being amazing and also shares behind the scenes footage of what it's like to care for 80+ exotic animals and share education locally and on the internet.,http://www.animalwonders.org,https://www.facebook.com/pages/Animal-Wonders-Inc/313837820385,http://animalwondersmontana.tumblr.com/,http://www.patreon.com/animalwonders,https://plus.google.com/118383268913071334592,
https://www.youtube.com/user/BestCompilationVine/about,BestVine,- Email your vines to realbestvine@gmail.com,https://www.facebook.com/RealBestVine,http://twitter.com/RealBestVine,https://www.youtube.com/channel/UCztVhjYQ-z1HCoEbIQLz7lg,https://plus.google.com/117109580424007016578,
https://www.youtube.com/user/RatBetcha/about,RatBetcha,
https://www.youtube.com/user/TotalHalibut/about,TotalBiscuit The Cynical Brit,YouTube's #1 PC gaming critic. Sick of game reviews? Watch lengthy first impressions gameplay with honest and informative commentary. Get an idea about what you're getting into before you spend your money with "WTF is.." YouTube's most popular first impressions gaming series  MEDIA/DEVELOPER & PUBLISHER INQUIRIES: pr[at]cynicalbrit.com  WARNING: ONLY SEND KEYS TO THE LISTED EMAIL ADDRESSES. SEVERAL PEOPLE HAVE ATTEMPTED TO SCAM KEYS WITH SPOOFED ADDRESSES.  The channel does not take requests.  System Specs:  CPU: Intel Core i7-5930K @ 4.0ghz. RAM: Corsair Vengeance LPX 16GB DDR4-2800 BOARD: ASUS Rampage V Extreme COOLER: Corsair H110i GPU: 2x Nvidia Geforce GTX 1080 SSDs: 3x Sandisk Extreme Pro 480gb 1x Samsung 950 PCI-E SSD. OS: Windows 7 x64 Ultimate. DISPLAY: Asus ROG SWIFT PG278Q 1440p 144hz G-sync monitor.  Capture: DXTory/FRAPs Microphone: EV RE20 Audio interface: RME Babyface.,http://twitch.tv/totalbiscuit,http://twitter.com/totalbiscuit,http://facebook.com/cynicalbrit,https://soundcloud.com/totalbiscuit,http://twitter.com/cynicalbrit,http://www.youtube.com/show/contentpatch,http://www.youtube.com/show/wtfis,http://store.steampowered.com/curator/1370293/,https://chrono.gg/tb,https://plus.google.com/116829913155105385874,
https://www.youtube.com/user/Filme/about,KinoCheck International,Hot new movie trailer news and reviews in highest quality on a daily basis! KinoCheck is Germany’s largest movie-entertainment channel. Whether blockbusters like Star Wars 8 Assassin's Creed Movie Baywatch Despicable Me 3 Fast and Furious 8 Wonder Woman Justice League or indie movie trailers — we’ve got them all. In addition we create original content like reviews mashups and contest so you’ll always be up to date on the really good movies!  Don’t miss to visit our brand-new website https://KinoCheck.de  KinoCheck is a project of some.marketing GmbH & Co. KG,https://KinoCheck.de,http://www.youtube.com/user/KinoCheck?sub_confirmation=1&app=desktop&annotation_id=annotation_2697786943,http://facebook.com/KinoCheck,http://twitter.com/KinoCheck,https://instagram.com/KinoCheck,https://KinoCheck.de/filmstarts,https://KinoCheck.de/kritiken,https://kinocheck.de/impressum,http://KinoCheck.me/Teilnahmebedingungen,https://plus.google.com/102051903913360590615,
https://www.youtube.com/user/PetsAddLife/about,Pets Add Life,Pets Add Life (PAL) is a non-profit PSA campaign dedicated to promoting the joys and benefits of responsible pet ownership.   Pets need a pal to talk to. Get a pal for your pet.  Check out our Spanish channel at https://www.youtube.com/PetsAddLifeSpanish,http://www.petsaddlife.org,http://www.twitter.com/petsaddlife,http://www.facebook.com/petsaddlife,http://petsaddlife.wordpress.com/,https://plus.google.com/113005259788487522589,
